<?xml version="1.0" encoding="UTF-8"?>
<!DOCTYPE xml [<!ENTITY shy "&#173;">]>
<preprocessedreport xmlns:addi="http://www.untermstrich.com/web/addi/">
    <head>
        <title id="b_timekeyword" format="A4" orientation="landscape">Zeitraum / Stichwort</title>
        <date type="date" timezoneshort="CET" unix="-2208992400" usdate="" ustime="" xlsdate="1900-01-01T00:00:00.000">Mon, 01 Jan 1900 00:00:00 +0100</date>
        <company>
            <line1 type="text">Endreß Ingenieurgesellschaft mbH Brandschutzsachverständige</line1>
            <line2 type="text">Siemensstraße 6</line2>
            <line3 type="text">61352 Bad Homburg v.d. Höhe</line3>
        </company>
        <columns>
            <total>
                <field name="number" type="number" width="13">Gesamtsumme</field>
            </total>
            <group by="staff_name" order="TRUE">
                <field name="staff_name" type="string" width="25">Mitarbeiter</field>
                <field name="work_package_name" type="string" width="40">Bereich</field>
                <field name="date" type="date" width="20">Datum</field>
                <field name="time_from" type="time" width="15">Von</field>
                <field name="time_to" type="time" width="15">Bis</field>
                <field name="number" type="number" width="17">Summe</field>
                <field name="project" type="string" width="50">Projekt</field>
                <field name="purpose" type="string" width="60">Leistung</field>
                <field name="is_client_changed" type="bool" width="5">Kunden&shy;änderung</field>
                <field name="purpose_internal" type="string" width="15">Bürointerne Informationen</field>
                <total>
                    <field name="number" type="number" width="13">Mitarbeitersumme</field>
                </total>
            </group>
        </columns>
        <filters>
            <filter name="print_user" title="C. Trapp SV">C. Trapp SV</filter>
            <filter name="print_date" title="03.11.2025">03.11.2025</filter>
            <filter name="print_datetime" title="03.11.2025 23:05">03.11.2025 23:05</filter>
            <filter name="print_serial" title="W049-A100-S75791">W049-A100-S75791</filter>
            <filter name="print_serial1" title="Endreß Ingenieurgesellschaft mbH Brandschutzsachverständige">Endreß Ingenieurgesellschaft mbH Brandschutzsachverständige</filter>
            <filter name="print_serial2" title="Siemensstraße 6">Siemensstraße 6</filter>
            <filter name="print_serial3" title="61352 Bad Homburg v.d. Höhe">61352 Bad Homburg v.d. Höhe</filter>
            <filter name="print_user" title="C. Trapp SV">C. Trapp SV</filter>
            <filter name="print_date" title="03.11.2025">03.11.2025</filter>
            <filter name="print_datetime" title="03.11.2025 23:05">03.11.2025 23:05</filter>
            <filter name="print_serial" title="W049-A100-S75791">W049-A100-S75791</filter>
            <filter name="print_serial1" title="Endreß Ingenieurgesellschaft mbH Brandschutzsachverständige">Endreß Ingenieurgesellschaft mbH Brandschutzsachverständige</filter>
            <filter name="print_serial2" title="Siemensstraße 6">Siemensstraße 6</filter>
            <filter name="print_serial3" title="61352 Bad Homburg v.d. Höhe">61352 Bad Homburg v.d. Höhe</filter>
            <filter name="date" title="Von">01.07.2025 - 30.09.2025</filter>
            <filter name="staff__staff_group" title="Mitarbeitergruppe">LUD</filter>
        </filters>
    </head>
    <data>
        <grouped by="staff_name" level="0">
            <values for="A. Kokott">
                <row>
                    <cell name="staff_name" type="text">A. Kokott</cell>
                    <cell name="work_package_name" type="text">Angebote-Ausschreibungen-Kalkulationen (max. 8h/Monat pro MA)</cell>
                    <cell name="date" type="date" timezoneshort="CEST" unix="1751320800" usdate="01.07.2025" ustime="00:00" xlsdate="2025-07-01T00:00:00.000">Tue, 01 Jul 2025 00:00:00 +0200</cell>
                    <cell name="time_from" type="time" timezoneshort="CET" ustime="12:00" xlsdate="1900-01-10T12:00:00.000">Wed, 10 Jan 1900 12:00:00 +0100</cell>
                    <cell name="time_to" type="time" timezoneshort="CET" ustime="13:00" xlsdate="1900-01-10T13:00:00.000">Wed, 10 Jan 1900 13:00:00 +0100</cell>
                    <cell name="number" type="number" usnumber="1,00">1</cell>
                    <cell name="project" type="text">0000 Sonderprojekt für Bonus</cell>
                    <cell name="purpose" type="text"></cell>
                    <cell name="is_client_changed" type="bool">false</cell>
                    <cell name="purpose_internal" type="text"></cell>
                </row>
                <row>
                    <cell name="staff_name" type="text">A. Kokott</cell>
                    <cell name="work_package_name" type="text">SV</cell>
                    <cell name="date" type="date" timezoneshort="CEST" unix="1751320800" usdate="01.07.2025" ustime="00:00" xlsdate="2025-07-01T00:00:00.000">Tue, 01 Jul 2025 00:00:00 +0200</cell>
                    <cell name="time_from" type="time" timezoneshort="CET" ustime="11:30" xlsdate="1900-01-10T11:30:00.000">Wed, 10 Jan 1900 11:30:00 +0100</cell>
                    <cell name="time_to" type="time" timezoneshort="CET" ustime="12:00" xlsdate="1900-01-10T12:00:00.000">Wed, 10 Jan 1900 12:00:00 +0100</cell>
                    <cell name="number" type="number" usnumber="0,50">0.5</cell>
                    <cell name="project" type="text">7090.01 Baupionier-BSK-Garagenpark-Eckersmühlen</cell>
                    <cell name="purpose" type="text">QS und Versand  BSK</cell>
                    <cell name="is_client_changed" type="bool">false</cell>
                    <cell name="purpose_internal" type="text"></cell>
                </row>
                <row>
                    <cell name="staff_name" type="text">A. Kokott</cell>
                    <cell name="work_package_name" type="text">3100-Erarbeiten des Brandschutzkonzept/Nachweis/Stellungnahme</cell>
                    <cell name="date" type="date" timezoneshort="CEST" unix="1751320800" usdate="01.07.2025" ustime="00:00" xlsdate="2025-07-01T00:00:00.000">Tue, 01 Jul 2025 00:00:00 +0200</cell>
                    <cell name="time_from" type="time" timezoneshort="CET" ustime="11:00" xlsdate="1900-01-10T11:00:00.000">Wed, 10 Jan 1900 11:00:00 +0100</cell>
                    <cell name="time_to" type="time" timezoneshort="CET" ustime="11:30" xlsdate="1900-01-10T11:30:00.000">Wed, 10 Jan 1900 11:30:00 +0100</cell>
                    <cell name="number" type="number" usnumber="0,50">0.5</cell>
                    <cell name="project" type="text">5607.05 BAB-NB-J4-Zentralinstitut-für-seelische-Gesundheit-Mannheim</cell>
                    <cell name="purpose" type="text">QS und Versand BSK Alamierung.</cell>
                    <cell name="is_client_changed" type="bool">false</cell>
                    <cell name="purpose_internal" type="text"></cell>
                </row>
                <row>
                    <cell name="staff_name" type="text">A. Kokott</cell>
                    <cell name="work_package_name" type="text">Einarbeitung neuer Mitarbeiter (max. 8h/Monat pro MA)</cell>
                    <cell name="date" type="date" timezoneshort="CEST" unix="1751320800" usdate="01.07.2025" ustime="00:00" xlsdate="2025-07-01T00:00:00.000">Tue, 01 Jul 2025 00:00:00 +0200</cell>
                    <cell name="time_from" type="time" timezoneshort="CET" ustime="09:00" xlsdate="1900-01-10T09:00:00.000">Wed, 10 Jan 1900 09:00:00 +0100</cell>
                    <cell name="time_to" type="time" timezoneshort="CET" ustime="11:00" xlsdate="1900-01-10T11:00:00.000">Wed, 10 Jan 1900 11:00:00 +0100</cell>
                    <cell name="number" type="number" usnumber="2,00">2</cell>
                    <cell name="project" type="text">0000 Sonderprojekt für Bonus</cell>
                    <cell name="purpose" type="text">Einarbeitung Jessica Mösinger</cell>
                    <cell name="is_client_changed" type="bool">false</cell>
                    <cell name="purpose_internal" type="text"></cell>
                </row>
                <row>
                    <cell name="staff_name" type="text">A. Kokott</cell>
                    <cell name="work_package_name" type="text">Angebote-Ausschreibungen-Kalkulationen (max. 8h/Monat pro MA)</cell>
                    <cell name="date" type="date" timezoneshort="CEST" unix="1751407200" usdate="02.07.2025" ustime="00:00" xlsdate="2025-07-02T00:00:00.000">Wed, 02 Jul 2025 00:00:00 +0200</cell>
                    <cell name="time_from" type="time" timezoneshort="CET" ustime="11:00" xlsdate="1900-01-10T11:00:00.000">Wed, 10 Jan 1900 11:00:00 +0100</cell>
                    <cell name="time_to" type="time" timezoneshort="CET" ustime="13:00" xlsdate="1900-01-10T13:00:00.000">Wed, 10 Jan 1900 13:00:00 +0100</cell>
                    <cell name="number" type="number" usnumber="2,00">2</cell>
                    <cell name="project" type="text">0000 Sonderprojekt für Bonus</cell>
                    <cell name="purpose" type="text"></cell>
                    <cell name="is_client_changed" type="bool">false</cell>
                    <cell name="purpose_internal" type="text"></cell>
                </row>
                <row>
                    <cell name="staff_name" type="text">A. Kokott</cell>
                    <cell name="work_package_name" type="text">ADM</cell>
                    <cell name="date" type="date" timezoneshort="CEST" unix="1751407200" usdate="02.07.2025" ustime="00:00" xlsdate="2025-07-02T00:00:00.000">Wed, 02 Jul 2025 00:00:00 +0200</cell>
                    <cell name="time_from" type="time" timezoneshort="CET" ustime="10:30" xlsdate="1900-01-10T10:30:00.000">Wed, 10 Jan 1900 10:30:00 +0100</cell>
                    <cell name="time_to" type="time" timezoneshort="CET" ustime="10:45" xlsdate="1900-01-10T10:45:00.000">Wed, 10 Jan 1900 10:45:00 +0100</cell>
                    <cell name="number" type="number" usnumber="0,25">0.25</cell>
                    <cell name="project" type="text">7090.01 Baupionier-BSK-Garagenpark-Eckersmühlen</cell>
                    <cell name="purpose" type="text">QS</cell>
                    <cell name="is_client_changed" type="bool">false</cell>
                    <cell name="purpose_internal" type="text"></cell>
                </row>
                <row>
                    <cell name="staff_name" type="text">A. Kokott</cell>
                    <cell name="work_package_name" type="text">Angebote-Ausschreibungen-Kalkulationen (max. 8h/Monat pro MA)</cell>
                    <cell name="date" type="date" timezoneshort="CEST" unix="1751407200" usdate="02.07.2025" ustime="00:00" xlsdate="2025-07-02T00:00:00.000">Wed, 02 Jul 2025 00:00:00 +0200</cell>
                    <cell name="time_from" type="time" timezoneshort="CET" ustime="09:00" xlsdate="1900-01-10T09:00:00.000">Wed, 10 Jan 1900 09:00:00 +0100</cell>
                    <cell name="time_to" type="time" timezoneshort="CET" ustime="10:30" xlsdate="1900-01-10T10:30:00.000">Wed, 10 Jan 1900 10:30:00 +0100</cell>
                    <cell name="number" type="number" usnumber="1,50">1.5</cell>
                    <cell name="project" type="text">0000 Sonderprojekt für Bonus</cell>
                    <cell name="purpose" type="text"></cell>
                    <cell name="is_client_changed" type="bool">false</cell>
                    <cell name="purpose_internal" type="text"></cell>
                </row>
                <row>
                    <cell name="staff_name" type="text">A. Kokott</cell>
                    <cell name="work_package_name" type="text">Einarbeitung neuer Mitarbeiter (max. 8h/Monat pro MA)</cell>
                    <cell name="date" type="date" timezoneshort="CEST" unix="1751407200" usdate="02.07.2025" ustime="00:00" xlsdate="2025-07-02T00:00:00.000">Wed, 02 Jul 2025 00:00:00 +0200</cell>
                    <cell name="time_from" type="time" timezoneshort="CET" ustime="08:00" xlsdate="1900-01-10T08:00:00.000">Wed, 10 Jan 1900 08:00:00 +0100</cell>
                    <cell name="time_to" type="time" timezoneshort="CET" ustime="09:00" xlsdate="1900-01-10T09:00:00.000">Wed, 10 Jan 1900 09:00:00 +0100</cell>
                    <cell name="number" type="number" usnumber="1,00">1</cell>
                    <cell name="project" type="text">0000 Sonderprojekt für Bonus</cell>
                    <cell name="purpose" type="text">Einarbeitung Jessica Mösinger und Fabienne David</cell>
                    <cell name="is_client_changed" type="bool">false</cell>
                    <cell name="purpose_internal" type="text"></cell>
                </row>
                <row>
                    <cell name="staff_name" type="text">A. Kokott</cell>
                    <cell name="work_package_name" type="text">Einarbeitung neuer Mitarbeiter (max. 8h/Monat pro MA)</cell>
                    <cell name="date" type="date" timezoneshort="CEST" unix="1751493600" usdate="03.07.2025" ustime="00:00" xlsdate="2025-07-03T00:00:00.000">Thu, 03 Jul 2025 00:00:00 +0200</cell>
                    <cell name="time_from" type="time" timezoneshort="CET" ustime="13:00" xlsdate="1900-01-10T13:00:00.000">Wed, 10 Jan 1900 13:00:00 +0100</cell>
                    <cell name="time_to" type="time" timezoneshort="CET" ustime="14:00" xlsdate="1900-01-10T14:00:00.000">Wed, 10 Jan 1900 14:00:00 +0100</cell>
                    <cell name="number" type="number" usnumber="1,00">1</cell>
                    <cell name="project" type="text">0000 Sonderprojekt für Bonus</cell>
                    <cell name="purpose" type="text">Einarbeitung Jessica und Fabienne   in ANG</cell>
                    <cell name="is_client_changed" type="bool">false</cell>
                    <cell name="purpose_internal" type="text"></cell>
                </row>
                <row>
                    <cell name="staff_name" type="text">A. Kokott</cell>
                    <cell name="work_package_name" type="text">Angebote-Ausschreibungen-Kalkulationen (max. 8h/Monat pro MA)</cell>
                    <cell name="date" type="date" timezoneshort="CEST" unix="1751493600" usdate="03.07.2025" ustime="00:00" xlsdate="2025-07-03T00:00:00.000">Thu, 03 Jul 2025 00:00:00 +0200</cell>
                    <cell name="time_from" type="time" timezoneshort="CET" ustime="11:00" xlsdate="1900-01-10T11:00:00.000">Wed, 10 Jan 1900 11:00:00 +0100</cell>
                    <cell name="time_to" type="time" timezoneshort="CET" ustime="12:30" xlsdate="1900-01-10T12:30:00.000">Wed, 10 Jan 1900 12:30:00 +0100</cell>
                    <cell name="number" type="number" usnumber="1,50">1.5</cell>
                    <cell name="project" type="text">0000 Sonderprojekt für Bonus</cell>
                    <cell name="purpose" type="text"></cell>
                    <cell name="is_client_changed" type="bool">false</cell>
                    <cell name="purpose_internal" type="text"></cell>
                </row>
                <row>
                    <cell name="staff_name" type="text">A. Kokott</cell>
                    <cell name="work_package_name" type="text">Einarbeitung neuer Mitarbeiter (max. 8h/Monat pro MA)</cell>
                    <cell name="date" type="date" timezoneshort="CEST" unix="1751493600" usdate="03.07.2025" ustime="00:00" xlsdate="2025-07-03T00:00:00.000">Thu, 03 Jul 2025 00:00:00 +0200</cell>
                    <cell name="time_from" type="time" timezoneshort="CET" ustime="09:00" xlsdate="1900-01-10T09:00:00.000">Wed, 10 Jan 1900 09:00:00 +0100</cell>
                    <cell name="time_to" type="time" timezoneshort="CET" ustime="11:00" xlsdate="1900-01-10T11:00:00.000">Wed, 10 Jan 1900 11:00:00 +0100</cell>
                    <cell name="number" type="number" usnumber="2,00">2</cell>
                    <cell name="project" type="text">0000 Sonderprojekt für Bonus</cell>
                    <cell name="purpose" type="text">Einarbeitung Jessica und Fabienne</cell>
                    <cell name="is_client_changed" type="bool">false</cell>
                    <cell name="purpose_internal" type="text"></cell>
                </row>
                <row>
                    <cell name="staff_name" type="text">A. Kokott</cell>
                    <cell name="work_package_name" type="text">ADM</cell>
                    <cell name="date" type="date" timezoneshort="CEST" unix="1751493600" usdate="03.07.2025" ustime="00:00" xlsdate="2025-07-03T00:00:00.000">Thu, 03 Jul 2025 00:00:00 +0200</cell>
                    <cell name="time_from" type="time" timezoneshort="CET" ustime="08:30" xlsdate="1900-01-10T08:30:00.000">Wed, 10 Jan 1900 08:30:00 +0100</cell>
                    <cell name="time_to" type="time" timezoneshort="CET" ustime="09:00" xlsdate="1900-01-10T09:00:00.000">Wed, 10 Jan 1900 09:00:00 +0100</cell>
                    <cell name="number" type="number" usnumber="0,50">0.5</cell>
                    <cell name="project" type="text">7441 Baupionier-Garagenpark-Öhringen-BSK</cell>
                    <cell name="purpose" type="text">Projektmanagment</cell>
                    <cell name="is_client_changed" type="bool">false</cell>
                    <cell name="purpose_internal" type="text"></cell>
                </row>
                <row>
                    <cell name="staff_name" type="text">A. Kokott</cell>
                    <cell name="work_package_name" type="text">ADM</cell>
                    <cell name="date" type="date" timezoneshort="CEST" unix="1751493600" usdate="03.07.2025" ustime="00:00" xlsdate="2025-07-03T00:00:00.000">Thu, 03 Jul 2025 00:00:00 +0200</cell>
                    <cell name="time_from" type="time" timezoneshort="CET" ustime="08:00" xlsdate="1900-01-10T08:00:00.000">Wed, 10 Jan 1900 08:00:00 +0100</cell>
                    <cell name="time_to" type="time" timezoneshort="CET" ustime="08:30" xlsdate="1900-01-10T08:30:00.000">Wed, 10 Jan 1900 08:30:00 +0100</cell>
                    <cell name="number" type="number" usnumber="0,50">0.5</cell>
                    <cell name="project" type="text">7445 Energieprojekte-DK-BSK-WEA-Thüngersheim</cell>
                    <cell name="purpose" type="text">Projektmanagment</cell>
                    <cell name="is_client_changed" type="bool">false</cell>
                    <cell name="purpose_internal" type="text"></cell>
                </row>
                <row>
                    <cell name="staff_name" type="text">A. Kokott</cell>
                    <cell name="work_package_name" type="text">0001-Stunden ohne Leistungsphase</cell>
                    <cell name="date" type="date" timezoneshort="CEST" unix="1751839200" usdate="07.07.2025" ustime="00:00" xlsdate="2025-07-07T00:00:00.000">Mon, 07 Jul 2025 00:00:00 +0200</cell>
                    <cell name="time_from" type="time" timezoneshort="CET" ustime="08:00" xlsdate="1900-01-10T08:00:00.000">Wed, 10 Jan 1900 08:00:00 +0100</cell>
                    <cell name="time_to" type="time" timezoneshort="CET" ustime="13:00" xlsdate="1900-01-10T13:00:00.000">Wed, 10 Jan 1900 13:00:00 +0100</cell>
                    <cell name="number" type="number" usnumber="5,00">5</cell>
                    <cell name="project" type="text">0014 Urlaubstage</cell>
                    <cell name="purpose" type="text"></cell>
                    <cell name="is_client_changed" type="bool">false</cell>
                    <cell name="purpose_internal" type="text"></cell>
                </row>
                <row>
                    <cell name="staff_name" type="text">A. Kokott</cell>
                    <cell name="work_package_name" type="text">0001-Stunden ohne Leistungsphase</cell>
                    <cell name="date" type="date" timezoneshort="CEST" unix="1751925600" usdate="08.07.2025" ustime="00:00" xlsdate="2025-07-08T00:00:00.000">Tue, 08 Jul 2025 00:00:00 +0200</cell>
                    <cell name="time_from" type="time" timezoneshort="CET" ustime="08:00" xlsdate="1900-01-10T08:00:00.000">Wed, 10 Jan 1900 08:00:00 +0100</cell>
                    <cell name="time_to" type="time" timezoneshort="CET" ustime="13:00" xlsdate="1900-01-10T13:00:00.000">Wed, 10 Jan 1900 13:00:00 +0100</cell>
                    <cell name="number" type="number" usnumber="5,00">5</cell>
                    <cell name="project" type="text">0014 Urlaubstage</cell>
                    <cell name="purpose" type="text"></cell>
                    <cell name="is_client_changed" type="bool">false</cell>
                    <cell name="purpose_internal" type="text"></cell>
                </row>
                <row>
                    <cell name="staff_name" type="text">A. Kokott</cell>
                    <cell name="work_package_name" type="text">0001-Stunden ohne Leistungsphase</cell>
                    <cell name="date" type="date" timezoneshort="CEST" unix="1752012000" usdate="09.07.2025" ustime="00:00" xlsdate="2025-07-09T00:00:00.000">Wed, 09 Jul 2025 00:00:00 +0200</cell>
                    <cell name="time_from" type="time" timezoneshort="CET" ustime="08:00" xlsdate="1900-01-10T08:00:00.000">Wed, 10 Jan 1900 08:00:00 +0100</cell>
                    <cell name="time_to" type="time" timezoneshort="CET" ustime="13:00" xlsdate="1900-01-10T13:00:00.000">Wed, 10 Jan 1900 13:00:00 +0100</cell>
                    <cell name="number" type="number" usnumber="5,00">5</cell>
                    <cell name="project" type="text">0014 Urlaubstage</cell>
                    <cell name="purpose" type="text"></cell>
                    <cell name="is_client_changed" type="bool">false</cell>
                    <cell name="purpose_internal" type="text"></cell>
                </row>
                <row>
                    <cell name="staff_name" type="text">A. Kokott</cell>
                    <cell name="work_package_name" type="text">0001-Stunden ohne Leistungsphase</cell>
                    <cell name="date" type="date" timezoneshort="CEST" unix="1752098400" usdate="10.07.2025" ustime="00:00" xlsdate="2025-07-10T00:00:00.000">Thu, 10 Jul 2025 00:00:00 +0200</cell>
                    <cell name="time_from" type="time" timezoneshort="CET" ustime="08:00" xlsdate="1900-01-10T08:00:00.000">Wed, 10 Jan 1900 08:00:00 +0100</cell>
                    <cell name="time_to" type="time" timezoneshort="CET" ustime="13:00" xlsdate="1900-01-10T13:00:00.000">Wed, 10 Jan 1900 13:00:00 +0100</cell>
                    <cell name="number" type="number" usnumber="5,00">5</cell>
                    <cell name="project" type="text">0014 Urlaubstage</cell>
                    <cell name="purpose" type="text"></cell>
                    <cell name="is_client_changed" type="bool">false</cell>
                    <cell name="purpose_internal" type="text"></cell>
                </row>
                <row>
                    <cell name="staff_name" type="text">A. Kokott</cell>
                    <cell name="work_package_name" type="text">0001-Stunden ohne Leistungsphase</cell>
                    <cell name="date" type="date" timezoneshort="CEST" unix="1752444000" usdate="14.07.2025" ustime="00:00" xlsdate="2025-07-14T00:00:00.000">Mon, 14 Jul 2025 00:00:00 +0200</cell>
                    <cell name="time_from" type="time" timezoneshort="CET" ustime="08:00" xlsdate="1900-01-10T08:00:00.000">Wed, 10 Jan 1900 08:00:00 +0100</cell>
                    <cell name="time_to" type="time" timezoneshort="CET" ustime="13:00" xlsdate="1900-01-10T13:00:00.000">Wed, 10 Jan 1900 13:00:00 +0100</cell>
                    <cell name="number" type="number" usnumber="5,00">5</cell>
                    <cell name="project" type="text">0014 Urlaubstage</cell>
                    <cell name="purpose" type="text"></cell>
                    <cell name="is_client_changed" type="bool">false</cell>
                    <cell name="purpose_internal" type="text"></cell>
                </row>
                <row>
                    <cell name="staff_name" type="text">A. Kokott</cell>
                    <cell name="work_package_name" type="text">0001-Stunden ohne Leistungsphase</cell>
                    <cell name="date" type="date" timezoneshort="CEST" unix="1752530400" usdate="15.07.2025" ustime="00:00" xlsdate="2025-07-15T00:00:00.000">Tue, 15 Jul 2025 00:00:00 +0200</cell>
                    <cell name="time_from" type="time" timezoneshort="CET" ustime="08:00" xlsdate="1900-01-10T08:00:00.000">Wed, 10 Jan 1900 08:00:00 +0100</cell>
                    <cell name="time_to" type="time" timezoneshort="CET" ustime="13:00" xlsdate="1900-01-10T13:00:00.000">Wed, 10 Jan 1900 13:00:00 +0100</cell>
                    <cell name="number" type="number" usnumber="5,00">5</cell>
                    <cell name="project" type="text">0014 Urlaubstage</cell>
                    <cell name="purpose" type="text"></cell>
                    <cell name="is_client_changed" type="bool">false</cell>
                    <cell name="purpose_internal" type="text"></cell>
                </row>
                <row>
                    <cell name="staff_name" type="text">A. Kokott</cell>
                    <cell name="work_package_name" type="text">0001-Stunden ohne Leistungsphase</cell>
                    <cell name="date" type="date" timezoneshort="CEST" unix="1752616800" usdate="16.07.2025" ustime="00:00" xlsdate="2025-07-16T00:00:00.000">Wed, 16 Jul 2025 00:00:00 +0200</cell>
                    <cell name="time_from" type="time" timezoneshort="CET" ustime="08:00" xlsdate="1900-01-10T08:00:00.000">Wed, 10 Jan 1900 08:00:00 +0100</cell>
                    <cell name="time_to" type="time" timezoneshort="CET" ustime="13:00" xlsdate="1900-01-10T13:00:00.000">Wed, 10 Jan 1900 13:00:00 +0100</cell>
                    <cell name="number" type="number" usnumber="5,00">5</cell>
                    <cell name="project" type="text">0014 Urlaubstage</cell>
                    <cell name="purpose" type="text"></cell>
                    <cell name="is_client_changed" type="bool">false</cell>
                    <cell name="purpose_internal" type="text"></cell>
                </row>
                <row>
                    <cell name="staff_name" type="text">A. Kokott</cell>
                    <cell name="work_package_name" type="text">0001-Stunden ohne Leistungsphase</cell>
                    <cell name="date" type="date" timezoneshort="CEST" unix="1752703200" usdate="17.07.2025" ustime="00:00" xlsdate="2025-07-17T00:00:00.000">Thu, 17 Jul 2025 00:00:00 +0200</cell>
                    <cell name="time_from" type="time" timezoneshort="CET" ustime="08:00" xlsdate="1900-01-10T08:00:00.000">Wed, 10 Jan 1900 08:00:00 +0100</cell>
                    <cell name="time_to" type="time" timezoneshort="CET" ustime="13:00" xlsdate="1900-01-10T13:00:00.000">Wed, 10 Jan 1900 13:00:00 +0100</cell>
                    <cell name="number" type="number" usnumber="5,00">5</cell>
                    <cell name="project" type="text">0014 Urlaubstage</cell>
                    <cell name="purpose" type="text"></cell>
                    <cell name="is_client_changed" type="bool">false</cell>
                    <cell name="purpose_internal" type="text"></cell>
                </row>
                <row>
                    <cell name="staff_name" type="text">A. Kokott</cell>
                    <cell name="work_package_name" type="text">0001-Stunden ohne Leistungsphase</cell>
                    <cell name="date" type="date" timezoneshort="CEST" unix="1753048800" usdate="21.07.2025" ustime="00:00" xlsdate="2025-07-21T00:00:00.000">Mon, 21 Jul 2025 00:00:00 +0200</cell>
                    <cell name="time_from" type="time" timezoneshort="CET" ustime="08:00" xlsdate="1900-01-10T08:00:00.000">Wed, 10 Jan 1900 08:00:00 +0100</cell>
                    <cell name="time_to" type="time" timezoneshort="CET" ustime="13:00" xlsdate="1900-01-10T13:00:00.000">Wed, 10 Jan 1900 13:00:00 +0100</cell>
                    <cell name="number" type="number" usnumber="5,00">5</cell>
                    <cell name="project" type="text">0014 Urlaubstage</cell>
                    <cell name="purpose" type="text"></cell>
                    <cell name="is_client_changed" type="bool">false</cell>
                    <cell name="purpose_internal" type="text"></cell>
                </row>
                <row>
                    <cell name="staff_name" type="text">A. Kokott</cell>
                    <cell name="work_package_name" type="text">0001-Stunden ohne Leistungsphase</cell>
                    <cell name="date" type="date" timezoneshort="CEST" unix="1753135200" usdate="22.07.2025" ustime="00:00" xlsdate="2025-07-22T00:00:00.000">Tue, 22 Jul 2025 00:00:00 +0200</cell>
                    <cell name="time_from" type="time" timezoneshort="CET" ustime="08:00" xlsdate="1900-01-10T08:00:00.000">Wed, 10 Jan 1900 08:00:00 +0100</cell>
                    <cell name="time_to" type="time" timezoneshort="CET" ustime="13:00" xlsdate="1900-01-10T13:00:00.000">Wed, 10 Jan 1900 13:00:00 +0100</cell>
                    <cell name="number" type="number" usnumber="5,00">5</cell>
                    <cell name="project" type="text">0014 Urlaubstage</cell>
                    <cell name="purpose" type="text"></cell>
                    <cell name="is_client_changed" type="bool">false</cell>
                    <cell name="purpose_internal" type="text"></cell>
                </row>
                <row>
                    <cell name="staff_name" type="text">A. Kokott</cell>
                    <cell name="work_package_name" type="text">ADM</cell>
                    <cell name="date" type="date" timezoneshort="CEST" unix="1753221600" usdate="23.07.2025" ustime="00:00" xlsdate="2025-07-23T00:00:00.000">Wed, 23 Jul 2025 00:00:00 +0200</cell>
                    <cell name="time_from" type="time" timezoneshort="CET" ustime="12:30" xlsdate="1900-01-10T12:30:00.000">Wed, 10 Jan 1900 12:30:00 +0100</cell>
                    <cell name="time_to" type="time" timezoneshort="CET" ustime="13:00" xlsdate="1900-01-10T13:00:00.000">Wed, 10 Jan 1900 13:00:00 +0100</cell>
                    <cell name="number" type="number" usnumber="0,50">0.5</cell>
                    <cell name="project" type="text">7015.02 HeyLagerGmbH-BAB-Garagenpark-Alzenau</cell>
                    <cell name="purpose" type="text">Projektmanagment</cell>
                    <cell name="is_client_changed" type="bool">false</cell>
                    <cell name="purpose_internal" type="text"></cell>
                </row>
                <row>
                    <cell name="staff_name" type="text">A. Kokott</cell>
                    <cell name="work_package_name" type="text">ADM</cell>
                    <cell name="date" type="date" timezoneshort="CEST" unix="1753221600" usdate="23.07.2025" ustime="00:00" xlsdate="2025-07-23T00:00:00.000">Wed, 23 Jul 2025 00:00:00 +0200</cell>
                    <cell name="time_from" type="time" timezoneshort="CET" ustime="12:00" xlsdate="1900-01-10T12:00:00.000">Wed, 10 Jan 1900 12:00:00 +0100</cell>
                    <cell name="time_to" type="time" timezoneshort="CET" ustime="12:30" xlsdate="1900-01-10T12:30:00.000">Wed, 10 Jan 1900 12:30:00 +0100</cell>
                    <cell name="number" type="number" usnumber="0,50">0.5</cell>
                    <cell name="project" type="text">3869.24 KES-BST-1.OG-Bestandsgebäude-Marktstr1-3-Stuttgart</cell>
                    <cell name="purpose" type="text">Projektmanagment</cell>
                    <cell name="is_client_changed" type="bool">false</cell>
                    <cell name="purpose_internal" type="text"></cell>
                </row>
                <row>
                    <cell name="staff_name" type="text">A. Kokott</cell>
                    <cell name="work_package_name" type="text">(aN) Pos. 1 Brandschutztechnische Beratung</cell>
                    <cell name="date" type="date" timezoneshort="CEST" unix="1753221600" usdate="23.07.2025" ustime="00:00" xlsdate="2025-07-23T00:00:00.000">Wed, 23 Jul 2025 00:00:00 +0200</cell>
                    <cell name="time_from" type="time" timezoneshort="CET" ustime="11:30" xlsdate="1900-01-10T11:30:00.000">Wed, 10 Jan 1900 11:30:00 +0100</cell>
                    <cell name="time_to" type="time" timezoneshort="CET" ustime="12:00" xlsdate="1900-01-10T12:00:00.000">Wed, 10 Jan 1900 12:00:00 +0100</cell>
                    <cell name="number" type="number" usnumber="0,50">0.5</cell>
                    <cell name="project" type="text">5793.03 StadtFB-Eschholzstr118-Freiburg-Rettungszentrum-Halle-E</cell>
                    <cell name="purpose" type="text">Projektmanagment</cell>
                    <cell name="is_client_changed" type="bool">false</cell>
                    <cell name="purpose_internal" type="text"></cell>
                </row>
                <row>
                    <cell name="staff_name" type="text">A. Kokott</cell>
                    <cell name="work_package_name" type="text">(aN) BTB (SV)</cell>
                    <cell name="date" type="date" timezoneshort="CEST" unix="1753221600" usdate="23.07.2025" ustime="00:00" xlsdate="2025-07-23T00:00:00.000">Wed, 23 Jul 2025 00:00:00 +0200</cell>
                    <cell name="time_from" type="time" timezoneshort="CET" ustime="11:00" xlsdate="1900-01-10T11:00:00.000">Wed, 10 Jan 1900 11:00:00 +0100</cell>
                    <cell name="time_to" type="time" timezoneshort="CET" ustime="11:30" xlsdate="1900-01-10T11:30:00.000">Wed, 10 Jan 1900 11:30:00 +0100</cell>
                    <cell name="number" type="number" usnumber="0,50">0.5</cell>
                    <cell name="project" type="text">6961.01 Neptune-Rheinhafen-Speyer-allgemeineBeratungsleistungen</cell>
                    <cell name="purpose" type="text">Projektmanagment</cell>
                    <cell name="is_client_changed" type="bool">false</cell>
                    <cell name="purpose_internal" type="text"></cell>
                </row>
                <row>
                    <cell name="staff_name" type="text">A. Kokott</cell>
                    <cell name="work_package_name" type="text">0100-Anlage Projekt, Angebot, Versand, Auftrag</cell>
                    <cell name="date" type="date" timezoneshort="CEST" unix="1753221600" usdate="23.07.2025" ustime="00:00" xlsdate="2025-07-23T00:00:00.000">Wed, 23 Jul 2025 00:00:00 +0200</cell>
                    <cell name="time_from" type="time" timezoneshort="CET" ustime="10:30" xlsdate="1900-01-10T10:30:00.000">Wed, 10 Jan 1900 10:30:00 +0100</cell>
                    <cell name="time_to" type="time" timezoneshort="CET" ustime="11:00" xlsdate="1900-01-10T11:00:00.000">Wed, 10 Jan 1900 11:00:00 +0100</cell>
                    <cell name="number" type="number" usnumber="0,50">0.5</cell>
                    <cell name="project" type="text">7247.01 Hoepfner-BST-Zentrale-Karlsruhe</cell>
                    <cell name="purpose" type="text">Projektmanagment</cell>
                    <cell name="is_client_changed" type="bool">false</cell>
                    <cell name="purpose_internal" type="text"></cell>
                </row>
                <row>
                    <cell name="staff_name" type="text">A. Kokott</cell>
                    <cell name="work_package_name" type="text">Anlage Projekt, Angebot, Versand, Auftrag </cell>
                    <cell name="date" type="date" timezoneshort="CEST" unix="1753221600" usdate="23.07.2025" ustime="00:00" xlsdate="2025-07-23T00:00:00.000">Wed, 23 Jul 2025 00:00:00 +0200</cell>
                    <cell name="time_from" type="time" timezoneshort="CET" ustime="10:00" xlsdate="1900-01-10T10:00:00.000">Wed, 10 Jan 1900 10:00:00 +0100</cell>
                    <cell name="time_to" type="time" timezoneshort="CET" ustime="10:30" xlsdate="1900-01-10T10:30:00.000">Wed, 10 Jan 1900 10:30:00 +0100</cell>
                    <cell name="number" type="number" usnumber="0,50">0.5</cell>
                    <cell name="project" type="text">7437 MVV-BSK-UW3-Käfertal-Mannheim</cell>
                    <cell name="purpose" type="text">Projektmanagment</cell>
                    <cell name="is_client_changed" type="bool">false</cell>
                    <cell name="purpose_internal" type="text"></cell>
                </row>
                <row>
                    <cell name="staff_name" type="text">A. Kokott</cell>
                    <cell name="work_package_name" type="text">ADM</cell>
                    <cell name="date" type="date" timezoneshort="CEST" unix="1753221600" usdate="23.07.2025" ustime="00:00" xlsdate="2025-07-23T00:00:00.000">Wed, 23 Jul 2025 00:00:00 +0200</cell>
                    <cell name="time_from" type="time" timezoneshort="CET" ustime="09:00" xlsdate="1900-01-10T09:00:00.000">Wed, 10 Jan 1900 09:00:00 +0100</cell>
                    <cell name="time_to" type="time" timezoneshort="CET" ustime="09:30" xlsdate="1900-01-10T09:30:00.000">Wed, 10 Jan 1900 09:30:00 +0100</cell>
                    <cell name="number" type="number" usnumber="0,50">0.5</cell>
                    <cell name="project" type="text">7441 Baupionier-Garagenpark-Öhringen-BSK</cell>
                    <cell name="purpose" type="text">QS und Versand BSK</cell>
                    <cell name="is_client_changed" type="bool">false</cell>
                    <cell name="purpose_internal" type="text"></cell>
                </row>
                <row>
                    <cell name="staff_name" type="text">A. Kokott</cell>
                    <cell name="work_package_name" type="text">ADM</cell>
                    <cell name="date" type="date" timezoneshort="CEST" unix="1753221600" usdate="23.07.2025" ustime="00:00" xlsdate="2025-07-23T00:00:00.000">Wed, 23 Jul 2025 00:00:00 +0200</cell>
                    <cell name="time_from" type="time" timezoneshort="CET" ustime="08:30" xlsdate="1900-01-10T08:30:00.000">Wed, 10 Jan 1900 08:30:00 +0100</cell>
                    <cell name="time_to" type="time" timezoneshort="CET" ustime="09:00" xlsdate="1900-01-10T09:00:00.000">Wed, 10 Jan 1900 09:00:00 +0100</cell>
                    <cell name="number" type="number" usnumber="0,50">0.5</cell>
                    <cell name="project" type="text">7448 Seniorenresidenz-Sonnenwinkel-BSH-Im-Füllengarten14-16-Saarbrücken</cell>
                    <cell name="purpose" type="text">Projektmanagment</cell>
                    <cell name="is_client_changed" type="bool">false</cell>
                    <cell name="purpose_internal" type="text"></cell>
                </row>
                <row>
                    <cell name="staff_name" type="text">A. Kokott</cell>
                    <cell name="work_package_name" type="text">ADM</cell>
                    <cell name="date" type="date" timezoneshort="CEST" unix="1753221600" usdate="23.07.2025" ustime="00:00" xlsdate="2025-07-23T00:00:00.000">Wed, 23 Jul 2025 00:00:00 +0200</cell>
                    <cell name="time_from" type="time" timezoneshort="CET" ustime="08:00" xlsdate="1900-01-10T08:00:00.000">Wed, 10 Jan 1900 08:00:00 +0100</cell>
                    <cell name="time_to" type="time" timezoneshort="CET" ustime="08:30" xlsdate="1900-01-10T08:30:00.000">Wed, 10 Jan 1900 08:30:00 +0100</cell>
                    <cell name="number" type="number" usnumber="0,50">0.5</cell>
                    <cell name="project" type="text">7444 Energieprojekte-DK-BSK-WEA-Schußbachwald</cell>
                    <cell name="purpose" type="text">Projektmanagment</cell>
                    <cell name="is_client_changed" type="bool">false</cell>
                    <cell name="purpose_internal" type="text"></cell>
                </row>
                <row>
                    <cell name="staff_name" type="text">A. Kokott</cell>
                    <cell name="work_package_name" type="text">3100-Erarbeiten des Brandschutzkonzept/Nachweis/Stellungnahme</cell>
                    <cell name="date" type="date" timezoneshort="CEST" unix="1753308000" usdate="24.07.2025" ustime="00:00" xlsdate="2025-07-24T00:00:00.000">Thu, 24 Jul 2025 00:00:00 +0200</cell>
                    <cell name="time_from" type="time" timezoneshort="CET" ustime="11:30" xlsdate="1900-01-10T11:30:00.000">Wed, 10 Jan 1900 11:30:00 +0100</cell>
                    <cell name="time_to" type="time" timezoneshort="CET" ustime="12:00" xlsdate="1900-01-10T12:00:00.000">Wed, 10 Jan 1900 12:00:00 +0100</cell>
                    <cell name="number" type="number" usnumber="0,50">0.5</cell>
                    <cell name="project" type="text">7459 Baupionier-BTB-Prüfung-Details-Garagenparks</cell>
                    <cell name="purpose" type="text">QS BST</cell>
                    <cell name="is_client_changed" type="bool">false</cell>
                    <cell name="purpose_internal" type="text"></cell>
                </row>
                <row>
                    <cell name="staff_name" type="text">A. Kokott</cell>
                    <cell name="work_package_name" type="text">ADM</cell>
                    <cell name="date" type="date" timezoneshort="CEST" unix="1753308000" usdate="24.07.2025" ustime="00:00" xlsdate="2025-07-24T00:00:00.000">Thu, 24 Jul 2025 00:00:00 +0200</cell>
                    <cell name="time_from" type="time" timezoneshort="CET" ustime="11:00" xlsdate="1900-01-10T11:00:00.000">Wed, 10 Jan 1900 11:00:00 +0100</cell>
                    <cell name="time_to" type="time" timezoneshort="CET" ustime="11:30" xlsdate="1900-01-10T11:30:00.000">Wed, 10 Jan 1900 11:30:00 +0100</cell>
                    <cell name="number" type="number" usnumber="0,50">0.5</cell>
                    <cell name="project" type="text">5984.01 QE-WEA-Windpark-Lusshardt-Überarbeitung-BSK</cell>
                    <cell name="purpose" type="text">QS und Versand BSK</cell>
                    <cell name="is_client_changed" type="bool">false</cell>
                    <cell name="purpose_internal" type="text"></cell>
                </row>
                <row>
                    <cell name="staff_name" type="text">A. Kokott</cell>
                    <cell name="work_package_name" type="text">Angebote-Ausschreibungen-Kalkulationen (max. 8h/Monat pro MA)</cell>
                    <cell name="date" type="date" timezoneshort="CEST" unix="1753308000" usdate="24.07.2025" ustime="00:00" xlsdate="2025-07-24T00:00:00.000">Thu, 24 Jul 2025 00:00:00 +0200</cell>
                    <cell name="time_from" type="time" timezoneshort="CET" ustime="09:00" xlsdate="1900-01-10T09:00:00.000">Wed, 10 Jan 1900 09:00:00 +0100</cell>
                    <cell name="time_to" type="time" timezoneshort="CET" ustime="11:00" xlsdate="1900-01-10T11:00:00.000">Wed, 10 Jan 1900 11:00:00 +0100</cell>
                    <cell name="number" type="number" usnumber="2,00">2</cell>
                    <cell name="project" type="text">0000 Sonderprojekt für Bonus</cell>
                    <cell name="purpose" type="text"></cell>
                    <cell name="is_client_changed" type="bool">false</cell>
                    <cell name="purpose_internal" type="text"></cell>
                </row>
                <row>
                    <cell name="staff_name" type="text">A. Kokott</cell>
                    <cell name="work_package_name" type="text">0100-Anlage Projekt, Angebot, Versand, Auftrag</cell>
                    <cell name="date" type="date" timezoneshort="CEST" unix="1753653600" usdate="28.07.2025" ustime="00:00" xlsdate="2025-07-28T00:00:00.000">Mon, 28 Jul 2025 00:00:00 +0200</cell>
                    <cell name="time_from" type="time" timezoneshort="CET" ustime="10:30" xlsdate="1900-01-10T10:30:00.000">Wed, 10 Jan 1900 10:30:00 +0100</cell>
                    <cell name="time_to" type="time" timezoneshort="CET" ustime="11:00" xlsdate="1900-01-10T11:00:00.000">Wed, 10 Jan 1900 11:00:00 +0100</cell>
                    <cell name="number" type="number" usnumber="0,50">0.5</cell>
                    <cell name="project" type="text">7459 Baupionier-BTB-Prüfung-Details-Garagenparks</cell>
                    <cell name="purpose" type="text">Projektmanagment</cell>
                    <cell name="is_client_changed" type="bool">false</cell>
                    <cell name="purpose_internal" type="text"></cell>
                </row>
                <row>
                    <cell name="staff_name" type="text">A. Kokott</cell>
                    <cell name="work_package_name" type="text">0100-Anlage Projekt, Angebot, Versand, Auftrag</cell>
                    <cell name="date" type="date" timezoneshort="CEST" unix="1753653600" usdate="28.07.2025" ustime="00:00" xlsdate="2025-07-28T00:00:00.000">Mon, 28 Jul 2025 00:00:00 +0200</cell>
                    <cell name="time_from" type="time" timezoneshort="CET" ustime="10:00" xlsdate="1900-01-10T10:00:00.000">Wed, 10 Jan 1900 10:00:00 +0100</cell>
                    <cell name="time_to" type="time" timezoneshort="CET" ustime="10:30" xlsdate="1900-01-10T10:30:00.000">Wed, 10 Jan 1900 10:30:00 +0100</cell>
                    <cell name="number" type="number" usnumber="0,50">0.5</cell>
                    <cell name="project" type="text">7247.01 Hoepfner-BST-Zentrale-Karlsruhe</cell>
                    <cell name="purpose" type="text">Projektmangament</cell>
                    <cell name="is_client_changed" type="bool">false</cell>
                    <cell name="purpose_internal" type="text"></cell>
                </row>
                <row>
                    <cell name="staff_name" type="text">A. Kokott</cell>
                    <cell name="work_package_name" type="text">CAD</cell>
                    <cell name="date" type="date" timezoneshort="CEST" unix="1753653600" usdate="28.07.2025" ustime="00:00" xlsdate="2025-07-28T00:00:00.000">Mon, 28 Jul 2025 00:00:00 +0200</cell>
                    <cell name="time_from" type="time" timezoneshort="CET" ustime="09:00" xlsdate="1900-01-10T09:00:00.000">Wed, 10 Jan 1900 09:00:00 +0100</cell>
                    <cell name="time_to" type="time" timezoneshort="CET" ustime="09:30" xlsdate="1900-01-10T09:30:00.000">Wed, 10 Jan 1900 09:30:00 +0100</cell>
                    <cell name="number" type="number" usnumber="0,50">0.5</cell>
                    <cell name="project" type="text">5640.12 Swisslife-BTB-BSK-HCIII-Salutem-4.OG-Eppelheimerstr8-Heidelberg</cell>
                    <cell name="purpose" type="text">QS 7. Fortschreibung BSK</cell>
                    <cell name="is_client_changed" type="bool">false</cell>
                    <cell name="purpose_internal" type="text"></cell>
                </row>
                <row>
                    <cell name="staff_name" type="text">A. Kokott</cell>
                    <cell name="work_package_name" type="text">ADM</cell>
                    <cell name="date" type="date" timezoneshort="CEST" unix="1753740000" usdate="29.07.2025" ustime="00:00" xlsdate="2025-07-29T00:00:00.000">Tue, 29 Jul 2025 00:00:00 +0200</cell>
                    <cell name="time_from" type="time" timezoneshort="CET" ustime="12:30" xlsdate="1900-01-10T12:30:00.000">Wed, 10 Jan 1900 12:30:00 +0100</cell>
                    <cell name="time_to" type="time" timezoneshort="CET" ustime="13:00" xlsdate="1900-01-10T13:00:00.000">Wed, 10 Jan 1900 13:00:00 +0100</cell>
                    <cell name="number" type="number" usnumber="0,50">0.5</cell>
                    <cell name="project" type="text">7435 wiwi-BSK-WEA-Spiesheim-Wörrstadt-Ost</cell>
                    <cell name="purpose" type="text">Projektmanagment</cell>
                    <cell name="is_client_changed" type="bool">false</cell>
                    <cell name="purpose_internal" type="text"></cell>
                </row>
                <row>
                    <cell name="staff_name" type="text">A. Kokott</cell>
                    <cell name="work_package_name" type="text">ADM</cell>
                    <cell name="date" type="date" timezoneshort="CEST" unix="1753740000" usdate="29.07.2025" ustime="00:00" xlsdate="2025-07-29T00:00:00.000">Tue, 29 Jul 2025 00:00:00 +0200</cell>
                    <cell name="time_from" type="time" timezoneshort="CET" ustime="12:00" xlsdate="1900-01-10T12:00:00.000">Wed, 10 Jan 1900 12:00:00 +0100</cell>
                    <cell name="time_to" type="time" timezoneshort="CET" ustime="12:30" xlsdate="1900-01-10T12:30:00.000">Wed, 10 Jan 1900 12:30:00 +0100</cell>
                    <cell name="number" type="number" usnumber="0,50">0.5</cell>
                    <cell name="project" type="text">7422 Energieprojekte-DK-BSK-WEA-Aschbach-Ilmenau</cell>
                    <cell name="purpose" type="text">Projektmanagment</cell>
                    <cell name="is_client_changed" type="bool">false</cell>
                    <cell name="purpose_internal" type="text"></cell>
                </row>
                <row>
                    <cell name="staff_name" type="text">A. Kokott</cell>
                    <cell name="work_package_name" type="text">SV</cell>
                    <cell name="date" type="date" timezoneshort="CEST" unix="1753740000" usdate="29.07.2025" ustime="00:00" xlsdate="2025-07-29T00:00:00.000">Tue, 29 Jul 2025 00:00:00 +0200</cell>
                    <cell name="time_from" type="time" timezoneshort="CET" ustime="11:30" xlsdate="1900-01-10T11:30:00.000">Wed, 10 Jan 1900 11:30:00 +0100</cell>
                    <cell name="time_to" type="time" timezoneshort="CET" ustime="11:45" xlsdate="1900-01-10T11:45:00.000">Wed, 10 Jan 1900 11:45:00 +0100</cell>
                    <cell name="number" type="number" usnumber="0,25">0.25</cell>
                    <cell name="project" type="text">6527.01 IO-Anp-BSK-Mühlenfeldstr1-Holzminden-Symotion</cell>
                    <cell name="purpose" type="text">korr. QS Fortschreibung BSK</cell>
                    <cell name="is_client_changed" type="bool">false</cell>
                    <cell name="purpose_internal" type="text"></cell>
                </row>
                <row>
                    <cell name="staff_name" type="text">A. Kokott</cell>
                    <cell name="work_package_name" type="text">(p) Anp. BSK</cell>
                    <cell name="date" type="date" timezoneshort="CEST" unix="1753740000" usdate="29.07.2025" ustime="00:00" xlsdate="2025-07-29T00:00:00.000">Tue, 29 Jul 2025 00:00:00 +0200</cell>
                    <cell name="time_from" type="time" timezoneshort="CET" ustime="11:00" xlsdate="1900-01-10T11:00:00.000">Wed, 10 Jan 1900 11:00:00 +0100</cell>
                    <cell name="time_to" type="time" timezoneshort="CET" ustime="11:30" xlsdate="1900-01-10T11:30:00.000">Wed, 10 Jan 1900 11:30:00 +0100</cell>
                    <cell name="number" type="number" usnumber="0,50">0.5</cell>
                    <cell name="project" type="text">6769.01 Juwi-Anp-BSK-Selser-Berg</cell>
                    <cell name="purpose" type="text">QS und Versand 1. Fortschr. BSK</cell>
                    <cell name="is_client_changed" type="bool">false</cell>
                    <cell name="purpose_internal" type="text"></cell>
                </row>
                <row>
                    <cell name="staff_name" type="text">A. Kokott</cell>
                    <cell name="work_package_name" type="text">ADM</cell>
                    <cell name="date" type="date" timezoneshort="CEST" unix="1753740000" usdate="29.07.2025" ustime="00:00" xlsdate="2025-07-29T00:00:00.000">Tue, 29 Jul 2025 00:00:00 +0200</cell>
                    <cell name="time_from" type="time" timezoneshort="CET" ustime="10:00" xlsdate="1900-01-10T10:00:00.000">Wed, 10 Jan 1900 10:00:00 +0100</cell>
                    <cell name="time_to" type="time" timezoneshort="CET" ustime="10:30" xlsdate="1900-01-10T10:30:00.000">Wed, 10 Jan 1900 10:30:00 +0100</cell>
                    <cell name="number" type="number" usnumber="0,50">0.5</cell>
                    <cell name="project" type="text">7293 VEW-BSK-WEA-Hopperkopf</cell>
                    <cell name="purpose" type="text">Projektmanagment</cell>
                    <cell name="is_client_changed" type="bool">false</cell>
                    <cell name="purpose_internal" type="text"></cell>
                </row>
                <row>
                    <cell name="staff_name" type="text">A. Kokott</cell>
                    <cell name="work_package_name" type="text">Einarbeitung neuer Mitarbeiter (max. 8h/Monat pro MA)</cell>
                    <cell name="date" type="date" timezoneshort="CEST" unix="1753740000" usdate="29.07.2025" ustime="00:00" xlsdate="2025-07-29T00:00:00.000">Tue, 29 Jul 2025 00:00:00 +0200</cell>
                    <cell name="time_from" type="time" timezoneshort="CET" ustime="08:00" xlsdate="1900-01-10T08:00:00.000">Wed, 10 Jan 1900 08:00:00 +0100</cell>
                    <cell name="time_to" type="time" timezoneshort="CET" ustime="10:00" xlsdate="1900-01-10T10:00:00.000">Wed, 10 Jan 1900 10:00:00 +0100</cell>
                    <cell name="number" type="number" usnumber="2,00">2</cell>
                    <cell name="project" type="text">0000 Sonderprojekt für Bonus</cell>
                    <cell name="purpose" type="text">Enarbeitung Fabienne</cell>
                    <cell name="is_client_changed" type="bool">false</cell>
                    <cell name="purpose_internal" type="text"></cell>
                </row>
                <row>
                    <cell name="staff_name" type="text">A. Kokott</cell>
                    <cell name="work_package_name" type="text">Angebote-Ausschreibungen-Kalkulationen (max. 8h/Monat pro MA)</cell>
                    <cell name="date" type="date" timezoneshort="CEST" unix="1754258400" usdate="04.08.2025" ustime="00:00" xlsdate="2025-08-04T00:00:00.000">Mon, 04 Aug 2025 00:00:00 +0200</cell>
                    <cell name="time_from" type="time" timezoneshort="CET" ustime="11:00" xlsdate="1900-01-10T11:00:00.000">Wed, 10 Jan 1900 11:00:00 +0100</cell>
                    <cell name="time_to" type="time" timezoneshort="CET" ustime="12:00" xlsdate="1900-01-10T12:00:00.000">Wed, 10 Jan 1900 12:00:00 +0100</cell>
                    <cell name="number" type="number" usnumber="1,00">1</cell>
                    <cell name="project" type="text">0000 Sonderprojekt für Bonus</cell>
                    <cell name="purpose" type="text"></cell>
                    <cell name="is_client_changed" type="bool">false</cell>
                    <cell name="purpose_internal" type="text"></cell>
                </row>
                <row>
                    <cell name="staff_name" type="text">A. Kokott</cell>
                    <cell name="work_package_name" type="text">9200-Erstellen od. Prüfen Feuerwehrpläne….</cell>
                    <cell name="date" type="date" timezoneshort="CEST" unix="1754258400" usdate="04.08.2025" ustime="00:00" xlsdate="2025-08-04T00:00:00.000">Mon, 04 Aug 2025 00:00:00 +0200</cell>
                    <cell name="time_from" type="time" timezoneshort="CET" ustime="10:00" xlsdate="1900-01-10T10:00:00.000">Wed, 10 Jan 1900 10:00:00 +0100</cell>
                    <cell name="time_to" type="time" timezoneshort="CET" ustime="10:15" xlsdate="1900-01-10T10:15:00.000">Wed, 10 Jan 1900 10:15:00 +0100</cell>
                    <cell name="number" type="number" usnumber="0,25">0.25</cell>
                    <cell name="project" type="text">4436.043 FWP-NA003-KKH-Bergstraße-Viernheimer-Straße-2-Heppenheim-Bauphase+NB-BauteilG</cell>
                    <cell name="purpose" type="text">Versand FWP</cell>
                    <cell name="is_client_changed" type="bool">false</cell>
                    <cell name="purpose_internal" type="text"></cell>
                </row>
                <row>
                    <cell name="staff_name" type="text">A. Kokott</cell>
                    <cell name="work_package_name" type="text">Erarbeiten des Brandschutzkonzept/Nachweis/Stellungnahme </cell>
                    <cell name="date" type="date" timezoneshort="CEST" unix="1754258400" usdate="04.08.2025" ustime="00:00" xlsdate="2025-08-04T00:00:00.000">Mon, 04 Aug 2025 00:00:00 +0200</cell>
                    <cell name="time_from" type="time" timezoneshort="CET" ustime="09:30" xlsdate="1900-01-10T09:30:00.000">Wed, 10 Jan 1900 09:30:00 +0100</cell>
                    <cell name="time_to" type="time" timezoneshort="CET" ustime="10:00" xlsdate="1900-01-10T10:00:00.000">Wed, 10 Jan 1900 10:00:00 +0100</cell>
                    <cell name="number" type="number" usnumber="0,50">0.5</cell>
                    <cell name="project" type="text">7437 MVV-BSK-UW3-Käfertal-Mannheim</cell>
                    <cell name="purpose" type="text">QS und Versand BSK</cell>
                    <cell name="is_client_changed" type="bool">false</cell>
                    <cell name="purpose_internal" type="text"></cell>
                </row>
                <row>
                    <cell name="staff_name" type="text">A. Kokott</cell>
                    <cell name="work_package_name" type="text">ADM</cell>
                    <cell name="date" type="date" timezoneshort="CEST" unix="1754258400" usdate="04.08.2025" ustime="00:00" xlsdate="2025-08-04T00:00:00.000">Mon, 04 Aug 2025 00:00:00 +0200</cell>
                    <cell name="time_from" type="time" timezoneshort="CET" ustime="09:00" xlsdate="1900-01-10T09:00:00.000">Wed, 10 Jan 1900 09:00:00 +0100</cell>
                    <cell name="time_to" type="time" timezoneshort="CET" ustime="09:30" xlsdate="1900-01-10T09:30:00.000">Wed, 10 Jan 1900 09:30:00 +0100</cell>
                    <cell name="number" type="number" usnumber="0,50">0.5</cell>
                    <cell name="project" type="text">7445 Energieprojekte-DK-BSK-WEA-Thüngersheim</cell>
                    <cell name="purpose" type="text">QS und Vers. BSK</cell>
                    <cell name="is_client_changed" type="bool">false</cell>
                    <cell name="purpose_internal" type="text"></cell>
                </row>
                <row>
                    <cell name="staff_name" type="text">A. Kokott</cell>
                    <cell name="work_package_name" type="text">ADM</cell>
                    <cell name="date" type="date" timezoneshort="CEST" unix="1754344800" usdate="05.08.2025" ustime="00:00" xlsdate="2025-08-05T00:00:00.000">Tue, 05 Aug 2025 00:00:00 +0200</cell>
                    <cell name="time_from" type="time" timezoneshort="CET" ustime="11:30" xlsdate="1900-01-10T11:30:00.000">Wed, 10 Jan 1900 11:30:00 +0100</cell>
                    <cell name="time_to" type="time" timezoneshort="CET" ustime="12:00" xlsdate="1900-01-10T12:00:00.000">Wed, 10 Jan 1900 12:00:00 +0100</cell>
                    <cell name="number" type="number" usnumber="0,50">0.5</cell>
                    <cell name="project" type="text">7364 SHE-BSK-WP-Göttingen-Baden-Württemberg</cell>
                    <cell name="purpose" type="text">QS und Versand BSK</cell>
                    <cell name="is_client_changed" type="bool">false</cell>
                    <cell name="purpose_internal" type="text"></cell>
                </row>
                <row>
                    <cell name="staff_name" type="text">A. Kokott</cell>
                    <cell name="work_package_name" type="text">ADM</cell>
                    <cell name="date" type="date" timezoneshort="CEST" unix="1754344800" usdate="05.08.2025" ustime="00:00" xlsdate="2025-08-05T00:00:00.000">Tue, 05 Aug 2025 00:00:00 +0200</cell>
                    <cell name="time_from" type="time" timezoneshort="CET" ustime="11:00" xlsdate="1900-01-10T11:00:00.000">Wed, 10 Jan 1900 11:00:00 +0100</cell>
                    <cell name="time_to" type="time" timezoneshort="CET" ustime="11:30" xlsdate="1900-01-10T11:30:00.000">Wed, 10 Jan 1900 11:30:00 +0100</cell>
                    <cell name="number" type="number" usnumber="0,50">0.5</cell>
                    <cell name="project" type="text">7361 Energieprojekte-DK-BSK-WP-Thalfingen+Repowering-Anlage-Seligweiler-Bayern</cell>
                    <cell name="purpose" type="text">QS und Versand BSK</cell>
                    <cell name="is_client_changed" type="bool">false</cell>
                    <cell name="purpose_internal" type="text"></cell>
                </row>
                <row>
                    <cell name="staff_name" type="text">A. Kokott</cell>
                    <cell name="work_package_name" type="text">Angebote-Ausschreibungen-Kalkulationen (max. 8h/Monat pro MA)</cell>
                    <cell name="date" type="date" timezoneshort="CEST" unix="1754344800" usdate="05.08.2025" ustime="00:00" xlsdate="2025-08-05T00:00:00.000">Tue, 05 Aug 2025 00:00:00 +0200</cell>
                    <cell name="time_from" type="time" timezoneshort="CET" ustime="09:00" xlsdate="1900-01-10T09:00:00.000">Wed, 10 Jan 1900 09:00:00 +0100</cell>
                    <cell name="time_to" type="time" timezoneshort="CET" ustime="11:00" xlsdate="1900-01-10T11:00:00.000">Wed, 10 Jan 1900 11:00:00 +0100</cell>
                    <cell name="number" type="number" usnumber="2,00">2</cell>
                    <cell name="project" type="text">0000 Sonderprojekt für Bonus</cell>
                    <cell name="purpose" type="text"></cell>
                    <cell name="is_client_changed" type="bool">false</cell>
                    <cell name="purpose_internal" type="text"></cell>
                </row>
                <row>
                    <cell name="staff_name" type="text">A. Kokott</cell>
                    <cell name="work_package_name" type="text">ADM</cell>
                    <cell name="date" type="date" timezoneshort="CEST" unix="1754344800" usdate="05.08.2025" ustime="00:00" xlsdate="2025-08-05T00:00:00.000">Tue, 05 Aug 2025 00:00:00 +0200</cell>
                    <cell name="time_from" type="time" timezoneshort="CET" ustime="08:30" xlsdate="1900-01-10T08:30:00.000">Wed, 10 Jan 1900 08:30:00 +0100</cell>
                    <cell name="time_to" type="time" timezoneshort="CET" ustime="09:00" xlsdate="1900-01-10T09:00:00.000">Wed, 10 Jan 1900 09:00:00 +0100</cell>
                    <cell name="number" type="number" usnumber="0,50">0.5</cell>
                    <cell name="project" type="text">7405 VWPA-BSK-WEA-Hollfeld-Daniel-Koglin</cell>
                    <cell name="purpose" type="text">QS und Versand BSK</cell>
                    <cell name="is_client_changed" type="bool">false</cell>
                    <cell name="purpose_internal" type="text"></cell>
                </row>
                <row>
                    <cell name="staff_name" type="text">A. Kokott</cell>
                    <cell name="work_package_name" type="text">Angebote-Ausschreibungen-Kalkulationen (max. 8h/Monat pro MA)</cell>
                    <cell name="date" type="date" timezoneshort="CEST" unix="1754431200" usdate="06.08.2025" ustime="00:00" xlsdate="2025-08-06T00:00:00.000">Wed, 06 Aug 2025 00:00:00 +0200</cell>
                    <cell name="time_from" type="time" timezoneshort="CET" ustime="10:00" xlsdate="1900-01-10T10:00:00.000">Wed, 10 Jan 1900 10:00:00 +0100</cell>
                    <cell name="time_to" type="time" timezoneshort="CET" ustime="11:00" xlsdate="1900-01-10T11:00:00.000">Wed, 10 Jan 1900 11:00:00 +0100</cell>
                    <cell name="number" type="number" usnumber="1,00">1</cell>
                    <cell name="project" type="text">0000 Sonderprojekt für Bonus</cell>
                    <cell name="purpose" type="text"></cell>
                    <cell name="is_client_changed" type="bool">false</cell>
                    <cell name="purpose_internal" type="text"></cell>
                </row>
                <row>
                    <cell name="staff_name" type="text">A. Kokott</cell>
                    <cell name="work_package_name" type="text">Angebote-Ausschreibungen-Kalkulationen (max. 8h/Monat pro MA)</cell>
                    <cell name="date" type="date" timezoneshort="CEST" unix="1754517600" usdate="07.08.2025" ustime="00:00" xlsdate="2025-08-07T00:00:00.000">Thu, 07 Aug 2025 00:00:00 +0200</cell>
                    <cell name="time_from" type="time" timezoneshort="CET" ustime="16:30" xlsdate="1900-01-10T16:30:00.000">Wed, 10 Jan 1900 16:30:00 +0100</cell>
                    <cell name="time_to" type="time" timezoneshort="CET" ustime="17:30" xlsdate="1900-01-10T17:30:00.000">Wed, 10 Jan 1900 17:30:00 +0100</cell>
                    <cell name="number" type="number" usnumber="1,00">1</cell>
                    <cell name="project" type="text">0000 Sonderprojekt für Bonus</cell>
                    <cell name="purpose" type="text"></cell>
                    <cell name="is_client_changed" type="bool">false</cell>
                    <cell name="purpose_internal" type="text"></cell>
                </row>
                <row>
                    <cell name="staff_name" type="text">A. Kokott</cell>
                    <cell name="work_package_name" type="text">ADM</cell>
                    <cell name="date" type="date" timezoneshort="CEST" unix="1754517600" usdate="07.08.2025" ustime="00:00" xlsdate="2025-08-07T00:00:00.000">Thu, 07 Aug 2025 00:00:00 +0200</cell>
                    <cell name="time_from" type="time" timezoneshort="CET" ustime="16:00" xlsdate="1900-01-10T16:00:00.000">Wed, 10 Jan 1900 16:00:00 +0100</cell>
                    <cell name="time_to" type="time" timezoneshort="CET" ustime="16:30" xlsdate="1900-01-10T16:30:00.000">Wed, 10 Jan 1900 16:30:00 +0100</cell>
                    <cell name="number" type="number" usnumber="0,50">0.5</cell>
                    <cell name="project" type="text">7435 wiwi-BSK-WEA-Spiesheim-Wörrstadt-Ost</cell>
                    <cell name="purpose" type="text">QS und Versand BSK</cell>
                    <cell name="is_client_changed" type="bool">false</cell>
                    <cell name="purpose_internal" type="text"></cell>
                </row>
                <row>
                    <cell name="staff_name" type="text">A. Kokott</cell>
                    <cell name="work_package_name" type="text">ADM</cell>
                    <cell name="date" type="date" timezoneshort="CEST" unix="1754517600" usdate="07.08.2025" ustime="00:00" xlsdate="2025-08-07T00:00:00.000">Thu, 07 Aug 2025 00:00:00 +0200</cell>
                    <cell name="time_from" type="time" timezoneshort="CET" ustime="15:30" xlsdate="1900-01-10T15:30:00.000">Wed, 10 Jan 1900 15:30:00 +0100</cell>
                    <cell name="time_to" type="time" timezoneshort="CET" ustime="16:00" xlsdate="1900-01-10T16:00:00.000">Wed, 10 Jan 1900 16:00:00 +0100</cell>
                    <cell name="number" type="number" usnumber="0,50">0.5</cell>
                    <cell name="project" type="text">7422 Energieprojekte-DK-BSK-WEA-Aschbach-Ilmenau</cell>
                    <cell name="purpose" type="text">QS und Versand BSK</cell>
                    <cell name="is_client_changed" type="bool">false</cell>
                    <cell name="purpose_internal" type="text"></cell>
                </row>
                <row>
                    <cell name="staff_name" type="text">A. Kokott</cell>
                    <cell name="work_package_name" type="text">3100-Erarbeiten des Brandschutzkonzept/Nachweis/Stellungnahme (SV)</cell>
                    <cell name="date" type="date" timezoneshort="CEST" unix="1754517600" usdate="07.08.2025" ustime="00:00" xlsdate="2025-08-07T00:00:00.000">Thu, 07 Aug 2025 00:00:00 +0200</cell>
                    <cell name="time_from" type="time" timezoneshort="CET" ustime="15:15" xlsdate="1900-01-10T15:15:00.000">Wed, 10 Jan 1900 15:15:00 +0100</cell>
                    <cell name="time_to" type="time" timezoneshort="CET" ustime="15:30" xlsdate="1900-01-10T15:30:00.000">Wed, 10 Jan 1900 15:30:00 +0100</cell>
                    <cell name="number" type="number" usnumber="0,25">0.25</cell>
                    <cell name="project" type="text">5664.19 (5667.04)  KOB-BAB-Umbau-Sprinkleranlage-Lauterstr50-Wolfstein</cell>
                    <cell name="purpose" type="text">QS BST</cell>
                    <cell name="is_client_changed" type="bool">false</cell>
                    <cell name="purpose_internal" type="text"></cell>
                </row>
                <row>
                    <cell name="staff_name" type="text">A. Kokott</cell>
                    <cell name="work_package_name" type="text">(p) Pos. 1 Anp. BSK (Best. 4500008752 25-03-20)</cell>
                    <cell name="date" type="date" timezoneshort="CEST" unix="1754517600" usdate="07.08.2025" ustime="00:00" xlsdate="2025-08-07T00:00:00.000">Thu, 07 Aug 2025 00:00:00 +0200</cell>
                    <cell name="time_from" type="time" timezoneshort="CET" ustime="14:45" xlsdate="1900-01-10T14:45:00.000">Wed, 10 Jan 1900 14:45:00 +0100</cell>
                    <cell name="time_to" type="time" timezoneshort="CET" ustime="15:15" xlsdate="1900-01-10T15:15:00.000">Wed, 10 Jan 1900 15:15:00 +0100</cell>
                    <cell name="number" type="number" usnumber="0,50">0.5</cell>
                    <cell name="project" type="text">7400 JUWI-WP-div-MST </cell>
                    <cell name="purpose" type="text">QS und Versand BSK</cell>
                    <cell name="is_client_changed" type="bool">false</cell>
                    <cell name="purpose_internal" type="text"></cell>
                </row>
                <row>
                    <cell name="staff_name" type="text">A. Kokott</cell>
                    <cell name="work_package_name" type="text">(p) Pos. 1 Anp. BSK gem. RV (Best. 4500010513 25.06.27)</cell>
                    <cell name="date" type="date" timezoneshort="CEST" unix="1754517600" usdate="07.08.2025" ustime="00:00" xlsdate="2025-08-07T00:00:00.000">Thu, 07 Aug 2025 00:00:00 +0200</cell>
                    <cell name="time_from" type="time" timezoneshort="CET" ustime="14:15" xlsdate="1900-01-10T14:15:00.000">Wed, 10 Jan 1900 14:15:00 +0100</cell>
                    <cell name="time_to" type="time" timezoneshort="CET" ustime="14:45" xlsdate="1900-01-10T14:45:00.000">Wed, 10 Jan 1900 14:45:00 +0100</cell>
                    <cell name="number" type="number" usnumber="0,50">0.5</cell>
                    <cell name="project" type="text">7400 JUWI-WP-div-MST </cell>
                    <cell name="purpose" type="text">QS und Versand  BSK</cell>
                    <cell name="is_client_changed" type="bool">false</cell>
                    <cell name="purpose_internal" type="text"></cell>
                </row>
                <row>
                    <cell name="staff_name" type="text">A. Kokott</cell>
                    <cell name="work_package_name" type="text">4103-Erarbeiten Brandschutzkonzeptpläne….</cell>
                    <cell name="date" type="date" timezoneshort="CEST" unix="1754517600" usdate="07.08.2025" ustime="00:00" xlsdate="2025-08-07T00:00:00.000">Thu, 07 Aug 2025 00:00:00 +0200</cell>
                    <cell name="time_from" type="time" timezoneshort="CET" ustime="13:30" xlsdate="1900-01-10T13:30:00.000">Wed, 10 Jan 1900 13:30:00 +0100</cell>
                    <cell name="time_to" type="time" timezoneshort="CET" ustime="14:15" xlsdate="1900-01-10T14:15:00.000">Wed, 10 Jan 1900 14:15:00 +0100</cell>
                    <cell name="number" type="number" usnumber="0,75">0.75</cell>
                    <cell name="project" type="text">6313.02 BSK+BAB-Otto-Volger-Straße-Sulzbach-Limespark</cell>
                    <cell name="purpose" type="text">QS und Versand 3. Fortschreibung BSK</cell>
                    <cell name="is_client_changed" type="bool">false</cell>
                    <cell name="purpose_internal" type="text"></cell>
                </row>
                <row>
                    <cell name="staff_name" type="text">A. Kokott</cell>
                    <cell name="work_package_name" type="text">Angebote-Ausschreibungen-Kalkulationen (max. 8h/Monat pro MA)</cell>
                    <cell name="date" type="date" timezoneshort="CEST" unix="1754517600" usdate="07.08.2025" ustime="00:00" xlsdate="2025-08-07T00:00:00.000">Thu, 07 Aug 2025 00:00:00 +0200</cell>
                    <cell name="time_from" type="time" timezoneshort="CET" ustime="07:00" xlsdate="1900-01-10T07:00:00.000">Wed, 10 Jan 1900 07:00:00 +0100</cell>
                    <cell name="time_to" type="time" timezoneshort="CET" ustime="08:00" xlsdate="1900-01-10T08:00:00.000">Wed, 10 Jan 1900 08:00:00 +0100</cell>
                    <cell name="number" type="number" usnumber="1,00">1</cell>
                    <cell name="project" type="text">0000 Sonderprojekt für Bonus</cell>
                    <cell name="purpose" type="text"></cell>
                    <cell name="is_client_changed" type="bool">false</cell>
                    <cell name="purpose_internal" type="text"></cell>
                </row>
                <row>
                    <cell name="staff_name" type="text">A. Kokott</cell>
                    <cell name="work_package_name" type="text">Angebote-Ausschreibungen-Kalkulationen (max. 8h/Monat pro MA)</cell>
                    <cell name="date" type="date" timezoneshort="CEST" unix="1754863200" usdate="11.08.2025" ustime="00:00" xlsdate="2025-08-11T00:00:00.000">Mon, 11 Aug 2025 00:00:00 +0200</cell>
                    <cell name="time_from" type="time" timezoneshort="CET" ustime="10:00" xlsdate="1900-01-10T10:00:00.000">Wed, 10 Jan 1900 10:00:00 +0100</cell>
                    <cell name="time_to" type="time" timezoneshort="CET" ustime="12:00" xlsdate="1900-01-10T12:00:00.000">Wed, 10 Jan 1900 12:00:00 +0100</cell>
                    <cell name="number" type="number" usnumber="2,00">2</cell>
                    <cell name="project" type="text">0000 Sonderprojekt für Bonus</cell>
                    <cell name="purpose" type="text"></cell>
                    <cell name="is_client_changed" type="bool">false</cell>
                    <cell name="purpose_internal" type="text"></cell>
                </row>
                <row>
                    <cell name="staff_name" type="text">A. Kokott</cell>
                    <cell name="work_package_name" type="text">ADM</cell>
                    <cell name="date" type="date" timezoneshort="CEST" unix="1754863200" usdate="11.08.2025" ustime="00:00" xlsdate="2025-08-11T00:00:00.000">Mon, 11 Aug 2025 00:00:00 +0200</cell>
                    <cell name="time_from" type="time" timezoneshort="CET" ustime="09:00" xlsdate="1900-01-10T09:00:00.000">Wed, 10 Jan 1900 09:00:00 +0100</cell>
                    <cell name="time_to" type="time" timezoneshort="CET" ustime="09:30" xlsdate="1900-01-10T09:30:00.000">Wed, 10 Jan 1900 09:30:00 +0100</cell>
                    <cell name="number" type="number" usnumber="0,50">0.5</cell>
                    <cell name="project" type="text">7422 Energieprojekte-DK-BSK-WEA-Aschbach-Ilmenau</cell>
                    <cell name="purpose" type="text">QS und Versand BSK</cell>
                    <cell name="is_client_changed" type="bool">false</cell>
                    <cell name="purpose_internal" type="text"></cell>
                </row>
                <row>
                    <cell name="staff_name" type="text">A. Kokott</cell>
                    <cell name="work_package_name" type="text">3100-Erarbeiten des Brandschutzkonzept/Nachweis/Stellungnahme</cell>
                    <cell name="date" type="date" timezoneshort="CEST" unix="1754949600" usdate="12.08.2025" ustime="00:00" xlsdate="2025-08-12T00:00:00.000">Tue, 12 Aug 2025 00:00:00 +0200</cell>
                    <cell name="time_from" type="time" timezoneshort="CET" ustime="12:30" xlsdate="1900-01-10T12:30:00.000">Wed, 10 Jan 1900 12:30:00 +0100</cell>
                    <cell name="time_to" type="time" timezoneshort="CET" ustime="12:45" xlsdate="1900-01-10T12:45:00.000">Wed, 10 Jan 1900 12:45:00 +0100</cell>
                    <cell name="number" type="number" usnumber="0,25">0.25</cell>
                    <cell name="project" type="text">3943.06 TFD-BSK-EuropePlaza-Innere-Wiener-Straße17-München</cell>
                    <cell name="purpose" type="text">KOF QS und Versand</cell>
                    <cell name="is_client_changed" type="bool">false</cell>
                    <cell name="purpose_internal" type="text"></cell>
                </row>
                <row>
                    <cell name="staff_name" type="text">A. Kokott</cell>
                    <cell name="work_package_name" type="text">Einarbeitung neuer Mitarbeiter (max. 8h/Monat pro MA)</cell>
                    <cell name="date" type="date" timezoneshort="CEST" unix="1754949600" usdate="12.08.2025" ustime="00:00" xlsdate="2025-08-12T00:00:00.000">Tue, 12 Aug 2025 00:00:00 +0200</cell>
                    <cell name="time_from" type="time" timezoneshort="CET" ustime="11:00" xlsdate="1900-01-10T11:00:00.000">Wed, 10 Jan 1900 11:00:00 +0100</cell>
                    <cell name="time_to" type="time" timezoneshort="CET" ustime="12:30" xlsdate="1900-01-10T12:30:00.000">Wed, 10 Jan 1900 12:30:00 +0100</cell>
                    <cell name="number" type="number" usnumber="1,50">1.5</cell>
                    <cell name="project" type="text">0000 Sonderprojekt für Bonus</cell>
                    <cell name="purpose" type="text"></cell>
                    <cell name="is_client_changed" type="bool">false</cell>
                    <cell name="purpose_internal" type="text"></cell>
                </row>
                <row>
                    <cell name="staff_name" type="text">A. Kokott</cell>
                    <cell name="work_package_name" type="text">ADM</cell>
                    <cell name="date" type="date" timezoneshort="CEST" unix="1754949600" usdate="12.08.2025" ustime="00:00" xlsdate="2025-08-12T00:00:00.000">Tue, 12 Aug 2025 00:00:00 +0200</cell>
                    <cell name="time_from" type="time" timezoneshort="CET" ustime="10:00" xlsdate="1900-01-10T10:00:00.000">Wed, 10 Jan 1900 10:00:00 +0100</cell>
                    <cell name="time_to" type="time" timezoneshort="CET" ustime="10:30" xlsdate="1900-01-10T10:30:00.000">Wed, 10 Jan 1900 10:30:00 +0100</cell>
                    <cell name="number" type="number" usnumber="0,50">0.5</cell>
                    <cell name="project" type="text">7000.01 RES-NAT-BSK-WEA-Oberrot</cell>
                    <cell name="purpose" type="text">QS und Versand BSK</cell>
                    <cell name="is_client_changed" type="bool">false</cell>
                    <cell name="purpose_internal" type="text"></cell>
                </row>
                <row>
                    <cell name="staff_name" type="text">A. Kokott</cell>
                    <cell name="work_package_name" type="text">ADM</cell>
                    <cell name="date" type="date" timezoneshort="CEST" unix="1754949600" usdate="12.08.2025" ustime="00:00" xlsdate="2025-08-12T00:00:00.000">Tue, 12 Aug 2025 00:00:00 +0200</cell>
                    <cell name="time_from" type="time" timezoneshort="CET" ustime="09:00" xlsdate="1900-01-10T09:00:00.000">Wed, 10 Jan 1900 09:00:00 +0100</cell>
                    <cell name="time_to" type="time" timezoneshort="CET" ustime="09:30" xlsdate="1900-01-10T09:30:00.000">Wed, 10 Jan 1900 09:30:00 +0100</cell>
                    <cell name="number" type="number" usnumber="0,50">0.5</cell>
                    <cell name="project" type="text">7380.02 Qualitas-BSK-WEA-Geroldshausen-Uengershausen</cell>
                    <cell name="purpose" type="text">QS und Versand BSK</cell>
                    <cell name="is_client_changed" type="bool">false</cell>
                    <cell name="purpose_internal" type="text"></cell>
                </row>
                <row>
                    <cell name="staff_name" type="text">A. Kokott</cell>
                    <cell name="work_package_name" type="text">ADM</cell>
                    <cell name="date" type="date" timezoneshort="CEST" unix="1755036000" usdate="13.08.2025" ustime="00:00" xlsdate="2025-08-13T00:00:00.000">Wed, 13 Aug 2025 00:00:00 +0200</cell>
                    <cell name="time_from" type="time" timezoneshort="CET" ustime="11:30" xlsdate="1900-01-10T11:30:00.000">Wed, 10 Jan 1900 11:30:00 +0100</cell>
                    <cell name="time_to" type="time" timezoneshort="CET" ustime="12:00" xlsdate="1900-01-10T12:00:00.000">Wed, 10 Jan 1900 12:00:00 +0100</cell>
                    <cell name="number" type="number" usnumber="0,50">0.5</cell>
                    <cell name="project" type="text">4249.12 Apleona-BSK-Geb10+11-Am-Keltenwald-Ehningen</cell>
                    <cell name="purpose" type="text">Projektmanagment</cell>
                    <cell name="is_client_changed" type="bool">false</cell>
                    <cell name="purpose_internal" type="text"></cell>
                </row>
                <row>
                    <cell name="staff_name" type="text">A. Kokott</cell>
                    <cell name="work_package_name" type="text">ADM</cell>
                    <cell name="date" type="date" timezoneshort="CEST" unix="1755036000" usdate="13.08.2025" ustime="00:00" xlsdate="2025-08-13T00:00:00.000">Wed, 13 Aug 2025 00:00:00 +0200</cell>
                    <cell name="time_from" type="time" timezoneshort="CET" ustime="11:00" xlsdate="1900-01-10T11:00:00.000">Wed, 10 Jan 1900 11:00:00 +0100</cell>
                    <cell name="time_to" type="time" timezoneshort="CET" ustime="11:30" xlsdate="1900-01-10T11:30:00.000">Wed, 10 Jan 1900 11:30:00 +0100</cell>
                    <cell name="number" type="number" usnumber="0,50">0.5</cell>
                    <cell name="project" type="text">7444 Energieprojekte-DK-BSK-WEA-Schußbachwald</cell>
                    <cell name="purpose" type="text">Projektmangment</cell>
                    <cell name="is_client_changed" type="bool">false</cell>
                    <cell name="purpose_internal" type="text"></cell>
                </row>
                <row>
                    <cell name="staff_name" type="text">A. Kokott</cell>
                    <cell name="work_package_name" type="text">ADM (nicht kalkuliert)</cell>
                    <cell name="date" type="date" timezoneshort="CEST" unix="1755036000" usdate="13.08.2025" ustime="00:00" xlsdate="2025-08-13T00:00:00.000">Wed, 13 Aug 2025 00:00:00 +0200</cell>
                    <cell name="time_from" type="time" timezoneshort="CET" ustime="10:30" xlsdate="1900-01-10T10:30:00.000">Wed, 10 Jan 1900 10:30:00 +0100</cell>
                    <cell name="time_to" type="time" timezoneshort="CET" ustime="11:00" xlsdate="1900-01-10T11:00:00.000">Wed, 10 Jan 1900 11:00:00 +0100</cell>
                    <cell name="number" type="number" usnumber="0,50">0.5</cell>
                    <cell name="project" type="text">7482 Telehouse-BSK-TDE-Campus-Kleyerstraße-FFM-übergeordnetes-BSK</cell>
                    <cell name="purpose" type="text">Projektmanagment</cell>
                    <cell name="is_client_changed" type="bool">false</cell>
                    <cell name="purpose_internal" type="text"></cell>
                </row>
                <row>
                    <cell name="staff_name" type="text">A. Kokott</cell>
                    <cell name="work_package_name" type="text">ADM</cell>
                    <cell name="date" type="date" timezoneshort="CEST" unix="1755036000" usdate="13.08.2025" ustime="00:00" xlsdate="2025-08-13T00:00:00.000">Wed, 13 Aug 2025 00:00:00 +0200</cell>
                    <cell name="time_from" type="time" timezoneshort="CET" ustime="10:00" xlsdate="1900-01-10T10:00:00.000">Wed, 10 Jan 1900 10:00:00 +0100</cell>
                    <cell name="time_to" type="time" timezoneshort="CET" ustime="10:30" xlsdate="1900-01-10T10:30:00.000">Wed, 10 Jan 1900 10:30:00 +0100</cell>
                    <cell name="number" type="number" usnumber="0,50">0.5</cell>
                    <cell name="project" type="text">7355.01 Pfizer-BSK-Umnutzung-Mooswaldallee-1-Freiburg-Geb-K</cell>
                    <cell name="purpose" type="text">Projektmanagment</cell>
                    <cell name="is_client_changed" type="bool">false</cell>
                    <cell name="purpose_internal" type="text"></cell>
                </row>
                <row>
                    <cell name="staff_name" type="text">A. Kokott</cell>
                    <cell name="work_package_name" type="text">3100-Erarbeiten des Brandschutzkonzept/Nachweis/Stellungnahme</cell>
                    <cell name="date" type="date" timezoneshort="CEST" unix="1755036000" usdate="13.08.2025" ustime="00:00" xlsdate="2025-08-13T00:00:00.000">Wed, 13 Aug 2025 00:00:00 +0200</cell>
                    <cell name="time_from" type="time" timezoneshort="CET" ustime="09:00" xlsdate="1900-01-10T09:00:00.000">Wed, 10 Jan 1900 09:00:00 +0100</cell>
                    <cell name="time_to" type="time" timezoneshort="CET" ustime="09:30" xlsdate="1900-01-10T09:30:00.000">Wed, 10 Jan 1900 09:30:00 +0100</cell>
                    <cell name="number" type="number" usnumber="0,50">0.5</cell>
                    <cell name="project" type="text">7370.02 LAER-formica-BSK-Garagenpark-Willi-Melchers-Straße-Lünen-NB-Hallenreihen</cell>
                    <cell name="purpose" type="text">QS und Versand BSK</cell>
                    <cell name="is_client_changed" type="bool">false</cell>
                    <cell name="purpose_internal" type="text"></cell>
                </row>
                <row>
                    <cell name="staff_name" type="text">A. Kokott</cell>
                    <cell name="work_package_name" type="text">ADM</cell>
                    <cell name="date" type="date" timezoneshort="CEST" unix="1755122400" usdate="14.08.2025" ustime="00:00" xlsdate="2025-08-14T00:00:00.000">Thu, 14 Aug 2025 00:00:00 +0200</cell>
                    <cell name="time_from" type="time" timezoneshort="CET" ustime="12:30" xlsdate="1900-01-10T12:30:00.000">Wed, 10 Jan 1900 12:30:00 +0100</cell>
                    <cell name="time_to" type="time" timezoneshort="CET" ustime="13:00" xlsdate="1900-01-10T13:00:00.000">Wed, 10 Jan 1900 13:00:00 +0100</cell>
                    <cell name="number" type="number" usnumber="0,50">0.5</cell>
                    <cell name="project" type="text">7478 WindBauer-BSK-WEA-Hofstett</cell>
                    <cell name="purpose" type="text">Projektmanagment</cell>
                    <cell name="is_client_changed" type="bool">false</cell>
                    <cell name="purpose_internal" type="text"></cell>
                </row>
                <row>
                    <cell name="staff_name" type="text">A. Kokott</cell>
                    <cell name="work_package_name" type="text">ADM</cell>
                    <cell name="date" type="date" timezoneshort="CEST" unix="1755122400" usdate="14.08.2025" ustime="00:00" xlsdate="2025-08-14T00:00:00.000">Thu, 14 Aug 2025 00:00:00 +0200</cell>
                    <cell name="time_from" type="time" timezoneshort="CET" ustime="12:00" xlsdate="1900-01-10T12:00:00.000">Wed, 10 Jan 1900 12:00:00 +0100</cell>
                    <cell name="time_to" type="time" timezoneshort="CET" ustime="12:30" xlsdate="1900-01-10T12:30:00.000">Wed, 10 Jan 1900 12:30:00 +0100</cell>
                    <cell name="number" type="number" usnumber="0,50">0.5</cell>
                    <cell name="project" type="text">7477 WindBauer-BSK-WEA-Waldhausen</cell>
                    <cell name="purpose" type="text">Projektmanagment</cell>
                    <cell name="is_client_changed" type="bool">false</cell>
                    <cell name="purpose_internal" type="text"></cell>
                </row>
                <row>
                    <cell name="staff_name" type="text">A. Kokott</cell>
                    <cell name="work_package_name" type="text">ADM</cell>
                    <cell name="date" type="date" timezoneshort="CEST" unix="1755122400" usdate="14.08.2025" ustime="00:00" xlsdate="2025-08-14T00:00:00.000">Thu, 14 Aug 2025 00:00:00 +0200</cell>
                    <cell name="time_from" type="time" timezoneshort="CET" ustime="11:00" xlsdate="1900-01-10T11:00:00.000">Wed, 10 Jan 1900 11:00:00 +0100</cell>
                    <cell name="time_to" type="time" timezoneshort="CET" ustime="11:15" xlsdate="1900-01-10T11:15:00.000">Wed, 10 Jan 1900 11:15:00 +0100</cell>
                    <cell name="number" type="number" usnumber="0,25">0.25</cell>
                    <cell name="project" type="text">7485 Hijran-Sohrab-BSK-Europaplatz10-BKR</cell>
                    <cell name="purpose" type="text">QS BST</cell>
                    <cell name="is_client_changed" type="bool">false</cell>
                    <cell name="purpose_internal" type="text"></cell>
                </row>
                <row>
                    <cell name="staff_name" type="text">A. Kokott</cell>
                    <cell name="work_package_name" type="text">ADM</cell>
                    <cell name="date" type="date" timezoneshort="CEST" unix="1755122400" usdate="14.08.2025" ustime="00:00" xlsdate="2025-08-14T00:00:00.000">Thu, 14 Aug 2025 00:00:00 +0200</cell>
                    <cell name="time_from" type="time" timezoneshort="CET" ustime="10:00" xlsdate="1900-01-10T10:00:00.000">Wed, 10 Jan 1900 10:00:00 +0100</cell>
                    <cell name="time_to" type="time" timezoneshort="CET" ustime="10:30" xlsdate="1900-01-10T10:30:00.000">Wed, 10 Jan 1900 10:30:00 +0100</cell>
                    <cell name="number" type="number" usnumber="0,50">0.5</cell>
                    <cell name="project" type="text">2032.061 aam2core-FRP-Halbergstraße1-LU</cell>
                    <cell name="purpose" type="text">Projektmanagment</cell>
                    <cell name="is_client_changed" type="bool">false</cell>
                    <cell name="purpose_internal" type="text"></cell>
                </row>
                <row>
                    <cell name="staff_name" type="text">A. Kokott</cell>
                    <cell name="work_package_name" type="text">5000-Ausführungsplanung</cell>
                    <cell name="date" type="date" timezoneshort="CEST" unix="1755468000" usdate="18.08.2025" ustime="00:00" xlsdate="2025-08-18T00:00:00.000">Mon, 18 Aug 2025 00:00:00 +0200</cell>
                    <cell name="time_from" type="time" timezoneshort="CET" ustime="11:00" xlsdate="1900-01-10T11:00:00.000">Wed, 10 Jan 1900 11:00:00 +0100</cell>
                    <cell name="time_to" type="time" timezoneshort="CET" ustime="11:30" xlsdate="1900-01-10T11:30:00.000">Wed, 10 Jan 1900 11:30:00 +0100</cell>
                    <cell name="number" type="number" usnumber="0,50">0.5</cell>
                    <cell name="project" type="text">6712.011 Züblin-Strabag-NA02-LP5-BTB-Waldstr6-10-Weiterstadt</cell>
                    <cell name="purpose" type="text">Projektmanagment</cell>
                    <cell name="is_client_changed" type="bool">false</cell>
                    <cell name="purpose_internal" type="text"></cell>
                </row>
                <row>
                    <cell name="staff_name" type="text">A. Kokott</cell>
                    <cell name="work_package_name" type="text">ADM</cell>
                    <cell name="date" type="date" timezoneshort="CEST" unix="1755468000" usdate="18.08.2025" ustime="00:00" xlsdate="2025-08-18T00:00:00.000">Mon, 18 Aug 2025 00:00:00 +0200</cell>
                    <cell name="time_from" type="time" timezoneshort="CET" ustime="10:00" xlsdate="1900-01-10T10:00:00.000">Wed, 10 Jan 1900 10:00:00 +0100</cell>
                    <cell name="time_to" type="time" timezoneshort="CET" ustime="10:30" xlsdate="1900-01-10T10:30:00.000">Wed, 10 Jan 1900 10:30:00 +0100</cell>
                    <cell name="number" type="number" usnumber="0,50">0.5</cell>
                    <cell name="project" type="text">5395.04 Burkhardt-Witteler-BSK-Gesundheitszentrum-Industriestr17-Ladenburg</cell>
                    <cell name="purpose" type="text">Projektmangment</cell>
                    <cell name="is_client_changed" type="bool">false</cell>
                    <cell name="purpose_internal" type="text"></cell>
                </row>
                <row>
                    <cell name="staff_name" type="text">A. Kokott</cell>
                    <cell name="work_package_name" type="text">ADM</cell>
                    <cell name="date" type="date" timezoneshort="CEST" unix="1755468000" usdate="18.08.2025" ustime="00:00" xlsdate="2025-08-18T00:00:00.000">Mon, 18 Aug 2025 00:00:00 +0200</cell>
                    <cell name="time_from" type="time" timezoneshort="CET" ustime="09:30" xlsdate="1900-01-10T09:30:00.000">Wed, 10 Jan 1900 09:30:00 +0100</cell>
                    <cell name="time_to" type="time" timezoneshort="CET" ustime="10:00" xlsdate="1900-01-10T10:00:00.000">Wed, 10 Jan 1900 10:00:00 +0100</cell>
                    <cell name="number" type="number" usnumber="0,50">0.5</cell>
                    <cell name="project" type="text">7419.03 Zech-BSO-Sporthalle-Pestalozzistr10-Eppelheim</cell>
                    <cell name="purpose" type="text">Projektmanagment</cell>
                    <cell name="is_client_changed" type="bool">false</cell>
                    <cell name="purpose_internal" type="text"></cell>
                </row>
                <row>
                    <cell name="staff_name" type="text">A. Kokott</cell>
                    <cell name="work_package_name" type="text">ADM</cell>
                    <cell name="date" type="date" timezoneshort="CEST" unix="1755468000" usdate="18.08.2025" ustime="00:00" xlsdate="2025-08-18T00:00:00.000">Mon, 18 Aug 2025 00:00:00 +0200</cell>
                    <cell name="time_from" type="time" timezoneshort="CET" ustime="09:00" xlsdate="1900-01-10T09:00:00.000">Wed, 10 Jan 1900 09:00:00 +0100</cell>
                    <cell name="time_to" type="time" timezoneshort="CET" ustime="09:30" xlsdate="1900-01-10T09:30:00.000">Wed, 10 Jan 1900 09:30:00 +0100</cell>
                    <cell name="number" type="number" usnumber="0,50">0.5</cell>
                    <cell name="project" type="text">7486 wiwi-BSK-WEA-Mainz-Hechtsheim</cell>
                    <cell name="purpose" type="text">Projektmanagment</cell>
                    <cell name="is_client_changed" type="bool">false</cell>
                    <cell name="purpose_internal" type="text"></cell>
                </row>
                <row>
                    <cell name="staff_name" type="text">A. Kokott</cell>
                    <cell name="work_package_name" type="text">ADM</cell>
                    <cell name="date" type="date" timezoneshort="CEST" unix="1755554400" usdate="19.08.2025" ustime="00:00" xlsdate="2025-08-19T00:00:00.000">Tue, 19 Aug 2025 00:00:00 +0200</cell>
                    <cell name="time_from" type="time" timezoneshort="CET" ustime="10:00" xlsdate="1900-01-10T10:00:00.000">Wed, 10 Jan 1900 10:00:00 +0100</cell>
                    <cell name="time_to" type="time" timezoneshort="CET" ustime="10:30" xlsdate="1900-01-10T10:30:00.000">Wed, 10 Jan 1900 10:30:00 +0100</cell>
                    <cell name="number" type="number" usnumber="0,50">0.5</cell>
                    <cell name="project" type="text">5395.04 Burkhardt-Witteler-BSK-Gesundheitszentrum-Industriestr17-Ladenburg</cell>
                    <cell name="purpose" type="text">QS Vorabzug BSK</cell>
                    <cell name="is_client_changed" type="bool">false</cell>
                    <cell name="purpose_internal" type="text"></cell>
                </row>
                <row>
                    <cell name="staff_name" type="text">A. Kokott</cell>
                    <cell name="work_package_name" type="text">9101-Fortschreibung Brandschutzkonzept….</cell>
                    <cell name="date" type="date" timezoneshort="CEST" unix="1755640800" usdate="20.08.2025" ustime="00:00" xlsdate="2025-08-20T00:00:00.000">Wed, 20 Aug 2025 00:00:00 +0200</cell>
                    <cell name="time_from" type="time" timezoneshort="CET" ustime="09:00" xlsdate="1900-01-10T09:00:00.000">Wed, 10 Jan 1900 09:00:00 +0100</cell>
                    <cell name="time_to" type="time" timezoneshort="CET" ustime="09:30" xlsdate="1900-01-10T09:30:00.000">Wed, 10 Jan 1900 09:30:00 +0100</cell>
                    <cell name="number" type="number" usnumber="0,50">0.5</cell>
                    <cell name="project" type="text">5607.05 BAB-NB-J4-Zentralinstitut-für-seelische-Gesundheit-Mannheim</cell>
                    <cell name="purpose" type="text">QS und Versand BSK</cell>
                    <cell name="is_client_changed" type="bool">false</cell>
                    <cell name="purpose_internal" type="text"></cell>
                </row>
                <row>
                    <cell name="staff_name" type="text">A. Kokott</cell>
                    <cell name="work_package_name" type="text">ADM</cell>
                    <cell name="date" type="date" timezoneshort="CEST" unix="1756072800" usdate="25.08.2025" ustime="00:00" xlsdate="2025-08-25T00:00:00.000">Mon, 25 Aug 2025 00:00:00 +0200</cell>
                    <cell name="time_from" type="time" timezoneshort="CET" ustime="11:30" xlsdate="1900-01-10T11:30:00.000">Wed, 10 Jan 1900 11:30:00 +0100</cell>
                    <cell name="time_to" type="time" timezoneshort="CET" ustime="12:00" xlsdate="1900-01-10T12:00:00.000">Wed, 10 Jan 1900 12:00:00 +0100</cell>
                    <cell name="number" type="number" usnumber="0,50">0.5</cell>
                    <cell name="project" type="text">3258.30 Öztürk-FRP-DQ-Pilates-Studio-Marktstr1-3-Stuttgart</cell>
                    <cell name="purpose" type="text">Projektmanagment</cell>
                    <cell name="is_client_changed" type="bool">false</cell>
                    <cell name="purpose_internal" type="text"></cell>
                </row>
                <row>
                    <cell name="staff_name" type="text">A. Kokott</cell>
                    <cell name="work_package_name" type="text">Einarbeitung neuer Mitarbeiter (max. 8h/Monat pro MA)</cell>
                    <cell name="date" type="date" timezoneshort="CEST" unix="1756072800" usdate="25.08.2025" ustime="00:00" xlsdate="2025-08-25T00:00:00.000">Mon, 25 Aug 2025 00:00:00 +0200</cell>
                    <cell name="time_from" type="time" timezoneshort="CET" ustime="10:00" xlsdate="1900-01-10T10:00:00.000">Wed, 10 Jan 1900 10:00:00 +0100</cell>
                    <cell name="time_to" type="time" timezoneshort="CET" ustime="11:30" xlsdate="1900-01-10T11:30:00.000">Wed, 10 Jan 1900 11:30:00 +0100</cell>
                    <cell name="number" type="number" usnumber="1,50">1.5</cell>
                    <cell name="project" type="text">0000 Sonderprojekt für Bonus</cell>
                    <cell name="purpose" type="text"></cell>
                    <cell name="is_client_changed" type="bool">false</cell>
                    <cell name="purpose_internal" type="text"></cell>
                </row>
                <row>
                    <cell name="staff_name" type="text">A. Kokott</cell>
                    <cell name="work_package_name" type="text">(p) NAT03-Bestandsaufnahme (Ist-Aufnahme)</cell>
                    <cell name="date" type="date" timezoneshort="CEST" unix="1756072800" usdate="25.08.2025" ustime="00:00" xlsdate="2025-08-25T00:00:00.000">Mon, 25 Aug 2025 00:00:00 +0200</cell>
