<?xml version="1.0" encoding="UTF-8"?>
<!DOCTYPE xml [<!ENTITY shy "&#173;">]>
<preprocessedreport xmlns:addi="http://www.untermstrich.com/web/addi/">
    <head>
        <title id="b_timekeyword" format="A4" orientation="landscape">Zeitraum / Stichwort</title>
        <date type="date" timezoneshort="CET" unix="-2208992400" usdate="" ustime="" xlsdate="1900-01-01T00:00:00.000">Mon, 01 Jan 1900 00:00:00 +0100</date>
        <company>
            <line1 type="text">Endreß Ingenieurgesellschaft mbH Brandschutzsachverständige</line1>
            <line2 type="text">Siemensstraße 6</line2>
            <line3 type="text">61352 Bad Homburg v.d. Höhe</line3>
        </company>
        <columns>
            <total>
                <field name="number" type="number" width="13">Gesamtsumme</field>
            </total>
            <group by="staff_name" order="TRUE">
                <field name="staff_name" type="string" width="25">Mitarbeiter</field>
                <field name="work_package_name" type="string" width="40">Bereich</field>
                <field name="date" type="date" width="20">Datum</field>
                <field name="time_from" type="time" width="15">Von</field>
                <field name="time_to" type="time" width="15">Bis</field>
                <field name="number" type="number" width="17">Summe</field>
                <field name="project" type="string" width="50">Projekt</field>
                <field name="purpose" type="string" width="60">Leistung</field>
                <field name="is_client_changed" type="bool" width="5">Kunden&shy;änderung</field>
                <field name="purpose_internal" type="string" width="15">Bürointerne Informationen</field>
                <total>
                    <field name="number" type="number" width="13">Mitarbeitersumme</field>
                </total>
            </group>
        </columns>
        <filters>
            <filter name="print_user" title="C. Trapp SV">C. Trapp SV</filter>
            <filter name="print_date" title="01.12.2025">01.12.2025</filter>
            <filter name="print_datetime" title="01.12.2025 22:39">01.12.2025 22:39</filter>
            <filter name="print_serial" title="W049-A100-S75791">W049-A100-S75791</filter>
            <filter name="print_serial1" title="Endreß Ingenieurgesellschaft mbH Brandschutzsachverständige">Endreß Ingenieurgesellschaft mbH Brandschutzsachverständige</filter>
            <filter name="print_serial2" title="Siemensstraße 6">Siemensstraße 6</filter>
            <filter name="print_serial3" title="61352 Bad Homburg v.d. Höhe">61352 Bad Homburg v.d. Höhe</filter>
            <filter name="print_user" title="C. Trapp SV">C. Trapp SV</filter>
            <filter name="print_date" title="01.12.2025">01.12.2025</filter>
            <filter name="print_datetime" title="01.12.2025 22:39">01.12.2025 22:39</filter>
            <filter name="print_serial" title="W049-A100-S75791">W049-A100-S75791</filter>
            <filter name="print_serial1" title="Endreß Ingenieurgesellschaft mbH Brandschutzsachverständige">Endreß Ingenieurgesellschaft mbH Brandschutzsachverständige</filter>
            <filter name="print_serial2" title="Siemensstraße 6">Siemensstraße 6</filter>
            <filter name="print_serial3" title="61352 Bad Homburg v.d. Höhe">61352 Bad Homburg v.d. Höhe</filter>
            <filter name="date" title="Von">01.10.2025 - 30.11.2025</filter>
            <filter name="staff__staff_group" title="Mitarbeitergruppe">LUD</filter>
        </filters>
    </head>
    <data>
        <grouped by="staff_name" level="0">
            <values for="A. Kokott">
                <row>
                    <cell name="staff_name" type="text">A. Kokott</cell>
                    <cell name="work_package_name" type="text">Angebote-Ausschreibungen-Kalkulationen (max. 8h/Monat pro MA)</cell>
                    <cell name="date" type="date" timezoneshort="CEST" unix="1759269600" usdate="01.10.2025" ustime="00:00" xlsdate="2025-10-01T00:00:00.000">Wed, 01 Oct 2025 00:00:00 +0200</cell>
                    <cell name="time_from" type="time" timezoneshort="CET" ustime="09:00" xlsdate="1900-01-10T09:00:00.000">Wed, 10 Jan 1900 09:00:00 +0100</cell>
                    <cell name="time_to" type="time" timezoneshort="CET" ustime="12:00" xlsdate="1900-01-10T12:00:00.000">Wed, 10 Jan 1900 12:00:00 +0100</cell>
                    <cell name="number" type="number" usnumber="3,00">3</cell>
                    <cell name="project" type="text">0000 Sonderprojekt für Bonus</cell>
                    <cell name="purpose" type="text"></cell>
                    <cell name="is_client_changed" type="bool">false</cell>
                    <cell name="purpose_internal" type="text"></cell>
                </row>
                <row>
                    <cell name="staff_name" type="text">A. Kokott</cell>
                    <cell name="work_package_name" type="text">ADM</cell>
                    <cell name="date" type="date" timezoneshort="CEST" unix="1760911200" usdate="20.10.2025" ustime="00:00" xlsdate="2025-10-20T00:00:00.000">Mon, 20 Oct 2025 00:00:00 +0200</cell>
                    <cell name="time_from" type="time" timezoneshort="CET" ustime="12:30" xlsdate="1900-01-10T12:30:00.000">Wed, 10 Jan 1900 12:30:00 +0100</cell>
                    <cell name="time_to" type="time" timezoneshort="CET" ustime="13:00" xlsdate="1900-01-10T13:00:00.000">Wed, 10 Jan 1900 13:00:00 +0100</cell>
                    <cell name="number" type="number" usnumber="0,50">0.5</cell>
                    <cell name="project" type="text">1257.08 Elektro-Krück-Überprüfung-FWP-Geb-7915-Germersheim</cell>
                    <cell name="purpose" type="text">Projektmanagment</cell>
                    <cell name="is_client_changed" type="bool">false</cell>
                    <cell name="purpose_internal" type="text"></cell>
                </row>
                <row>
                    <cell name="staff_name" type="text">A. Kokott</cell>
                    <cell name="work_package_name" type="text">ADM</cell>
                    <cell name="date" type="date" timezoneshort="CEST" unix="1760911200" usdate="20.10.2025" ustime="00:00" xlsdate="2025-10-20T00:00:00.000">Mon, 20 Oct 2025 00:00:00 +0200</cell>
                    <cell name="time_from" type="time" timezoneshort="CET" ustime="08:00" xlsdate="1900-01-10T08:00:00.000">Wed, 10 Jan 1900 08:00:00 +0100</cell>
                    <cell name="time_to" type="time" timezoneshort="CET" ustime="08:30" xlsdate="1900-01-10T08:30:00.000">Wed, 10 Jan 1900 08:30:00 +0100</cell>
                    <cell name="number" type="number" usnumber="0,50">0.5</cell>
                    <cell name="project" type="text">7213.01 SW-Wertheim-BSK-WEA-Schenkenwald-II</cell>
                    <cell name="purpose" type="text">Projektmanagment</cell>
                    <cell name="is_client_changed" type="bool">false</cell>
                    <cell name="purpose_internal" type="text"></cell>
                </row>
                <row>
                    <cell name="staff_name" type="text">A. Kokott</cell>
                    <cell name="work_package_name" type="text">0100-Anlage Projekt, Angebot, Versand, Auftrag</cell>
                    <cell name="date" type="date" timezoneshort="CEST" unix="1760911200" usdate="20.10.2025" ustime="00:00" xlsdate="2025-10-20T00:00:00.000">Mon, 20 Oct 2025 00:00:00 +0200</cell>
                    <cell name="time_from" type="time" timezoneshort="CET" ustime="09:00" xlsdate="1900-01-10T09:00:00.000">Wed, 10 Jan 1900 09:00:00 +0100</cell>
                    <cell name="time_to" type="time" timezoneshort="CET" ustime="09:30" xlsdate="1900-01-10T09:30:00.000">Wed, 10 Jan 1900 09:30:00 +0100</cell>
                    <cell name="number" type="number" usnumber="0,50">0.5</cell>
                    <cell name="project" type="text">4547.04 KIT-BSK-EnergyLab-Bau668-Hermann von Helmholtz-Platz1-Eggenstein-Leopoldshafen</cell>
                    <cell name="purpose" type="text">Projektmanagment</cell>
                    <cell name="is_client_changed" type="bool">false</cell>
                    <cell name="purpose_internal" type="text"></cell>
                </row>
                <row>
                    <cell name="staff_name" type="text">A. Kokott</cell>
                    <cell name="work_package_name" type="text">Anlage Projekt, Angebot, Versand, Auftrag (ADM)</cell>
                    <cell name="date" type="date" timezoneshort="CEST" unix="1760911200" usdate="20.10.2025" ustime="00:00" xlsdate="2025-10-20T00:00:00.000">Mon, 20 Oct 2025 00:00:00 +0200</cell>
                    <cell name="time_from" type="time" timezoneshort="CET" ustime="10:00" xlsdate="1900-01-10T10:00:00.000">Wed, 10 Jan 1900 10:00:00 +0100</cell>
                    <cell name="time_to" type="time" timezoneshort="CET" ustime="10:30" xlsdate="1900-01-10T10:30:00.000">Wed, 10 Jan 1900 10:30:00 +0100</cell>
                    <cell name="number" type="number" usnumber="0,50">0.5</cell>
                    <cell name="project" type="text">7324.01 DREP-BSK-Umbau-Lederfabrik-in-Wohngebäude-Hülsbachweg10-Kirn</cell>
                    <cell name="purpose" type="text">Projektmanagment</cell>
                    <cell name="is_client_changed" type="bool">false</cell>
                    <cell name="purpose_internal" type="text"></cell>
                </row>
                <row>
                    <cell name="staff_name" type="text">A. Kokott</cell>
                    <cell name="work_package_name" type="text">ADM</cell>
                    <cell name="date" type="date" timezoneshort="CEST" unix="1760911200" usdate="20.10.2025" ustime="00:00" xlsdate="2025-10-20T00:00:00.000">Mon, 20 Oct 2025 00:00:00 +0200</cell>
                    <cell name="time_from" type="time" timezoneshort="CET" ustime="10:30" xlsdate="1900-01-10T10:30:00.000">Wed, 10 Jan 1900 10:30:00 +0100</cell>
                    <cell name="time_to" type="time" timezoneshort="CET" ustime="11:00" xlsdate="1900-01-10T11:00:00.000">Wed, 10 Jan 1900 11:00:00 +0100</cell>
                    <cell name="number" type="number" usnumber="0,50">0.5</cell>
                    <cell name="project" type="text">7601 Klink-FWP-Industriestr44-Waldmohr</cell>
                    <cell name="purpose" type="text">Projektmanagment</cell>
                    <cell name="is_client_changed" type="bool">false</cell>
                    <cell name="purpose_internal" type="text"></cell>
                </row>
                <row>
                    <cell name="staff_name" type="text">A. Kokott</cell>
                    <cell name="work_package_name" type="text">0100-Anlage Projekt, Angebot, Versand, Auftrag (SV)</cell>
                    <cell name="date" type="date" timezoneshort="CEST" unix="1760911200" usdate="20.10.2025" ustime="00:00" xlsdate="2025-10-20T00:00:00.000">Mon, 20 Oct 2025 00:00:00 +0200</cell>
                    <cell name="time_from" type="time" timezoneshort="CET" ustime="11:00" xlsdate="1900-01-10T11:00:00.000">Wed, 10 Jan 1900 11:00:00 +0100</cell>
                    <cell name="time_to" type="time" timezoneshort="CET" ustime="11:30" xlsdate="1900-01-10T11:30:00.000">Wed, 10 Jan 1900 11:30:00 +0100</cell>
                    <cell name="number" type="number" usnumber="0,50">0.5</cell>
                    <cell name="project" type="text">7602 1100-Architekten-MBS-Cafeteria-US-Wohngeb-Bundesbank-FFM</cell>
                    <cell name="purpose" type="text">Projektmanagment</cell>
                    <cell name="is_client_changed" type="bool">false</cell>
                    <cell name="purpose_internal" type="text"></cell>
                </row>
                <row>
                    <cell name="staff_name" type="text">A. Kokott</cell>
                    <cell name="work_package_name" type="text">ADM (nicht kalkuliert)</cell>
                    <cell name="date" type="date" timezoneshort="CEST" unix="1760911200" usdate="20.10.2025" ustime="00:00" xlsdate="2025-10-20T00:00:00.000">Mon, 20 Oct 2025 00:00:00 +0200</cell>
                    <cell name="time_from" type="time" timezoneshort="CET" ustime="11:30" xlsdate="1900-01-10T11:30:00.000">Wed, 10 Jan 1900 11:30:00 +0100</cell>
                    <cell name="time_to" type="time" timezoneshort="CET" ustime="12:00" xlsdate="1900-01-10T12:00:00.000">Wed, 10 Jan 1900 12:00:00 +0100</cell>
                    <cell name="number" type="number" usnumber="0,50">0.5</cell>
                    <cell name="project" type="text">5834.08 Fuchs-FLK-Werner-HeisenbergStr1-KL</cell>
                    <cell name="purpose" type="text">Projektmanagment</cell>
                    <cell name="is_client_changed" type="bool">false</cell>
                    <cell name="purpose_internal" type="text"></cell>
                </row>
                <row>
                    <cell name="staff_name" type="text">A. Kokott</cell>
                    <cell name="work_package_name" type="text">8100-Prüfen der Ausführung auf prinzipielle Übereinstimmung (Stufe 1)....</cell>
                    <cell name="date" type="date" timezoneshort="CEST" unix="1760997600" usdate="21.10.2025" ustime="00:00" xlsdate="2025-10-21T00:00:00.000">Tue, 21 Oct 2025 00:00:00 +0200</cell>
                    <cell name="time_from" type="time" timezoneshort="CET" ustime="08:00" xlsdate="1900-01-10T08:00:00.000">Wed, 10 Jan 1900 08:00:00 +0100</cell>
                    <cell name="time_to" type="time" timezoneshort="CET" ustime="08:15" xlsdate="1900-01-10T08:15:00.000">Wed, 10 Jan 1900 08:15:00 +0100</cell>
                    <cell name="number" type="number" usnumber="0,25">0.25</cell>
                    <cell name="project" type="text">5640.06 Erhard+Stern-BAB-EppelheimerStr8-Heidelberg</cell>
                    <cell name="purpose" type="text">QS und Versand KOF</cell>
                    <cell name="is_client_changed" type="bool">false</cell>
                    <cell name="purpose_internal" type="text"></cell>
                </row>
                <row>
                    <cell name="staff_name" type="text">A. Kokott</cell>
                    <cell name="work_package_name" type="text">Angebote-Ausschreibungen-Kalkulationen (max. 8h/Monat pro MA)</cell>
                    <cell name="date" type="date" timezoneshort="CEST" unix="1760997600" usdate="21.10.2025" ustime="00:00" xlsdate="2025-10-21T00:00:00.000">Tue, 21 Oct 2025 00:00:00 +0200</cell>
                    <cell name="time_from" type="time" timezoneshort="CET" ustime="08:15" xlsdate="1900-01-10T08:15:00.000">Wed, 10 Jan 1900 08:15:00 +0100</cell>
                    <cell name="time_to" type="time" timezoneshort="CET" ustime="10:15" xlsdate="1900-01-10T10:15:00.000">Wed, 10 Jan 1900 10:15:00 +0100</cell>
                    <cell name="number" type="number" usnumber="2,00">2</cell>
                    <cell name="project" type="text">0000 Sonderprojekt für Bonus</cell>
                    <cell name="purpose" type="text"></cell>
                    <cell name="is_client_changed" type="bool">false</cell>
                    <cell name="purpose_internal" type="text"></cell>
                </row>
                <row>
                    <cell name="staff_name" type="text">A. Kokott</cell>
                    <cell name="work_package_name" type="text">Angebote-Ausschreibungen-Kalkulationen (max. 8h/Monat pro MA)</cell>
                    <cell name="date" type="date" timezoneshort="CEST" unix="1761084000" usdate="22.10.2025" ustime="00:00" xlsdate="2025-10-22T00:00:00.000">Wed, 22 Oct 2025 00:00:00 +0200</cell>
                    <cell name="time_from" type="time" timezoneshort="CET" ustime="08:00" xlsdate="1900-01-10T08:00:00.000">Wed, 10 Jan 1900 08:00:00 +0100</cell>
                    <cell name="time_to" type="time" timezoneshort="CET" ustime="10:00" xlsdate="1900-01-10T10:00:00.000">Wed, 10 Jan 1900 10:00:00 +0100</cell>
                    <cell name="number" type="number" usnumber="2,00">2</cell>
                    <cell name="project" type="text">0000 Sonderprojekt für Bonus</cell>
                    <cell name="purpose" type="text"></cell>
                    <cell name="is_client_changed" type="bool">false</cell>
                    <cell name="purpose_internal" type="text"></cell>
                </row>
                <row>
                    <cell name="staff_name" type="text">A. Kokott</cell>
                    <cell name="work_package_name" type="text">Einarbeitung neuer Mitarbeiter (max. 8h/Monat pro MA)</cell>
                    <cell name="date" type="date" timezoneshort="CEST" unix="1761084000" usdate="22.10.2025" ustime="00:00" xlsdate="2025-10-22T00:00:00.000">Wed, 22 Oct 2025 00:00:00 +0200</cell>
                    <cell name="time_from" type="time" timezoneshort="CET" ustime="11:00" xlsdate="1900-01-10T11:00:00.000">Wed, 10 Jan 1900 11:00:00 +0100</cell>
                    <cell name="time_to" type="time" timezoneshort="CET" ustime="12:00" xlsdate="1900-01-10T12:00:00.000">Wed, 10 Jan 1900 12:00:00 +0100</cell>
                    <cell name="number" type="number" usnumber="1,00">1</cell>
                    <cell name="project" type="text">0000 Sonderprojekt für Bonus</cell>
                    <cell name="purpose" type="text">Einarbeitung Fabienne</cell>
                    <cell name="is_client_changed" type="bool">false</cell>
                    <cell name="purpose_internal" type="text"></cell>
                </row>
                <row>
                    <cell name="staff_name" type="text">A. Kokott</cell>
                    <cell name="work_package_name" type="text">ADM</cell>
                    <cell name="date" type="date" timezoneshort="CEST" unix="1761170400" usdate="23.10.2025" ustime="00:00" xlsdate="2025-10-23T00:00:00.000">Thu, 23 Oct 2025 00:00:00 +0200</cell>
                    <cell name="time_from" type="time" timezoneshort="CET" ustime="10:30" xlsdate="1900-01-10T10:30:00.000">Wed, 10 Jan 1900 10:30:00 +0100</cell>
                    <cell name="time_to" type="time" timezoneshort="CET" ustime="11:00" xlsdate="1900-01-10T11:00:00.000">Wed, 10 Jan 1900 11:00:00 +0100</cell>
                    <cell name="number" type="number" usnumber="0,50">0.5</cell>
                    <cell name="project" type="text">4249.12 Apleona-BSK-Geb10+11-Am-Keltenwald-Ehningen</cell>
                    <cell name="purpose" type="text">QS Vorabzug BSK Geb. 11</cell>
                    <cell name="is_client_changed" type="bool">false</cell>
                    <cell name="purpose_internal" type="text"></cell>
                </row>
                <row>
                    <cell name="staff_name" type="text">A. Kokott</cell>
                    <cell name="work_package_name" type="text">Angebote-Ausschreibungen-Kalkulationen (max. 8h/Monat pro MA)</cell>
                    <cell name="date" type="date" timezoneshort="CEST" unix="1761170400" usdate="23.10.2025" ustime="00:00" xlsdate="2025-10-23T00:00:00.000">Thu, 23 Oct 2025 00:00:00 +0200</cell>
                    <cell name="time_from" type="time" timezoneshort="CET" ustime="08:00" xlsdate="1900-01-10T08:00:00.000">Wed, 10 Jan 1900 08:00:00 +0100</cell>
                    <cell name="time_to" type="time" timezoneshort="CET" ustime="09:00" xlsdate="1900-01-10T09:00:00.000">Wed, 10 Jan 1900 09:00:00 +0100</cell>
                    <cell name="number" type="number" usnumber="1,00">1</cell>
                    <cell name="project" type="text">0000 Sonderprojekt für Bonus</cell>
                    <cell name="purpose" type="text"></cell>
                    <cell name="is_client_changed" type="bool">false</cell>
                    <cell name="purpose_internal" type="text"></cell>
                </row>
                <row>
                    <cell name="staff_name" type="text">A. Kokott</cell>
                    <cell name="work_package_name" type="text">ADM</cell>
                    <cell name="date" type="date" timezoneshort="CEST" unix="1761170400" usdate="23.10.2025" ustime="00:00" xlsdate="2025-10-23T00:00:00.000">Thu, 23 Oct 2025 00:00:00 +0200</cell>
                    <cell name="time_from" type="time" timezoneshort="CET" ustime="09:00" xlsdate="1900-01-10T09:00:00.000">Wed, 10 Jan 1900 09:00:00 +0100</cell>
                    <cell name="time_to" type="time" timezoneshort="CET" ustime="09:30" xlsdate="1900-01-10T09:30:00.000">Wed, 10 Jan 1900 09:30:00 +0100</cell>
                    <cell name="number" type="number" usnumber="0,50">0.5</cell>
                    <cell name="project" type="text">4249.12 Apleona-BSK-Geb10+11-Am-Keltenwald-Ehningen</cell>
                    <cell name="purpose" type="text">QS BSK Geb 10 Vorabzug</cell>
                    <cell name="is_client_changed" type="bool">false</cell>
                    <cell name="purpose_internal" type="text"></cell>
                </row>
                <row>
                    <cell name="staff_name" type="text">A. Kokott</cell>
                    <cell name="work_package_name" type="text">(aN) Pos. 2 Fortschr. BSK</cell>
                    <cell name="date" type="date" timezoneshort="CEST" unix="1761170400" usdate="23.10.2025" ustime="00:00" xlsdate="2025-10-23T00:00:00.000">Thu, 23 Oct 2025 00:00:00 +0200</cell>
                    <cell name="time_from" type="time" timezoneshort="CET" ustime="11:00" xlsdate="1900-01-10T11:00:00.000">Wed, 10 Jan 1900 11:00:00 +0100</cell>
                    <cell name="time_to" type="time" timezoneshort="CET" ustime="11:30" xlsdate="1900-01-10T11:30:00.000">Wed, 10 Jan 1900 11:30:00 +0100</cell>
                    <cell name="number" type="number" usnumber="0,50">0.5</cell>
                    <cell name="project" type="text">4249.11 Apleona-Fortschr-BSK-Geb15-IBMAllee1-Ehningen</cell>
                    <cell name="purpose" type="text">Vorabzug QS BSK Geb 15</cell>
                    <cell name="is_client_changed" type="bool">false</cell>
                    <cell name="purpose_internal" type="text"></cell>
                </row>
                <row>
                    <cell name="staff_name" type="text">A. Kokott</cell>
                    <cell name="work_package_name" type="text">SV</cell>
                    <cell name="date" type="date" timezoneshort="CET" unix="1761519600" usdate="27.10.2025" ustime="00:00" xlsdate="2025-10-27T00:00:00.000">Mon, 27 Oct 2025 00:00:00 +0100</cell>
                    <cell name="time_from" type="time" timezoneshort="CET" ustime="10:30" xlsdate="1900-01-10T10:30:00.000">Wed, 10 Jan 1900 10:30:00 +0100</cell>
                    <cell name="time_to" type="time" timezoneshort="CET" ustime="11:00" xlsdate="1900-01-10T11:00:00.000">Wed, 10 Jan 1900 11:00:00 +0100</cell>
                    <cell name="number" type="number" usnumber="0,50">0.5</cell>
                    <cell name="project" type="text">5291.01 RNV-BTB-NB-ABZ-Betriebshof-Ludwigshafen</cell>
                    <cell name="purpose" type="text">QS und Vers, BSK</cell>
                    <cell name="is_client_changed" type="bool">false</cell>
                    <cell name="purpose_internal" type="text"></cell>
                </row>
                <row>
                    <cell name="staff_name" type="text">A. Kokott</cell>
                    <cell name="work_package_name" type="text">(p) Pos. 1 ADM</cell>
                    <cell name="date" type="date" timezoneshort="CET" unix="1761519600" usdate="27.10.2025" ustime="00:00" xlsdate="2025-10-27T00:00:00.000">Mon, 27 Oct 2025 00:00:00 +0100</cell>
                    <cell name="time_from" type="time" timezoneshort="CET" ustime="09:00" xlsdate="1900-01-10T09:00:00.000">Wed, 10 Jan 1900 09:00:00 +0100</cell>
                    <cell name="time_to" type="time" timezoneshort="CET" ustime="09:30" xlsdate="1900-01-10T09:30:00.000">Wed, 10 Jan 1900 09:30:00 +0100</cell>
                    <cell name="number" type="number" usnumber="0,50">0.5</cell>
                    <cell name="project" type="text">7355.02 Pfizer-BTB-Aufst-Wärmepumpen-Mooswaldallee-1-Freiburg-Geb-V-H-N</cell>
                    <cell name="purpose" type="text">2 x QS und Versand Vorabzug BST </cell>
                    <cell name="is_client_changed" type="bool">false</cell>
                    <cell name="purpose_internal" type="text"></cell>
                </row>
                <row>
                    <cell name="staff_name" type="text">A. Kokott</cell>
                    <cell name="work_package_name" type="text">0100-Anlage Projekt, Angebot, Versand, Auftrag</cell>
                    <cell name="date" type="date" timezoneshort="CET" unix="1761606000" usdate="28.10.2025" ustime="00:00" xlsdate="2025-10-28T00:00:00.000">Tue, 28 Oct 2025 00:00:00 +0100</cell>
                    <cell name="time_from" type="time" timezoneshort="CET" ustime="08:00" xlsdate="1900-01-10T08:00:00.000">Wed, 10 Jan 1900 08:00:00 +0100</cell>
                    <cell name="time_to" type="time" timezoneshort="CET" ustime="08:15" xlsdate="1900-01-10T08:15:00.000">Wed, 10 Jan 1900 08:15:00 +0100</cell>
                    <cell name="number" type="number" usnumber="0,25">0.25</cell>
                    <cell name="project" type="text">6313.05 rh-Construction-LG-EnSol-BSK-BAB-Limespark-Sulzbach</cell>
                    <cell name="purpose" type="text">Austauschseite BSK Versand</cell>
                    <cell name="is_client_changed" type="bool">false</cell>
                    <cell name="purpose_internal" type="text"></cell>
                </row>
                <row>
                    <cell name="staff_name" type="text">A. Kokott</cell>
                    <cell name="work_package_name" type="text">ADM</cell>
                    <cell name="date" type="date" timezoneshort="CET" unix="1761692400" usdate="29.10.2025" ustime="00:00" xlsdate="2025-10-29T00:00:00.000">Wed, 29 Oct 2025 00:00:00 +0100</cell>
                    <cell name="time_from" type="time" timezoneshort="CET" ustime="08:00" xlsdate="1900-01-10T08:00:00.000">Wed, 10 Jan 1900 08:00:00 +0100</cell>
                    <cell name="time_to" type="time" timezoneshort="CET" ustime="08:30" xlsdate="1900-01-10T08:30:00.000">Wed, 10 Jan 1900 08:30:00 +0100</cell>
                    <cell name="number" type="number" usnumber="0,50">0.5</cell>
                    <cell name="project" type="text">7478 WindBauer-BSK-WEA-Hofstett</cell>
                    <cell name="purpose" type="text">QS und Vers. BSK</cell>
                    <cell name="is_client_changed" type="bool">false</cell>
                    <cell name="purpose_internal" type="text"></cell>
                </row>
                <row>
                    <cell name="staff_name" type="text">A. Kokott</cell>
                    <cell name="work_package_name" type="text">ADM</cell>
                    <cell name="date" type="date" timezoneshort="CET" unix="1761692400" usdate="29.10.2025" ustime="00:00" xlsdate="2025-10-29T00:00:00.000">Wed, 29 Oct 2025 00:00:00 +0100</cell>
                    <cell name="time_from" type="time" timezoneshort="CET" ustime="09:30" xlsdate="1900-01-10T09:30:00.000">Wed, 10 Jan 1900 09:30:00 +0100</cell>
                    <cell name="time_to" type="time" timezoneshort="CET" ustime="10:00" xlsdate="1900-01-10T10:00:00.000">Wed, 10 Jan 1900 10:00:00 +0100</cell>
                    <cell name="number" type="number" usnumber="0,50">0.5</cell>
                    <cell name="project" type="text">7477 WindBauer-BSK-WEA-Waldhausen</cell>
                    <cell name="purpose" type="text">QS und Vers. BSK</cell>
                    <cell name="is_client_changed" type="bool">false</cell>
                    <cell name="purpose_internal" type="text"></cell>
                </row>
                <row>
                    <cell name="staff_name" type="text">A. Kokott</cell>
                    <cell name="work_package_name" type="text">(aN) BTB (SV)</cell>
                    <cell name="date" type="date" timezoneshort="CET" unix="1761692400" usdate="29.10.2025" ustime="00:00" xlsdate="2025-10-29T00:00:00.000">Wed, 29 Oct 2025 00:00:00 +0100</cell>
                    <cell name="time_from" type="time" timezoneshort="CET" ustime="11:00" xlsdate="1900-01-10T11:00:00.000">Wed, 10 Jan 1900 11:00:00 +0100</cell>
                    <cell name="time_to" type="time" timezoneshort="CET" ustime="11:30" xlsdate="1900-01-10T11:30:00.000">Wed, 10 Jan 1900 11:30:00 +0100</cell>
                    <cell name="number" type="number" usnumber="0,50">0.5</cell>
                    <cell name="project" type="text">6961.01 Neptune-Rheinhafen-Speyer-allgemeineBeratungsleistungen</cell>
                    <cell name="purpose" type="text">QS und Vers. BST</cell>
                    <cell name="is_client_changed" type="bool">false</cell>
                    <cell name="purpose_internal" type="text"></cell>
                </row>
                <row>
                    <cell name="staff_name" type="text">A. Kokott</cell>
                    <cell name="work_package_name" type="text">4309-Fortschreibung Brandschutzkonzept / Tektur</cell>
                    <cell name="date" type="date" timezoneshort="CET" unix="1761778800" usdate="30.10.2025" ustime="00:00" xlsdate="2025-10-30T00:00:00.000">Thu, 30 Oct 2025 00:00:00 +0100</cell>
                    <cell name="time_from" type="time" timezoneshort="CET" ustime="10:30" xlsdate="1900-01-10T10:30:00.000">Wed, 10 Jan 1900 10:30:00 +0100</cell>
                    <cell name="time_to" type="time" timezoneshort="CET" ustime="10:45" xlsdate="1900-01-10T10:45:00.000">Wed, 10 Jan 1900 10:45:00 +0100</cell>
                    <cell name="number" type="number" usnumber="0,25">0.25</cell>
                    <cell name="project" type="text">6377 Alemannenstraße-21-Heimsheim-IAV</cell>
                    <cell name="purpose" type="text">korr. QS und Vers.BSK</cell>
                    <cell name="is_client_changed" type="bool">false</cell>
                    <cell name="purpose_internal" type="text"></cell>
                </row>
                <row>
                    <cell name="staff_name" type="text">A. Kokott</cell>
                    <cell name="work_package_name" type="text">4101-Erläuterungsbericht Brandschutzkonzept….</cell>
                    <cell name="date" type="date" timezoneshort="CET" unix="1761778800" usdate="30.10.2025" ustime="00:00" xlsdate="2025-10-30T00:00:00.000">Thu, 30 Oct 2025 00:00:00 +0100</cell>
                    <cell name="time_from" type="time" timezoneshort="CET" ustime="08:00" xlsdate="1900-01-10T08:00:00.000">Wed, 10 Jan 1900 08:00:00 +0100</cell>
                    <cell name="time_to" type="time" timezoneshort="CET" ustime="08:30" xlsdate="1900-01-10T08:30:00.000">Wed, 10 Jan 1900 08:30:00 +0100</cell>
                    <cell name="number" type="number" usnumber="0,50">0.5</cell>
                    <cell name="project" type="text">6648 oPVA-S21-Berlin-Neubau-HP-Perleberger-Brücke-ganzheitliches-BSK</cell>
                    <cell name="purpose" type="text">QS Versand Protokoll</cell>
                    <cell name="is_client_changed" type="bool">false</cell>
                    <cell name="purpose_internal" type="text"></cell>
                </row>
                <row>
                    <cell name="staff_name" type="text">A. Kokott</cell>
                    <cell name="work_package_name" type="text">ADM</cell>
                    <cell name="date" type="date" timezoneshort="CET" unix="1762124400" usdate="03.11.2025" ustime="00:00" xlsdate="2025-11-03T00:00:00.000">Mon, 03 Nov 2025 00:00:00 +0100</cell>
                    <cell name="time_from" type="time" timezoneshort="CET" ustime="12:00" xlsdate="1900-01-10T12:00:00.000">Wed, 10 Jan 1900 12:00:00 +0100</cell>
                    <cell name="time_to" type="time" timezoneshort="CET" ustime="12:30" xlsdate="1900-01-10T12:30:00.000">Wed, 10 Jan 1900 12:30:00 +0100</cell>
                    <cell name="number" type="number" usnumber="0,50">0.5</cell>
                    <cell name="project" type="text">7607 LAER-Garagenpark-Möchengladbach</cell>
                    <cell name="purpose" type="text">Projektmanagment</cell>
                    <cell name="is_client_changed" type="bool">false</cell>
                    <cell name="purpose_internal" type="text"></cell>
                </row>
                <row>
                    <cell name="staff_name" type="text">A. Kokott</cell>
                    <cell name="work_package_name" type="text">ADM</cell>
                    <cell name="date" type="date" timezoneshort="CET" unix="1762124400" usdate="03.11.2025" ustime="00:00" xlsdate="2025-11-03T00:00:00.000">Mon, 03 Nov 2025 00:00:00 +0100</cell>
                    <cell name="time_from" type="time" timezoneshort="CET" ustime="11:30" xlsdate="1900-01-10T11:30:00.000">Wed, 10 Jan 1900 11:30:00 +0100</cell>
                    <cell name="time_to" type="time" timezoneshort="CET" ustime="12:00" xlsdate="1900-01-10T12:00:00.000">Wed, 10 Jan 1900 12:00:00 +0100</cell>
                    <cell name="number" type="number" usnumber="0,50">0.5</cell>
                    <cell name="project" type="text">5757.06 Stadt-Schriesheim-FWP-Gymnasium-Hirschbergstr1-Schriesheim</cell>
                    <cell name="purpose" type="text">Projektmanagment</cell>
                    <cell name="is_client_changed" type="bool">false</cell>
                    <cell name="purpose_internal" type="text"></cell>
                </row>
                <row>
                    <cell name="staff_name" type="text">A. Kokott</cell>
                    <cell name="work_package_name" type="text">Nebentätigkeiten (ADM)</cell>
                    <cell name="date" type="date" timezoneshort="CET" unix="1762124400" usdate="03.11.2025" ustime="00:00" xlsdate="2025-11-03T00:00:00.000">Mon, 03 Nov 2025 00:00:00 +0100</cell>
                    <cell name="time_from" type="time" timezoneshort="CET" ustime="11:00" xlsdate="1900-01-10T11:00:00.000">Wed, 10 Jan 1900 11:00:00 +0100</cell>
                    <cell name="time_to" type="time" timezoneshort="CET" ustime="11:30" xlsdate="1900-01-10T11:30:00.000">Wed, 10 Jan 1900 11:30:00 +0100</cell>
                    <cell name="number" type="number" usnumber="0,50">0.5</cell>
                    <cell name="project" type="text">5156.04 LP9-LBBTR-SPES-N-Airbase-Spangdahlem</cell>
                    <cell name="purpose" type="text">Projektmanagment</cell>
                    <cell name="is_client_changed" type="bool">false</cell>
                    <cell name="purpose_internal" type="text"></cell>
                </row>
                <row>
                    <cell name="staff_name" type="text">A. Kokott</cell>
                    <cell name="work_package_name" type="text">ADM</cell>
                    <cell name="date" type="date" timezoneshort="CET" unix="1762124400" usdate="03.11.2025" ustime="00:00" xlsdate="2025-11-03T00:00:00.000">Mon, 03 Nov 2025 00:00:00 +0100</cell>
                    <cell name="time_from" type="time" timezoneshort="CET" ustime="10:30" xlsdate="1900-01-10T10:30:00.000">Wed, 10 Jan 1900 10:30:00 +0100</cell>
                    <cell name="time_to" type="time" timezoneshort="CET" ustime="11:00" xlsdate="1900-01-10T11:00:00.000">Wed, 10 Jan 1900 11:00:00 +0100</cell>
                    <cell name="number" type="number" usnumber="0,50">0.5</cell>
                    <cell name="project" type="text">7606 RIZ-BSK-Badstr22A-Offenburg</cell>
                    <cell name="purpose" type="text">Projektmanagment</cell>
                    <cell name="is_client_changed" type="bool">false</cell>
                    <cell name="purpose_internal" type="text"></cell>
                </row>
                <row>
                    <cell name="staff_name" type="text">A. Kokott</cell>
                    <cell name="work_package_name" type="text">(aN) Pos. 2 Erstellung brandschutztechnische Stellungnahme (SV)</cell>
                    <cell name="date" type="date" timezoneshort="CET" unix="1762124400" usdate="03.11.2025" ustime="00:00" xlsdate="2025-11-03T00:00:00.000">Mon, 03 Nov 2025 00:00:00 +0100</cell>
                    <cell name="time_from" type="time" timezoneshort="CET" ustime="10:00" xlsdate="1900-01-10T10:00:00.000">Wed, 10 Jan 1900 10:00:00 +0100</cell>
                    <cell name="time_to" type="time" timezoneshort="CET" ustime="10:30" xlsdate="1900-01-10T10:30:00.000">Wed, 10 Jan 1900 10:30:00 +0100</cell>
                    <cell name="number" type="number" usnumber="0,50">0.5</cell>
                    <cell name="project" type="text">6712.04 Züblin-Strabag-BST-Waldstr6-10-Weiterstadt</cell>
                    <cell name="purpose" type="text">Projektmanagment</cell>
                    <cell name="is_client_changed" type="bool">false</cell>
                    <cell name="purpose_internal" type="text"></cell>
                </row>
                <row>
                    <cell name="staff_name" type="text">A. Kokott</cell>
                    <cell name="work_package_name" type="text">3100-Erarbeiten des Brandschutzkonzept/Nachweis/Stellungnahme (SV)</cell>
                    <cell name="date" type="date" timezoneshort="CET" unix="1762124400" usdate="03.11.2025" ustime="00:00" xlsdate="2025-11-03T00:00:00.000">Mon, 03 Nov 2025 00:00:00 +0100</cell>
                    <cell name="time_from" type="time" timezoneshort="CET" ustime="09:45" xlsdate="1900-01-10T09:45:00.000">Wed, 10 Jan 1900 09:45:00 +0100</cell>
                    <cell name="time_to" type="time" timezoneshort="CET" ustime="10:00" xlsdate="1900-01-10T10:00:00.000">Wed, 10 Jan 1900 10:00:00 +0100</cell>
                    <cell name="number" type="number" usnumber="0,25">0.25</cell>
                    <cell name="project" type="text">5664.19 (5667.04)  KOB-BAB-Umbau-Sprinkleranlage-Lauterstr50-Wolfstein</cell>
                    <cell name="purpose" type="text">QS und Vers. BST</cell>
                    <cell name="is_client_changed" type="bool">false</cell>
                    <cell name="purpose_internal" type="text"></cell>
                </row>
                <row>
                    <cell name="staff_name" type="text">A. Kokott</cell>
                    <cell name="work_package_name" type="text">Vorträge, Repräsentation (übergreifend)  (max. 4h/Quartal pro MA)</cell>
                    <cell name="date" type="date" timezoneshort="CET" unix="1762124400" usdate="03.11.2025" ustime="00:00" xlsdate="2025-11-03T00:00:00.000">Mon, 03 Nov 2025 00:00:00 +0100</cell>
                    <cell name="time_from" type="time" timezoneshort="CET" ustime="08:15" xlsdate="1900-01-10T08:15:00.000">Wed, 10 Jan 1900 08:15:00 +0100</cell>
                    <cell name="time_to" type="time" timezoneshort="CET" ustime="09:45" xlsdate="1900-01-10T09:45:00.000">Wed, 10 Jan 1900 09:45:00 +0100</cell>
                    <cell name="number" type="number" usnumber="1,50">1.5</cell>
                    <cell name="project" type="text">0000 Sonderprojekt für Bonus</cell>
                    <cell name="purpose" type="text">Vorbereitung Schulung Dirk Ranf</cell>
                    <cell name="is_client_changed" type="bool">false</cell>
                    <cell name="purpose_internal" type="text"></cell>
                </row>
                <row>
                    <cell name="staff_name" type="text">A. Kokott</cell>
                    <cell name="work_package_name" type="text">Vorträge, Repräsentation (übergreifend)  (max. 4h/Quartal pro MA)</cell>
                    <cell name="date" type="date" timezoneshort="CET" unix="1762210800" usdate="04.11.2025" ustime="00:00" xlsdate="2025-11-04T00:00:00.000">Tue, 04 Nov 2025 00:00:00 +0100</cell>
                    <cell name="time_from" type="time" timezoneshort="CET" ustime="08:00" xlsdate="1900-01-10T08:00:00.000">Wed, 10 Jan 1900 08:00:00 +0100</cell>
                    <cell name="time_to" type="time" timezoneshort="CET" ustime="09:00" xlsdate="1900-01-10T09:00:00.000">Wed, 10 Jan 1900 09:00:00 +0100</cell>
                    <cell name="number" type="number" usnumber="1,00">1</cell>
                    <cell name="project" type="text">0000 Sonderprojekt für Bonus</cell>
                    <cell name="purpose" type="text">Vorbereitung Schulung Dirk Ranf</cell>
                    <cell name="is_client_changed" type="bool">false</cell>
                    <cell name="purpose_internal" type="text"></cell>
                </row>
                <row>
                    <cell name="staff_name" type="text">A. Kokott</cell>
                    <cell name="work_package_name" type="text">Einarbeitung neuer Mitarbeiter (max. 8h/Monat pro MA)</cell>
                    <cell name="date" type="date" timezoneshort="CET" unix="1762210800" usdate="04.11.2025" ustime="00:00" xlsdate="2025-11-04T00:00:00.000">Tue, 04 Nov 2025 00:00:00 +0100</cell>
                    <cell name="time_from" type="time" timezoneshort="CET" ustime="09:00" xlsdate="1900-01-10T09:00:00.000">Wed, 10 Jan 1900 09:00:00 +0100</cell>
                    <cell name="time_to" type="time" timezoneshort="CET" ustime="11:00" xlsdate="1900-01-10T11:00:00.000">Wed, 10 Jan 1900 11:00:00 +0100</cell>
                    <cell name="number" type="number" usnumber="2,00">2</cell>
                    <cell name="project" type="text">0000 Sonderprojekt für Bonus</cell>
                    <cell name="purpose" type="text">Einarbeitung Hennis und Hill</cell>
                    <cell name="is_client_changed" type="bool">false</cell>
                    <cell name="purpose_internal" type="text"></cell>
                </row>
                <row>
                    <cell name="staff_name" type="text">A. Kokott</cell>
                    <cell name="work_package_name" type="text">Angebote-Ausschreibungen-Kalkulationen (max. 8h/Monat pro MA)</cell>
                    <cell name="date" type="date" timezoneshort="CET" unix="1762210800" usdate="04.11.2025" ustime="00:00" xlsdate="2025-11-04T00:00:00.000">Tue, 04 Nov 2025 00:00:00 +0100</cell>
                    <cell name="time_from" type="time" timezoneshort="CET" ustime="11:00" xlsdate="1900-01-10T11:00:00.000">Wed, 10 Jan 1900 11:00:00 +0100</cell>
                    <cell name="time_to" type="time" timezoneshort="CET" ustime="13:00" xlsdate="1900-01-10T13:00:00.000">Wed, 10 Jan 1900 13:00:00 +0100</cell>
                    <cell name="number" type="number" usnumber="2,00">2</cell>
                    <cell name="project" type="text">0000 Sonderprojekt für Bonus</cell>
                    <cell name="purpose" type="text"></cell>
                    <cell name="is_client_changed" type="bool">false</cell>
                    <cell name="purpose_internal" type="text"></cell>
                </row>
                <row>
                    <cell name="staff_name" type="text">A. Kokott</cell>
                    <cell name="work_package_name" type="text">Vorträge, Repräsentation (übergreifend)  (max. 4h/Quartal pro MA)</cell>
                    <cell name="date" type="date" timezoneshort="CET" unix="1762297200" usdate="05.11.2025" ustime="00:00" xlsdate="2025-11-05T00:00:00.000">Wed, 05 Nov 2025 00:00:00 +0100</cell>
                    <cell name="time_from" type="time" timezoneshort="CET" ustime="08:00" xlsdate="1900-01-10T08:00:00.000">Wed, 10 Jan 1900 08:00:00 +0100</cell>
                    <cell name="time_to" type="time" timezoneshort="CET" ustime="09:00" xlsdate="1900-01-10T09:00:00.000">Wed, 10 Jan 1900 09:00:00 +0100</cell>
                    <cell name="number" type="number" usnumber="1,00">1</cell>
                    <cell name="project" type="text">0000 Sonderprojekt für Bonus</cell>
                    <cell name="purpose" type="text">Vorbereitung Schulung Dirk Ranf</cell>
                    <cell name="is_client_changed" type="bool">false</cell>
                    <cell name="purpose_internal" type="text"></cell>
                </row>
                <row>
                    <cell name="staff_name" type="text">A. Kokott</cell>
                    <cell name="work_package_name" type="text">Angebote-Ausschreibungen-Kalkulationen (max. 8h/Monat pro MA)</cell>
                    <cell name="date" type="date" timezoneshort="CET" unix="1762297200" usdate="05.11.2025" ustime="00:00" xlsdate="2025-11-05T00:00:00.000">Wed, 05 Nov 2025 00:00:00 +0100</cell>
                    <cell name="time_from" type="time" timezoneshort="CET" ustime="09:00" xlsdate="1900-01-10T09:00:00.000">Wed, 10 Jan 1900 09:00:00 +0100</cell>
                    <cell name="time_to" type="time" timezoneshort="CET" ustime="11:00" xlsdate="1900-01-10T11:00:00.000">Wed, 10 Jan 1900 11:00:00 +0100</cell>
                    <cell name="number" type="number" usnumber="2,00">2</cell>
                    <cell name="project" type="text">0000 Sonderprojekt für Bonus</cell>
                    <cell name="purpose" type="text"></cell>
                    <cell name="is_client_changed" type="bool">false</cell>
                    <cell name="purpose_internal" type="text"></cell>
                </row>
                <row>
                    <cell name="staff_name" type="text">A. Kokott</cell>
                    <cell name="work_package_name" type="text">3100-Erarbeiten des Brandschutzkonzept/Nachweis/Stellungnahme</cell>
                    <cell name="date" type="date" timezoneshort="CET" unix="1762383600" usdate="06.11.2025" ustime="00:00" xlsdate="2025-11-06T00:00:00.000">Thu, 06 Nov 2025 00:00:00 +0100</cell>
                    <cell name="time_from" type="time" timezoneshort="CET" ustime="09:30" xlsdate="1900-01-10T09:30:00.000">Wed, 10 Jan 1900 09:30:00 +0100</cell>
                    <cell name="time_to" type="time" timezoneshort="CET" ustime="10:15" xlsdate="1900-01-10T10:15:00.000">Wed, 10 Jan 1900 10:15:00 +0100</cell>
                    <cell name="number" type="number" usnumber="0,75">0.75</cell>
                    <cell name="project" type="text">4249.09 Apleona-Fortschr04-BSK-Geb10+11-IBMAllee1-Ehningen</cell>
                    <cell name="purpose" type="text">4. Fortschreibung Gebäude 10 und 11 - Versand BSK</cell>
                    <cell name="is_client_changed" type="bool">false</cell>
                    <cell name="purpose_internal" type="text"></cell>
                </row>
                <row>
                    <cell name="staff_name" type="text">A. Kokott</cell>
                    <cell name="work_package_name" type="text">(aN) BTB (SV)</cell>
                    <cell name="date" type="date" timezoneshort="CET" unix="1762383600" usdate="06.11.2025" ustime="00:00" xlsdate="2025-11-06T00:00:00.000">Thu, 06 Nov 2025 00:00:00 +0100</cell>
                    <cell name="time_from" type="time" timezoneshort="CET" ustime="09:00" xlsdate="1900-01-10T09:00:00.000">Wed, 10 Jan 1900 09:00:00 +0100</cell>
                    <cell name="time_to" type="time" timezoneshort="CET" ustime="09:30" xlsdate="1900-01-10T09:30:00.000">Wed, 10 Jan 1900 09:30:00 +0100</cell>
                    <cell name="number" type="number" usnumber="0,50">0.5</cell>
                    <cell name="project" type="text">6961.01 Neptune-Rheinhafen-Speyer-allgemeineBeratungsleistungen</cell>
                    <cell name="purpose" type="text">QS und Versand BSK</cell>
                    <cell name="is_client_changed" type="bool">false</cell>
                    <cell name="purpose_internal" type="text"></cell>
                </row>
                <row>
                    <cell name="staff_name" type="text">A. Kokott</cell>
                    <cell name="work_package_name" type="text">(aN) Pos. 2 Fortschr. BSK</cell>
                    <cell name="date" type="date" timezoneshort="CET" unix="1762383600" usdate="06.11.2025" ustime="00:00" xlsdate="2025-11-06T00:00:00.000">Thu, 06 Nov 2025 00:00:00 +0100</cell>
                    <cell name="time_from" type="time" timezoneshort="CET" ustime="10:15" xlsdate="1900-01-10T10:15:00.000">Wed, 10 Jan 1900 10:15:00 +0100</cell>
                    <cell name="time_to" type="time" timezoneshort="CET" ustime="10:30" xlsdate="1900-01-10T10:30:00.000">Wed, 10 Jan 1900 10:30:00 +0100</cell>
                    <cell name="number" type="number" usnumber="0,25">0.25</cell>
                    <cell name="project" type="text">4249.11 Apleona-Fortschr-BSK-Geb15-IBMAllee1-Ehningen</cell>
                    <cell name="purpose" type="text">Fortschreibung BSK - Versand</cell>
                    <cell name="is_client_changed" type="bool">false</cell>
                    <cell name="purpose_internal" type="text"></cell>
                </row>
                <row>
                    <cell name="staff_name" type="text">A. Kokott</cell>
                    <cell name="work_package_name" type="text">Angebote-Ausschreibungen-Kalkulationen (max. 8h/Monat pro MA)</cell>
                    <cell name="date" type="date" timezoneshort="CET" unix="1762383600" usdate="06.11.2025" ustime="00:00" xlsdate="2025-11-06T00:00:00.000">Thu, 06 Nov 2025 00:00:00 +0100</cell>
                    <cell name="time_from" type="time" timezoneshort="CET" ustime="10:30" xlsdate="1900-01-10T10:30:00.000">Wed, 10 Jan 1900 10:30:00 +0100</cell>
                    <cell name="time_to" type="time" timezoneshort="CET" ustime="11:30" xlsdate="1900-01-10T11:30:00.000">Wed, 10 Jan 1900 11:30:00 +0100</cell>
                    <cell name="number" type="number" usnumber="1,00">1</cell>
                    <cell name="project" type="text">0000 Sonderprojekt für Bonus</cell>
                    <cell name="purpose" type="text">Diverse Angebotserstellung</cell>
                    <cell name="is_client_changed" type="bool">false</cell>
                    <cell name="purpose_internal" type="text"></cell>
                </row>
                <row>
                    <cell name="staff_name" type="text">A. Kokott</cell>
                    <cell name="work_package_name" type="text">3100-Erarbeiten des Brandschutzkonzept/Nachweis/Stellungnahme</cell>
                    <cell name="date" type="date" timezoneshort="CET" unix="1762902000" usdate="12.11.2025" ustime="00:00" xlsdate="2025-11-12T00:00:00.000">Wed, 12 Nov 2025 00:00:00 +0100</cell>
                    <cell name="time_from" type="time" timezoneshort="CET" ustime="10:00" xlsdate="1900-01-10T10:00:00.000">Wed, 10 Jan 1900 10:00:00 +0100</cell>
                    <cell name="time_to" type="time" timezoneshort="CET" ustime="10:30" xlsdate="1900-01-10T10:30:00.000">Wed, 10 Jan 1900 10:30:00 +0100</cell>
                    <cell name="number" type="number" usnumber="0,50">0.5</cell>
                    <cell name="project" type="text">6680.01 GSKOK-Heidelberg-Kopfklinik-Neurologie-BTB</cell>
                    <cell name="purpose" type="text">QS Vorabzug BSK</cell>
                    <cell name="is_client_changed" type="bool">false</cell>
                    <cell name="purpose_internal" type="text"></cell>
                </row>
                <row>
                    <cell name="staff_name" type="text">A. Kokott</cell>
                    <cell name="work_package_name" type="text">ADM (nicht kalkuliert)</cell>
                    <cell name="date" type="date" timezoneshort="CET" unix="1763334000" usdate="17.11.2025" ustime="00:00" xlsdate="2025-11-17T00:00:00.000">Mon, 17 Nov 2025 00:00:00 +0100</cell>
                    <cell name="time_from" type="time" timezoneshort="CET" ustime="11:30" xlsdate="1900-01-10T11:30:00.000">Wed, 10 Jan 1900 11:30:00 +0100</cell>
                    <cell name="time_to" type="time" timezoneshort="CET" ustime="12:00" xlsdate="1900-01-10T12:00:00.000">Wed, 10 Jan 1900 12:00:00 +0100</cell>
                    <cell name="number" type="number" usnumber="0,50">0.5</cell>
                    <cell name="project" type="text">6524.04 DB-BFM-Entrauchung-uPVA-BHF-RosenheimerPlatz-München</cell>
                    <cell name="purpose" type="text">Projektmangament</cell>
                    <cell name="is_client_changed" type="bool">false</cell>
                    <cell name="purpose_internal" type="text"></cell>
                </row>
                <row>
                    <cell name="staff_name" type="text">A. Kokott</cell>
                    <cell name="work_package_name" type="text">0100-Anlage Projekt, Angebot, Versand, Auftrag (ADM)</cell>
                    <cell name="date" type="date" timezoneshort="CET" unix="1763334000" usdate="17.11.2025" ustime="00:00" xlsdate="2025-11-17T00:00:00.000">Mon, 17 Nov 2025 00:00:00 +0100</cell>
                    <cell name="time_from" type="time" timezoneshort="CET" ustime="08:00" xlsdate="1900-01-10T08:00:00.000">Wed, 10 Jan 1900 08:00:00 +0100</cell>
                    <cell name="time_to" type="time" timezoneshort="CET" ustime="08:30" xlsdate="1900-01-10T08:30:00.000">Wed, 10 Jan 1900 08:30:00 +0100</cell>
                    <cell name="number" type="number" usnumber="0,50">0.5</cell>
                    <cell name="project" type="text">6495.01 ENBW-BSK-Windpark-Vöhl</cell>
                    <cell name="purpose" type="text">Projektmanagment</cell>
                    <cell name="is_client_changed" type="bool">false</cell>
                    <cell name="purpose_internal" type="text"></cell>
                </row>
                <row>
                    <cell name="staff_name" type="text">A. Kokott</cell>
                    <cell name="work_package_name" type="text">(p) ADM</cell>
                    <cell name="date" type="date" timezoneshort="CET" unix="1763334000" usdate="17.11.2025" ustime="00:00" xlsdate="2025-11-17T00:00:00.000">Mon, 17 Nov 2025 00:00:00 +0100</cell>
                    <cell name="time_from" type="time" timezoneshort="CET" ustime="08:30" xlsdate="1900-01-10T08:30:00.000">Wed, 10 Jan 1900 08:30:00 +0100</cell>
                    <cell name="time_to" type="time" timezoneshort="CET" ustime="09:00" xlsdate="1900-01-10T09:00:00.000">Wed, 10 Jan 1900 09:00:00 +0100</cell>
                    <cell name="number" type="number" usnumber="0,50">0.5</cell>
                    <cell name="project" type="text">5829.02 JUWI-Anp-BSK-WP-Hellenthal-Wiesenhardt</cell>
                    <cell name="purpose" type="text">Projektmanagment</cell>
                    <cell name="is_client_changed" type="bool">false</cell>
                    <cell name="purpose_internal" type="text"></cell>
                </row>
                <row>
                    <cell name="staff_name" type="text">A. Kokott</cell>
                    <cell name="work_package_name" type="text">ADM</cell>
                    <cell name="date" type="date" timezoneshort="CET" unix="1763334000" usdate="17.11.2025" ustime="00:00" xlsdate="2025-11-17T00:00:00.000">Mon, 17 Nov 2025 00:00:00 +0100</cell>
                    <cell name="time_from" type="time" timezoneshort="CET" ustime="09:00" xlsdate="1900-01-10T09:00:00.000">Wed, 10 Jan 1900 09:00:00 +0100</cell>
                    <cell name="time_to" type="time" timezoneshort="CET" ustime="09:30" xlsdate="1900-01-10T09:30:00.000">Wed, 10 Jan 1900 09:30:00 +0100</cell>
                    <cell name="number" type="number" usnumber="0,50">0.5</cell>
                    <cell name="project" type="text">7362 BSA-BW-Seminarinhalte-und-Durchführung-Breisgauring13-Eschbach</cell>
                    <cell name="purpose" type="text">Projektmanagment</cell>
                    <cell name="is_client_changed" type="bool">false</cell>
                    <cell name="purpose_internal" type="text"></cell>
                </row>
                <row>
                    <cell name="staff_name" type="text">A. Kokott</cell>
                    <cell name="work_package_name" type="text">ADM (nicht kalkuliert)</cell>
                    <cell name="date" type="date" timezoneshort="CET" unix="1763334000" usdate="17.11.2025" ustime="00:00" xlsdate="2025-11-17T00:00:00.000">Mon, 17 Nov 2025 00:00:00 +0100</cell>
                    <cell name="time_from" type="time" timezoneshort="CET" ustime="09:30" xlsdate="1900-01-10T09:30:00.000">Wed, 10 Jan 1900 09:30:00 +0100</cell>
                    <cell name="time_to" type="time" timezoneshort="CET" ustime="10:00" xlsdate="1900-01-10T10:00:00.000">Wed, 10 Jan 1900 10:00:00 +0100</cell>
                    <cell name="number" type="number" usnumber="0,50">0.5</cell>
                    <cell name="project" type="text">7300.60 Ströer-RV-BST-Schaltschränke-Raumzelle-Innsbrucker-Ring-München</cell>
                    <cell name="purpose" type="text">Projektmanagment</cell>
                    <cell name="is_client_changed" type="bool">false</cell>
                    <cell name="purpose_internal" type="text"></cell>
                </row>
                <row>
                    <cell name="staff_name" type="text">A. Kokott</cell>
                    <cell name="work_package_name" type="text">(p) Pos. 1 ADM</cell>
                    <cell name="date" type="date" timezoneshort="CET" unix="1763334000" usdate="17.11.2025" ustime="00:00" xlsdate="2025-11-17T00:00:00.000">Mon, 17 Nov 2025 00:00:00 +0100</cell>
                    <cell name="time_from" type="time" timezoneshort="CET" ustime="10:30" xlsdate="1900-01-10T10:30:00.000">Wed, 10 Jan 1900 10:30:00 +0100</cell>
                    <cell name="time_to" type="time" timezoneshort="CET" ustime="11:00" xlsdate="1900-01-10T11:00:00.000">Wed, 10 Jan 1900 11:00:00 +0100</cell>
                    <cell name="number" type="number" usnumber="0,50">0.5</cell>
                    <cell name="project" type="text">7355.02 Pfizer-BTB-Aufst-Wärmepumpen-Mooswaldallee-1-Freiburg-Geb-V-H-N</cell>
                    <cell name="purpose" type="text">QS und Versand BST Wärmepumpe</cell>
                    <cell name="is_client_changed" type="bool">false</cell>
                    <cell name="purpose_internal" type="text"></cell>
                </row>
                <row>
                    <cell name="staff_name" type="text">A. Kokott</cell>
                    <cell name="work_package_name" type="text">(p) Pos. 1 ADM</cell>
                    <cell name="date" type="date" timezoneshort="CET" unix="1763334000" usdate="17.11.2025" ustime="00:00" xlsdate="2025-11-17T00:00:00.000">Mon, 17 Nov 2025 00:00:00 +0100</cell>
                    <cell name="time_from" type="time" timezoneshort="CET" ustime="11:00" xlsdate="1900-01-10T11:00:00.000">Wed, 10 Jan 1900 11:00:00 +0100</cell>
                    <cell name="time_to" type="time" timezoneshort="CET" ustime="11:30" xlsdate="1900-01-10T11:30:00.000">Wed, 10 Jan 1900 11:30:00 +0100</cell>
                    <cell name="number" type="number" usnumber="0,50">0.5</cell>
                    <cell name="project" type="text">7355.02 Pfizer-BTB-Aufst-Wärmepumpen-Mooswaldallee-1-Freiburg-Geb-V-H-N</cell>
                    <cell name="purpose" type="text">QS und Versand BST Kältemasch.</cell>
                    <cell name="is_client_changed" type="bool">false</cell>
                    <cell name="purpose_internal" type="text"></cell>
                </row>
                <row>
                    <cell name="staff_name" type="text">A. Kokott</cell>
                    <cell name="work_package_name" type="text">(p) LP 8 RL (SV)</cell>
                    <cell name="date" type="date" timezoneshort="CET" unix="1763334000" usdate="17.11.2025" ustime="00:00" xlsdate="2025-11-17T00:00:00.000">Mon, 17 Nov 2025 00:00:00 +0100</cell>
                    <cell name="time_from" type="time" timezoneshort="CET" ustime="12:00" xlsdate="1900-01-10T12:00:00.000">Wed, 10 Jan 1900 12:00:00 +0100</cell>
                    <cell name="time_to" type="time" timezoneshort="CET" ustime="12:30" xlsdate="1900-01-10T12:30:00.000">Wed, 10 Jan 1900 12:30:00 +0100</cell>
                    <cell name="number" type="number" usnumber="0,50">0.5</cell>
                    <cell name="project" type="text">6974.03 DDK-LP8-LOS-1-Fast-Track+LOS-2-Prio-Geb-Maasberg</cell>
                    <cell name="purpose" type="text">Projektmangment</cell>
                    <cell name="is_client_changed" type="bool">false</cell>
                    <cell name="purpose_internal" type="text"></cell>
                </row>
                <row>
                    <cell name="staff_name" type="text">A. Kokott</cell>
                    <cell name="work_package_name" type="text">ADM (für alle Aufträge)</cell>
                    <cell name="date" type="date" timezoneshort="CET" unix="1763420400" usdate="18.11.2025" ustime="00:00" xlsdate="2025-11-18T00:00:00.000">Tue, 18 Nov 2025 00:00:00 +0100</cell>
                    <cell name="time_from" type="time" timezoneshort="CET" ustime="09:00" xlsdate="1900-01-10T09:00:00.000">Wed, 10 Jan 1900 09:00:00 +0100</cell>
                    <cell name="time_to" type="time" timezoneshort="CET" ustime="09:30" xlsdate="1900-01-10T09:30:00.000">Wed, 10 Jan 1900 09:30:00 +0100</cell>
                    <cell name="number" type="number" usnumber="0,50">0.5</cell>
                    <cell name="project" type="text">7618 BSH-Schulungen</cell>
                    <cell name="purpose" type="text">Projektmanagment</cell>
                    <cell name="is_client_changed" type="bool">false</cell>
                    <cell name="purpose_internal" type="text"></cell>
                </row>
                <row>
                    <cell name="staff_name" type="text">A. Kokott</cell>
                    <cell name="work_package_name" type="text">(aN) Pos. 1 Grundlagenermittlung und Objektbegehung (Ortsbesichtigung inkludiert/SV)</cell>
                    <cell name="date" type="date" timezoneshort="CET" unix="1763420400" usdate="18.11.2025" ustime="00:00" xlsdate="2025-11-18T00:00:00.000">Tue, 18 Nov 2025 00:00:00 +0100</cell>
                    <cell name="time_from" type="time" timezoneshort="CET" ustime="10:30" xlsdate="1900-01-10T10:30:00.000">Wed, 10 Jan 1900 10:30:00 +0100</cell>
                    <cell name="time_to" type="time" timezoneshort="CET" ustime="11:00" xlsdate="1900-01-10T11:00:00.000">Wed, 10 Jan 1900 11:00:00 +0100</cell>
                    <cell name="number" type="number" usnumber="0,50">0.5</cell>
                    <cell name="project" type="text">7446 Hamm-Architektur-BSK-BTB-Dom-zu-Worms-Lutherring9-Worms</cell>
                    <cell name="purpose" type="text">Projektmanagment</cell>
                    <cell name="is_client_changed" type="bool">false</cell>
                    <cell name="purpose_internal" type="text"></cell>
                </row>
                <row>
                    <cell name="staff_name" type="text">A. Kokott</cell>
                    <cell name="work_package_name" type="text">0300-QM, prüfen Plausibilität, Fertigstellung der Unterlagen (ADM)</cell>
                    <cell name="date" type="date" timezoneshort="CET" unix="1763506800" usdate="19.11.2025" ustime="00:00" xlsdate="2025-11-19T00:00:00.000">Wed, 19 Nov 2025 00:00:00 +0100</cell>
                    <cell name="time_from" type="time" timezoneshort="CET" ustime="10:00" xlsdate="1900-01-10T10:00:00.000">Wed, 10 Jan 1900 10:00:00 +0100</cell>
                    <cell name="time_to" type="time" timezoneshort="CET" ustime="10:30" xlsdate="1900-01-10T10:30:00.000">Wed, 10 Jan 1900 10:30:00 +0100</cell>
                    <cell name="number" type="number" usnumber="0,50">0.5</cell>
                    <cell name="project" type="text">6495.01 ENBW-BSK-Windpark-Vöhl</cell>
                    <cell name="purpose" type="text">QS und Versand BSK</cell>
                    <cell name="is_client_changed" type="bool">false</cell>
                    <cell name="purpose_internal" type="text"></cell>
                </row>
                <row>
                    <cell name="staff_name" type="text">A. Kokott</cell>
                    <cell name="work_package_name" type="text">ADM (nicht kalkuliert)</cell>
                    <cell name="date" type="date" timezoneshort="CET" unix="1763506800" usdate="19.11.2025" ustime="00:00" xlsdate="2025-11-19T00:00:00.000">Wed, 19 Nov 2025 00:00:00 +0100</cell>
                    <cell name="time_from" type="time" timezoneshort="CET" ustime="10:30" xlsdate="1900-01-10T10:30:00.000">Wed, 10 Jan 1900 10:30:00 +0100</cell>
                    <cell name="time_to" type="time" timezoneshort="CET" ustime="11:00" xlsdate="1900-01-10T11:00:00.000">Wed, 10 Jan 1900 11:00:00 +0100</cell>
                    <cell name="number" type="number" usnumber="0,50">0.5</cell>
                    <cell name="project" type="text">7505 Züblin-AHO-Neubau-Grundschule-Gengenbach</cell>
                    <cell name="purpose" type="text">Projektmanagment</cell>
                    <cell name="is_client_changed" type="bool">false</cell>
                    <cell name="purpose_internal" type="text"></cell>
                </row>
                <row>
                    <cell name="staff_name" type="text">A. Kokott</cell>
                    <cell name="work_package_name" type="text">(p) Pos. 1 ADM</cell>
                    <cell name="date" type="date" timezoneshort="CET" unix="1763938800" usdate="24.11.2025" ustime="00:00" xlsdate="2025-11-24T00:00:00.000">Mon, 24 Nov 2025 00:00:00 +0100</cell>
                    <cell name="time_from" type="time" timezoneshort="CET" ustime="12:15" xlsdate="1900-01-10T12:15:00.000">Wed, 10 Jan 1900 12:15:00 +0100</cell>
                    <cell name="time_to" type="time" timezoneshort="CET" ustime="12:45" xlsdate="1900-01-10T12:45:00.000">Wed, 10 Jan 1900 12:45:00 +0100</cell>
                    <cell name="number" type="number" usnumber="0,50">0.5</cell>
                    <cell name="project" type="text">7355.03 Pfizer-Mooswaldallee-1-Freiburg-BTB-Abluftventilatoren-Brandabschnitt</cell>
                    <cell name="purpose" type="text">Projektmanagment</cell>
                    <cell name="is_client_changed" type="bool">false</cell>
                    <cell name="purpose_internal" type="text"></cell>
                </row>
                <row>
                    <cell name="staff_name" type="text">A. Kokott</cell>
                    <cell name="work_package_name" type="text">0100-Anlage Projekt, Angebot, Versand, Auftrag</cell>
                    <cell name="date" type="date" timezoneshort="CET" unix="1763938800" usdate="24.11.2025" ustime="00:00" xlsdate="2025-11-24T00:00:00.000">Mon, 24 Nov 2025 00:00:00 +0100</cell>
                    <cell name="time_from" type="time" timezoneshort="CET" ustime="11:45" xlsdate="1900-01-10T11:45:00.000">Wed, 10 Jan 1900 11:45:00 +0100</cell>
                    <cell name="time_to" type="time" timezoneshort="CET" ustime="12:15" xlsdate="1900-01-10T12:15:00.000">Wed, 10 Jan 1900 12:15:00 +0100</cell>
                    <cell name="number" type="number" usnumber="0,50">0.5</cell>
                    <cell name="project" type="text">5437.04 FWP-Bissierstraße-Freiburg-Metzgergrün</cell>
                    <cell name="purpose" type="text">Projektmanagment</cell>
                    <cell name="is_client_changed" type="bool">false</cell>
                    <cell name="purpose_internal" type="text"></cell>
                </row>
                <row>
                    <cell name="staff_name" type="text">A. Kokott</cell>
                    <cell name="work_package_name" type="text">ADM</cell>
                    <cell name="date" type="date" timezoneshort="CET" unix="1763938800" usdate="24.11.2025" ustime="00:00" xlsdate="2025-11-24T00:00:00.000">Mon, 24 Nov 2025 00:00:00 +0100</cell>
                    <cell name="time_from" type="time" timezoneshort="CET" ustime="11:15" xlsdate="1900-01-10T11:15:00.000">Wed, 10 Jan 1900 11:15:00 +0100</cell>
                    <cell name="time_to" type="time" timezoneshort="CET" ustime="11:45" xlsdate="1900-01-10T11:45:00.000">Wed, 10 Jan 1900 11:45:00 +0100</cell>
                    <cell name="number" type="number" usnumber="0,50">0.5</cell>
                    <cell name="project" type="text">7500 Baupionier-PCP-RV-diverse-Garagenparks</cell>
                    <cell name="purpose" type="text">QS BSK</cell>
                    <cell name="is_client_changed" type="bool">false</cell>
                    <cell name="purpose_internal" type="text"></cell>
                </row>
                <row>
                    <cell name="staff_name" type="text">A. Kokott</cell>
                    <cell name="work_package_name" type="text">Erarbeiten des Brandschutzkonzept/Nachweis/Stellungnahme</cell>
                    <cell name="date" type="date" timezoneshort="CET" unix="1763938800" usdate="24.11.2025" ustime="00:00" xlsdate="2025-11-24T00:00:00.000">Mon, 24 Nov 2025 00:00:00 +0100</cell>
                    <cell name="time_from" type="time" timezoneshort="CET" ustime="09:00" xlsdate="1900-01-10T09:00:00.000">Wed, 10 Jan 1900 09:00:00 +0100</cell>
                    <cell name="time_to" type="time" timezoneshort="CET" ustime="09:15" xlsdate="1900-01-10T09:15:00.000">Wed, 10 Jan 1900 09:15:00 +0100</cell>
                    <cell name="number" type="number" usnumber="0,25">0.25</cell>
                    <cell name="project" type="text">6995 Telehouse-BSK-TDE-RZ-GebN-Kleyerstraße75-89-FFM</cell>
                    <cell name="purpose" type="text">QS BSK</cell>
                    <cell name="is_client_changed" type="bool">false</cell>
                    <cell name="purpose_internal" type="text"></cell>
                </row>
                <row>
                    <cell name="staff_name" type="text">A. Kokott</cell>
                    <cell name="work_package_name" type="text">(p) ADM</cell>
                    <cell name="date" type="date" timezoneshort="CET" unix="1764025200" usdate="25.11.2025" ustime="00:00" xlsdate="2025-11-25T00:00:00.000">Tue, 25 Nov 2025 00:00:00 +0100</cell>
                    <cell name="time_from" type="time" timezoneshort="CET" ustime="11:00" xlsdate="1900-01-10T11:00:00.000">Wed, 10 Jan 1900 11:00:00 +0100</cell>
                    <cell name="time_to" type="time" timezoneshort="CET" ustime="11:30" xlsdate="1900-01-10T11:30:00.000">Wed, 10 Jan 1900 11:30:00 +0100</cell>
                    <cell name="number" type="number" usnumber="0,50">0.5</cell>
                    <cell name="project" type="text">5829.02 JUWI-Anp-BSK-WP-Hellenthal-Wiesenhardt</cell>
                    <cell name="purpose" type="text">Projektmanagment</cell>
                    <cell name="is_client_changed" type="bool">false</cell>
                    <cell name="purpose_internal" type="text"></cell>
                </row>
                <row>
                    <cell name="staff_name" type="text">A. Kokott</cell>
                    <cell name="work_package_name" type="text">ADM</cell>
                    <cell name="date" type="date" timezoneshort="CET" unix="1764025200" usdate="25.11.2025" ustime="00:00" xlsdate="2025-11-25T00:00:00.000">Tue, 25 Nov 2025 00:00:00 +0100</cell>
                    <cell name="time_from" type="time" timezoneshort="CET" ustime="10:30" xlsdate="1900-01-10T10:30:00.000">Wed, 10 Jan 1900 10:30:00 +0100</cell>
                    <cell name="time_to" type="time" timezoneshort="CET" ustime="11:00" xlsdate="1900-01-10T11:00:00.000">Wed, 10 Jan 1900 11:00:00 +0100</cell>
                    <cell name="number" type="number" usnumber="0,50">0.5</cell>
                    <cell name="project" type="text">7607 LAER-Garagenpark-Möchengladbach</cell>
                    <cell name="purpose" type="text">QS und Verand BSK</cell>
                    <cell name="is_client_changed" type="bool">false</cell>
                    <cell name="purpose_internal" type="text"></cell>
                </row>
                <row>
                    <cell name="staff_name" type="text">A. Kokott</cell>
                    <cell name="work_package_name" type="text">Erarbeiten des Brandschutzkonzept/Nachweis/Stellungnahme</cell>
                    <cell name="date" type="date" timezoneshort="CET" unix="1764025200" usdate="25.11.2025" ustime="00:00" xlsdate="2025-11-25T00:00:00.000">Tue, 25 Nov 2025 00:00:00 +0100</cell>
                    <cell name="time_from" type="time" timezoneshort="CET" ustime="09:00" xlsdate="1900-01-10T09:00:00.000">Wed, 10 Jan 1900 09:00:00 +0100</cell>
                    <cell name="time_to" type="time" timezoneshort="CET" ustime="09:30" xlsdate="1900-01-10T09:30:00.000">Wed, 10 Jan 1900 09:30:00 +0100</cell>
                    <cell name="number" type="number" usnumber="0,50">0.5</cell>
                    <cell name="project" type="text">6995 Telehouse-BSK-TDE-RZ-GebN-Kleyerstraße75-89-FFM</cell>
                    <cell name="purpose" type="text">Versand in Original BSK mit Plan</cell>
                    <cell name="is_client_changed" type="bool">false</cell>
                    <cell name="purpose_internal" type="text"></cell>
                </row>
                <row>
                    <cell name="staff_name" type="text">A. Kokott</cell>
                    <cell name="work_package_name" type="text">(p) Pos. 1 ADM</cell>
                    <cell name="date" type="date" timezoneshort="CET" unix="1764111600" usdate="26.11.2025" ustime="00:00" xlsdate="2025-11-26T00:00:00.000">Wed, 26 Nov 2025 00:00:00 +0100</cell>
                    <cell name="time_from" type="time" timezoneshort="CET" ustime="09:00" xlsdate="1900-01-10T09:00:00.000">Wed, 10 Jan 1900 09:00:00 +0100</cell>
                    <cell name="time_to" type="time" timezoneshort="CET" ustime="09:30" xlsdate="1900-01-10T09:30:00.000">Wed, 10 Jan 1900 09:30:00 +0100</cell>
                    <cell name="number" type="number" usnumber="0,50">0.5</cell>
                    <cell name="project" type="text">7355.02 Pfizer-BTB-Aufst-Wärmepumpen-Mooswaldallee-1-Freiburg-Geb-V-H-N</cell>
                    <cell name="purpose" type="text">Versand der beiden BST Wärmep und Kältem.</cell>
                    <cell name="is_client_changed" type="bool">false</cell>
                    <cell name="purpose_internal" type="text"></cell>
                </row>
                <row>
                    <cell name="staff_name" type="text">A. Kokott</cell>
                    <cell name="work_package_name" type="text">Angebote-Ausschreibungen-Kalkulationen (max. 8h/Monat pro MA)</cell>
                    <cell name="date" type="date" timezoneshort="CET" unix="1764111600" usdate="26.11.2025" ustime="00:00" xlsdate="2025-11-26T00:00:00.000">Wed, 26 Nov 2025 00:00:00 +0100</cell>
                    <cell name="time_from" type="time" timezoneshort="CET" ustime="10:00" xlsdate="1900-01-10T10:00:00.000">Wed, 10 Jan 1900 10:00:00 +0100</cell>
                    <cell name="time_to" type="time" timezoneshort="CET" ustime="13:00" xlsdate="1900-01-10T13:00:00.000">Wed, 10 Jan 1900 13:00:00 +0100</cell>
                    <cell name="number" type="number" usnumber="3,00">3</cell>
                    <cell name="project" type="text">0000 Sonderprojekt für Bonus</cell>
                    <cell name="purpose" type="text"></cell>
                    <cell name="is_client_changed" type="bool">false</cell>
                    <cell name="purpose_internal" type="text"></cell>
                </row>
                <rowtotals>
                    <cell name="number" type="number" usnumber="45,75">45.75</cell>
                </rowtotals>
            </values>
            <values for="C. Trapp SV">
                <row>
                    <cell name="staff_name" type="text">C. Trapp SV</cell>
                    <cell name="work_package_name" type="text">8200-Prüfen der Ausführung - system. stichprobenart. Kontrolle (Stufe 2)….</cell>
                    <cell name="date" type="date" timezoneshort="CEST" unix="1759269600" usdate="01.10.2025" ustime="00:00" xlsdate="2025-10-01T00:00:00.000">Wed, 01 Oct 2025 00:00:00 +0200</cell>
                    <cell name="time_from" type="time" timezoneshort="CET" ustime="07:30" xlsdate="1900-01-10T07:30:00.000">Wed, 10 Jan 1900 07:30:00 +0100</cell>
                    <cell name="time_to" type="time" timezoneshort="CET" ustime="17:00" xlsdate="1900-01-10T17:00:00.000">Wed, 10 Jan 1900 17:00:00 +0100</cell>
                    <cell name="number" type="number" usnumber="9,50">9.5</cell>
                    <cell name="project" type="text">5328 Flugfeldklinikum-Böblingen</cell>
                    <cell name="purpose" type="text">Ortstermin</cell>
                    <cell name="is_client_changed" type="bool">false</cell>
                    <cell name="purpose_internal" type="text"></cell>
                </row>
                <row>
                    <cell name="staff_name" type="text">C. Trapp SV</cell>
                    <cell name="work_package_name" type="text">8000-Objektüberwachung</cell>
                    <cell name="date" type="date" timezoneshort="CEST" unix="1759356000" usdate="02.10.2025" ustime="00:00" xlsdate="2025-10-02T00:00:00.000">Thu, 02 Oct 2025 00:00:00 +0200</cell>
                    <cell name="time_from" type="time" timezoneshort="CET" ustime="08:00" xlsdate="1900-01-10T08:00:00.000">Wed, 10 Jan 1900 08:00:00 +0100</cell>
                    <cell name="time_to" type="time" timezoneshort="CET" ustime="16:00" xlsdate="1900-01-10T16:00:00.000">Wed, 10 Jan 1900 16:00:00 +0100</cell>
                    <cell name="number" type="number" usnumber="8,00">8</cell>
                    <cell name="project" type="text">6564.01 ROB-MCR-Weilerbach-Züblin-TP1</cell>
                    <cell name="purpose" type="text">Ortstermin</cell>
                    <cell name="is_client_changed" type="bool">false</cell>
                    <cell name="purpose_internal" type="text"></cell>
                </row>
                <row>
                    <cell name="staff_name" type="text">C. Trapp SV</cell>
                    <cell name="work_package_name" type="text">Erstellung Vorlagen (übergreifend) (max. 8h/Monat pro MA)</cell>
                    <cell name="date" type="date" timezoneshort="CEST" unix="1759442400" usdate="03.10.2025" ustime="00:00" xlsdate="2025-10-03T00:00:00.000">Fri, 03 Oct 2025 00:00:00 +0200</cell>
                    <cell name="time_from" type="time" timezoneshort="CET" ustime="12:00" xlsdate="1900-01-10T12:00:00.000">Wed, 10 Jan 1900 12:00:00 +0100</cell>
                    <cell name="time_to" type="time" timezoneshort="CET" ustime="15:30" xlsdate="1900-01-10T15:30:00.000">Wed, 10 Jan 1900 15:30:00 +0100</cell>
                    <cell name="number" type="number" usnumber="3,50">3.5</cell>
                    <cell name="project" type="text">0000 Sonderprojekt für Bonus</cell>
                    <cell name="purpose" type="text">Aufbau SharePoint</cell>
                    <cell name="is_client_changed" type="bool">false</cell>
                    <cell name="purpose_internal" type="text"></cell>
                </row>
                <row>
                    <cell name="staff_name" type="text">C. Trapp SV</cell>
                    <cell name="work_package_name" type="text">8200-Prüfen der Ausführung - system. stichprobenart. Kontrolle (Stufe 2)….</cell>
                    <cell name="date" type="date" timezoneshort="CEST" unix="1760306400" usdate="13.10.2025" ustime="00:00" xlsdate="2025-10-13T00:00:00.000">Mon, 13 Oct 2025 00:00:00 +0200</cell>
                    <cell name="time_from" type="time" timezoneshort="CET" ustime="08:00" xlsdate="1900-01-10T08:00:00.000">Wed, 10 Jan 1900 08:00:00 +0100</cell>
                    <cell name="time_to" type="time" timezoneshort="CET" ustime="12:00" xlsdate="1900-01-10T12:00:00.000">Wed, 10 Jan 1900 12:00:00 +0100</cell>
                    <cell name="number" type="number" usnumber="4,00">4</cell>
                    <cell name="project" type="text">6643 BTB-FRP-FWP-Ersatzneubau-Krankenhaus-Hohenlohe-Öhringen-Vamed</cell>
                    <cell name="purpose" type="text">Prüfen der Unterlagen sowie Anfragen weiterer Unterlagen </cell>
                    <cell name="is_client_changed" type="bool">false</cell>
                    <cell name="purpose_internal" type="text"></cell>
                </row>
                <row>
                    <cell name="staff_name" type="text">C. Trapp SV</cell>
                    <cell name="work_package_name" type="text">8200-Prüfen der Ausführung - system. stichprobenart. Kontrolle (Stufe 2)….</cell>
                    <cell name="date" type="date" timezoneshort="CEST" unix="1760392800" usdate="14.10.2025" ustime="00:00" xlsdate="2025-10-14T00:00:00.000">Tue, 14 Oct 2025 00:00:00 +0200</cell>
                    <cell name="time_from" type="time" timezoneshort="CET" ustime="07:30" xlsdate="1900-01-10T07:30:00.000">Wed, 10 Jan 1900 07:30:00 +0100</cell>
                    <cell name="time_to" type="time" timezoneshort="CET" ustime="16:00" xlsdate="1900-01-10T16:00:00.000">Wed, 10 Jan 1900 16:00:00 +0100</cell>
                    <cell name="number" type="number" usnumber="8,50">8.5</cell>
                    <cell name="project" type="text">5328 Flugfeldklinikum-Böblingen</cell>
                    <cell name="purpose" type="text">Ortstermin</cell>
                    <cell name="is_client_changed" type="bool">false</cell>
                    <cell name="purpose_internal" type="text"></cell>
                </row>
                <row>
                    <cell name="staff_name" type="text">C. Trapp SV</cell>
                    <cell name="work_package_name" type="text">8000-Objektüberwachung</cell>
                    <cell name="date" type="date" timezoneshort="CEST" unix="1760479200" usdate="15.10.2025" ustime="00:00" xlsdate="2025-10-15T00:00:00.000">Wed, 15 Oct 2025 00:00:00 +0200</cell>
                    <cell name="time_from" type="time" timezoneshort="CET" ustime="08:00" xlsdate="1900-01-10T08:00:00.000">Wed, 10 Jan 1900 08:00:00 +0100</cell>
                    <cell name="time_to" type="time" timezoneshort="CET" ustime="15:30" xlsdate="1900-01-10T15:30:00.000">Wed, 10 Jan 1900 15:30:00 +0100</cell>
                    <cell name="number" type="number" usnumber="7,50">7.5</cell>
                    <cell name="project" type="text">6564.01 ROB-MCR-Weilerbach-Züblin-TP1</cell>
                    <cell name="purpose" type="text">Ortstermin</cell>
                    <cell name="is_client_changed" type="bool">false</cell>
                    <cell name="purpose_internal" type="text"></cell>
                </row>
                <row>
                    <cell name="staff_name" type="text">C. Trapp SV</cell>
                    <cell name="work_package_name" type="text">(aN) 8200-Prüfen der Ausführung - system. stichprobenart. Kontrolle (Stufe 2)….</cell>
                    <cell name="date" type="date" timezoneshort="CEST" unix="1760565600" usdate="16.10.2025" ustime="00:00" xlsdate="2025-10-16T00:00:00.000">Thu, 16 Oct 2025 00:00:00 +0200</cell>
                    <cell name="time_from" type="time" timezoneshort="CET" ustime="08:00" xlsdate="1900-01-10T08:00:00.000">Wed, 10 Jan 1900 08:00:00 +0100</cell>
                    <cell name="time_to" type="time" timezoneshort="CET" ustime="12:30" xlsdate="1900-01-10T12:30:00.000">Wed, 10 Jan 1900 12:30:00 +0100</cell>
                    <cell name="number" type="number" usnumber="4,50">4.5</cell>
                    <cell name="project" type="text">5607.05 BAB-NB-J4-Zentralinstitut-für-seelische-Gesundheit-Mannheim</cell>
                    <cell name="purpose" type="text">Ortstermin</cell>
                    <cell name="is_client_changed" type="bool">false</cell>
                    <cell name="purpose_internal" type="text"></cell>
                </row>
                <row>
                    <cell name="staff_name" type="text">C. Trapp SV</cell>
                    <cell name="work_package_name" type="text">8102-Mitwirken bei Vorbereitung und Teilnahme bei behördlichen Abnahmen….</cell>
                    <cell name="date" type="date" timezoneshort="CEST" unix="1760565600" usdate="16.10.2025" ustime="00:00" xlsdate="2025-10-16T00:00:00.000">Thu, 16 Oct 2025 00:00:00 +0200</cell>
                    <cell name="time_from" type="time" timezoneshort="CET" ustime="13:00" xlsdate="1900-01-10T13:00:00.000">Wed, 10 Jan 1900 13:00:00 +0100</cell>
                    <cell name="time_to" type="time" timezoneshort="CET" ustime="14:00" xlsdate="1900-01-10T14:00:00.000">Wed, 10 Jan 1900 14:00:00 +0100</cell>
                    <cell name="number" type="number" usnumber="1,00">1</cell>
                    <cell name="project" type="text">6643 BTB-FRP-FWP-Ersatzneubau-Krankenhaus-Hohenlohe-Öhringen-Vamed</cell>
                    <cell name="purpose" type="text">Abstimmung Behörde zur Abnahme </cell>
                    <cell name="is_client_changed" type="bool">false</cell>
                    <cell name="purpose_internal" type="text"></cell>
                </row>
                <row>
                    <cell name="staff_name" type="text">C. Trapp SV</cell>
                    <cell name="work_package_name" type="text">Erstellung Vorlagen (übergreifend) (max. 8h/Monat pro MA)</cell>
                    <cell name="date" type="date" timezoneshort="CEST" unix="1760565600" usdate="16.10.2025" ustime="00:00" xlsdate="2025-10-16T00:00:00.000">Thu, 16 Oct 2025 00:00:00 +0200</cell>
                    <cell name="time_from" type="time" timezoneshort="CET" ustime="14:00" xlsdate="1900-01-10T14:00:00.000">Wed, 10 Jan 1900 14:00:00 +0100</cell>
                    <cell name="time_to" type="time" timezoneshort="CET" ustime="16:30" xlsdate="1900-01-10T16:30:00.000">Wed, 10 Jan 1900 16:30:00 +0100</cell>
                    <cell name="number" type="number" usnumber="2,50">2.5</cell>
                    <cell name="project" type="text">0000 Sonderprojekt für Bonus</cell>
                    <cell name="purpose" type="text">Aufbau SharePoint</cell>
                    <cell name="is_client_changed" type="bool">false</cell>
                    <cell name="purpose_internal" type="text"></cell>
                </row>
                <row>
                    <cell name="staff_name" type="text">C. Trapp SV</cell>
                    <cell name="work_package_name" type="text">(aN) 8200-Prüfen der Ausführung - system. stichprobenart. Kontrolle (Stufe 2)….</cell>
                    <cell name="date" type="date" timezoneshort="CEST" unix="1760652000" usdate="17.10.2025" ustime="00:00" xlsdate="2025-10-17T00:00:00.000">Fri, 17 Oct 2025 00:00:00 +0200</cell>
                    <cell name="time_from" type="time" timezoneshort="CET" ustime="11:00" xlsdate="1900-01-10T11:00:00.000">Wed, 10 Jan 1900 11:00:00 +0100</cell>
                    <cell name="time_to" type="time" timezoneshort="CET" ustime="11:30" xlsdate="1900-01-10T11:30:00.000">Wed, 10 Jan 1900 11:30:00 +0100</cell>
                    <cell name="number" type="number" usnumber="0,50">0.5</cell>
                    <cell name="project" type="text">5607.05 BAB-NB-J4-Zentralinstitut-für-seelische-Gesundheit-Mannheim</cell>
                    <cell name="purpose" type="text">Abstimmungen Schottungen </cell>
                    <cell name="is_client_changed" type="bool">false</cell>
                    <cell name="purpose_internal" type="text"></cell>
                </row>
                <row>
                    <cell name="staff_name" type="text">C. Trapp SV</cell>
                    <cell name="work_package_name" type="text">Einarbeitung neuer Mitarbeiter (max. 8h/Monat pro MA)</cell>
                    <cell name="date" type="date" timezoneshort="CEST" unix="1760652000" usdate="17.10.2025" ustime="00:00" xlsdate="2025-10-17T00:00:00.000">Fri, 17 Oct 2025 00:00:00 +0200</cell>
                    <cell name="time_from" type="time" timezoneshort="CET" ustime="09:30" xlsdate="1900-01-10T09:30:00.000">Wed, 10 Jan 1900 09:30:00 +0100</cell>
                    <cell name="time_to" type="time" timezoneshort="CET" ustime="15:30" xlsdate="1900-01-10T15:30:00.000">Wed, 10 Jan 1900 15:30:00 +0100</cell>
                    <cell name="number" type="number" usnumber="6,00">6</cell>
                    <cell name="project" type="text">0000 Sonderprojekt für Bonus</cell>
                    <cell name="purpose" type="text">Einarbeitung Steven </cell>
                    <cell name="is_client_changed" type="bool">false</cell>
                    <cell name="purpose_internal" type="text"></cell>
                </row>
                <row>
                    <cell name="staff_name" type="text">C. Trapp SV</cell>
                    <cell name="work_package_name" type="text">8200-Prüfen der Ausführung - system. stichprobenart. Kontrolle (Stufe 2)….</cell>
                    <cell name="date" type="date" timezoneshort="CEST" unix="1760911200" usdate="20.10.2025" ustime="00:00" xlsdate="2025-10-20T00:00:00.000">Mon, 20 Oct 2025 00:00:00 +0200</cell>
                    <cell name="time_from" type="time" timezoneshort="CET" ustime="08:00" xlsdate="1900-01-10T08:00:00.000">Wed, 10 Jan 1900 08:00:00 +0100</cell>
                    <cell name="time_to" type="time" timezoneshort="CET" ustime="12:00" xlsdate="1900-01-10T12:00:00.000">Wed, 10 Jan 1900 12:00:00 +0100</cell>
                    <cell name="number" type="number" usnumber="4,00">4</cell>
                    <cell name="project" type="text">6643 BTB-FRP-FWP-Ersatzneubau-Krankenhaus-Hohenlohe-Öhringen-Vamed</cell>
                    <cell name="purpose" type="text">Prüfen der Unterlagen sowie Anfragen weiterer Unterlagen </cell>
                    <cell name="is_client_changed" type="bool">false</cell>
                    <cell name="purpose_internal" type="text"></cell>
                </row>
                <row>
                    <cell name="staff_name" type="text">C. Trapp SV</cell>
                    <cell name="work_package_name" type="text">Erstellung Vorlagen (übergreifend) (max. 8h/Monat pro MA)</cell>
                    <cell name="date" type="date" timezoneshort="CEST" unix="1760911200" usdate="20.10.2025" ustime="00:00" xlsdate="2025-10-20T00:00:00.000">Mon, 20 Oct 2025 00:00:00 +0200</cell>
                    <cell name="time_from" type="time" timezoneshort="CET" ustime="12:00" xlsdate="1900-01-10T12:00:00.000">Wed, 10 Jan 1900 12:00:00 +0100</cell>
                    <cell name="time_to" type="time" timezoneshort="CET" ustime="16:00" xlsdate="1900-01-10T16:00:00.000">Wed, 10 Jan 1900 16:00:00 +0100</cell>
                    <cell name="number" type="number" usnumber="4,00">4</cell>
                    <cell name="project" type="text">0000 Sonderprojekt für Bonus</cell>
                    <cell name="purpose" type="text">Aufbau SharePoint</cell>
                    <cell name="is_client_changed" type="bool">false</cell>
                    <cell name="purpose_internal" type="text"></cell>
                </row>
                <row>
                    <cell name="staff_name" type="text">C. Trapp SV</cell>
                    <cell name="work_package_name" type="text">(aN) 8200-Prüfen der Ausführung - system. stichprobenart. Kontrolle (Stufe 2)….</cell>
                    <cell name="date" type="date" timezoneshort="CEST" unix="1760997600" usdate="21.10.2025" ustime="00:00" xlsdate="2025-10-21T00:00:00.000">Tue, 21 Oct 2025 00:00:00 +0200</cell>
                    <cell name="time_from" type="time" timezoneshort="CET" ustime="09:00" xlsdate="1900-01-10T09:00:00.000">Wed, 10 Jan 1900 09:00:00 +0100</cell>
                    <cell name="time_to" type="time" timezoneshort="CET" ustime="15:00" xlsdate="1900-01-10T15:00:00.000">Wed, 10 Jan 1900 15:00:00 +0100</cell>
                    <cell name="number" type="number" usnumber="6,00">6</cell>
                    <cell name="project" type="text">5607.05 BAB-NB-J4-Zentralinstitut-für-seelische-Gesundheit-Mannheim</cell>
                    <cell name="purpose" type="text">Ortstermin und Abstimmung Fa. Wagner</cell>
                    <cell name="is_client_changed" type="bool">false</cell>
                    <cell name="purpose_internal" type="text"></cell>
                </row>
                <row>
                    <cell name="staff_name" type="text">C. Trapp SV</cell>
                    <cell name="work_package_name" type="text">8200-Prüfen der Ausführung - system. stichprobenart. Kontrolle (Stufe 2)….</cell>
                    <cell name="date" type="date" timezoneshort="CET" unix="1761519600" usdate="27.10.2025" ustime="00:00" xlsdate="2025-10-27T00:00:00.000">Mon, 27 Oct 2025 00:00:00 +0100</cell>
                    <cell name="time_from" type="time" timezoneshort="CET" ustime="08:00" xlsdate="1900-01-10T08:00:00.000">Wed, 10 Jan 1900 08:00:00 +0100</cell>
                    <cell name="time_to" type="time" timezoneshort="CET" ustime="12:00" xlsdate="1900-01-10T12:00:00.000">Wed, 10 Jan 1900 12:00:00 +0100</cell>
                    <cell name="number" type="number" usnumber="4,00">4</cell>
                    <cell name="project" type="text">6643 BTB-FRP-FWP-Ersatzneubau-Krankenhaus-Hohenlohe-Öhringen-Vamed</cell>
                    <cell name="purpose" type="text">Prüfen der Unterlagen sowie Anfragen weiterer Unterlagen </cell>
                    <cell name="is_client_changed" type="bool">false</cell>
                    <cell name="purpose_internal" type="text"></cell>
                </row>
                <row>
                    <cell name="staff_name" type="text">C. Trapp SV</cell>
                    <cell name="work_package_name" type="text">8200-Prüfen der Ausführung - system. stichprobenart. Kontrolle (Stufe 2)….</cell>
                    <cell name="date" type="date" timezoneshort="CET" unix="1761606000" usdate="28.10.2025" ustime="00:00" xlsdate="2025-10-28T00:00:00.000">Tue, 28 Oct 2025 00:00:00 +0100</cell>
                    <cell name="time_from" type="time" timezoneshort="CET" ustime="07:30" xlsdate="1900-01-10T07:30:00.000">Wed, 10 Jan 1900 07:30:00 +0100</cell>
                    <cell name="time_to" type="time" timezoneshort="CET" ustime="16:30" xlsdate="1900-01-10T16:30:00.000">Wed, 10 Jan 1900 16:30:00 +0100</cell>
                    <cell name="number" type="number" usnumber="9,00">9</cell>
                    <cell name="project" type="text">5328 Flugfeldklinikum-Böblingen</cell>
                    <cell name="purpose" type="text">Ortstermin</cell>
                    <cell name="is_client_changed" type="bool">false</cell>
                    <cell name="purpose_internal" type="text"></cell>
                </row>
                <row>
                    <cell name="staff_name" type="text">C. Trapp SV</cell>
                    <cell name="work_package_name" type="text">8305-Beratungsleistungen bei Sonderdetails in der Ausführung....</cell>
                    <cell name="date" type="date" timezoneshort="CET" unix="1761692400" usdate="29.10.2025" ustime="00:00" xlsdate="2025-10-29T00:00:00.000">Wed, 29 Oct 2025 00:00:00 +0100</cell>
                    <cell name="time_from" type="time" timezoneshort="CET" ustime="08:30" xlsdate="1900-01-10T08:30:00.000">Wed, 10 Jan 1900 08:30:00 +0100</cell>
                    <cell name="time_to" type="time" timezoneshort="CET" ustime="11:30" xlsdate="1900-01-10T11:30:00.000">Wed, 10 Jan 1900 11:30:00 +0100</cell>
                    <cell name="number" type="number" usnumber="3,00">3</cell>
                    <cell name="project" type="text">6643 BTB-FRP-FWP-Ersatzneubau-Krankenhaus-Hohenlohe-Öhringen-Vamed</cell>
                    <cell name="purpose" type="text">Erarbeiten Stellungnahme Tronsoldämmung Treppenräume&#13;
Abstimmung mit H-K</cell>
                    <cell name="is_client_changed" type="bool">false</cell>
                    <cell name="purpose_internal" type="text"></cell>
                </row>
                <row>
                    <cell name="staff_name" type="text">C. Trapp SV</cell>
                    <cell name="work_package_name" type="text">8305-Beratungsleistungen bei Sonderdetails in der Ausführung....</cell>
                    <cell name="date" type="date" timezoneshort="CET" unix="1761692400" usdate="29.10.2025" ustime="00:00" xlsdate="2025-10-29T00:00:00.000">Wed, 29 Oct 2025 00:00:00 +0100</cell>
                    <cell name="time_from" type="time" timezoneshort="CET" ustime="14:30" xlsdate="1900-01-10T14:30:00.000">Wed, 10 Jan 1900 14:30:00 +0100</cell>
                    <cell name="time_to" type="time" timezoneshort="CET" ustime="16:30" xlsdate="1900-01-10T16:30:00.000">Wed, 10 Jan 1900 16:30:00 +0100</cell>
                    <cell name="number" type="number" usnumber="2,00">2</cell>
                    <cell name="project" type="text">6643 BTB-FRP-FWP-Ersatzneubau-Krankenhaus-Hohenlohe-Öhringen-Vamed</cell>
                    <cell name="purpose" type="text">Erstellen Stellungnahme </cell>
                    <cell name="is_client_changed" type="bool">false</cell>
                    <cell name="purpose_internal" type="text"></cell>
                </row>
                <row>
                    <cell name="staff_name" type="text">C. Trapp SV</cell>
                    <cell name="work_package_name" type="text">8000-Objektüberwachung</cell>
                    <cell name="date" type="date" timezoneshort="CET" unix="1761778800" usdate="30.10.2025" ustime="00:00" xlsdate="2025-10-30T00:00:00.000">Thu, 30 Oct 2025 00:00:00 +0100</cell>
                    <cell name="time_from" type="time" timezoneshort="CET" ustime="07:00" xlsdate="1900-01-10T07:00:00.000">Wed, 10 Jan 1900 07:00:00 +0100</cell>
                    <cell name="time_to" type="time" timezoneshort="CET" ustime="16:30" xlsdate="1900-01-10T16:30:00.000">Wed, 10 Jan 1900 16:30:00 +0100</cell>
                    <cell name="number" type="number" usnumber="9,50">9.5</cell>
                    <cell name="project" type="text">6564.01 ROB-MCR-Weilerbach-Züblin-TP1</cell>
                    <cell name="purpose" type="text">Ortstermin</cell>
                    <cell name="is_client_changed" type="bool">false</cell>
                    <cell name="purpose_internal" type="text"></cell>
                </row>
                <row>
                    <cell name="staff_name" type="text">C. Trapp SV</cell>
                    <cell name="work_package_name" type="text">8305-Beratungsleistungen bei Sonderdetails in der Ausführung....</cell>
                    <cell name="date" type="date" timezoneshort="CET" unix="1761865200" usdate="31.10.2025" ustime="00:00" xlsdate="2025-10-31T00:00:00.000">Fri, 31 Oct 2025 00:00:00 +0100</cell>
                    <cell name="time_from" type="time" timezoneshort="CET" ustime="08:30" xlsdate="1900-01-10T08:30:00.000">Wed, 10 Jan 1900 08:30:00 +0100</cell>
                    <cell name="time_to" type="time" timezoneshort="CET" ustime="14:00" xlsdate="1900-01-10T14:00:00.000">Wed, 10 Jan 1900 14:00:00 +0100</cell>
                    <cell name="number" type="number" usnumber="5,50">5.5</cell>
                    <cell name="project" type="text">6643 BTB-FRP-FWP-Ersatzneubau-Krankenhaus-Hohenlohe-Öhringen-Vamed</cell>
                    <cell name="purpose" type="text">Abstimmung Baubehörde und bearbeiten Stellungnahme Tronsoldämmung Treppenräume</cell>
                    <cell name="is_client_changed" type="bool">false</cell>
                    <cell name="purpose_internal" type="text"></cell>
                </row>
                <row>
                    <cell name="staff_name" type="text">C. Trapp SV</cell>
                    <cell name="work_package_name" type="text">8103-Prüfen Plausibilität der Sachverständigennachweise auf Schnittstellen….</cell>
